[INFO] Scanning for projects...
[INFO] 
[INFO] ---------------------< jvms-compare:jvms-compare >----------------------
[INFO] Building JVMs Compare 1.0.0
[INFO] --------------------------------[ jar ]---------------------------------
[INFO] 
[INFO] --- maven-clean-plugin:2.5:clean (default-clean) @ jvms-compare ---
[INFO] Deleting /Users/cguntur/projects/conf/jvms-compare/target
[INFO] 
[INFO] --- maven-toolchains-plugin:1.1:toolchain (default) @ jvms-compare ---
[INFO] Required toolchain: jdk [ vendor='oracle' version='11' ]
[INFO] Found matching toolchain for type jdk: JDK[/Library/Java/JavaVirtualMachines/oraclejdk-11.0.6.jdk/Contents/Home/]
[INFO] 
[INFO] --- maven-dependency-plugin:3.1.1:build-classpath (build-classpath) @ jvms-compare ---
[INFO] Dependencies classpath:
/Users/cguntur/.m2/repository/org/apache/commons/commons-math3/3.2/commons-math3-3.2.jar:/Users/cguntur/.m2/repository/org/junit/jupiter/junit-jupiter-api/5.5.0/junit-jupiter-api-5.5.0.jar:/Users/cguntur/.m2/repository/org/eclipse/collections/eclipse-collections/10.0.0/eclipse-collections-10.0.0.jar:/Users/cguntur/.m2/repository/org/junit/platform/junit-platform-engine/1.5.0/junit-platform-engine-1.5.0.jar:/Users/cguntur/.m2/repository/org/junit/platform/junit-platform-commons/1.5.0/junit-platform-commons-1.5.0.jar:/Users/cguntur/.m2/repository/org/junit/jupiter/junit-jupiter-params/5.5.0/junit-jupiter-params-5.5.0.jar:/Users/cguntur/.m2/repository/org/junit/jupiter/junit-jupiter-engine/5.5.0/junit-jupiter-engine-5.5.0.jar:/Users/cguntur/.m2/repository/org/junit/jupiter/junit-jupiter/5.5.0/junit-jupiter-5.5.0.jar:/Users/cguntur/.m2/repository/org/opentest4j/opentest4j/1.2.0/opentest4j-1.2.0.jar:/Users/cguntur/.m2/repository/org/openjdk/jmh/jmh-core/1.23/jmh-core-1.23.jar:/Users/cguntur/.m2/repository/org/apiguardian/apiguardian-api/1.1.0/apiguardian-api-1.1.0.jar:/Users/cguntur/.m2/repository/net/sf/jopt-simple/jopt-simple/4.6/jopt-simple-4.6.jar:/Users/cguntur/.m2/repository/org/eclipse/collections/eclipse-collections-api/10.0.0/eclipse-collections-api-10.0.0.jar
[INFO] 
[INFO] --- maven-resources-plugin:2.6:resources (default-resources) @ jvms-compare ---
[INFO] Using 'UTF-8' encoding to copy filtered resources.
[INFO] Copying 1 resource
[INFO] 
[INFO] --- maven-compiler-plugin:3.8.1:compile (default-compile) @ jvms-compare ---
[INFO] Toolchain in maven-compiler-plugin: JDK[/Library/Java/JavaVirtualMachines/oraclejdk-11.0.6.jdk/Contents/Home/]
[INFO] Changes detected - recompiling the module!
[INFO] Compiling 10 source files to /Users/cguntur/projects/conf/jvms-compare/target/classes
[INFO] 
[INFO] --- maven-resources-plugin:2.6:testResources (default-testResources) @ jvms-compare ---
[INFO] Using 'UTF-8' encoding to copy filtered resources.
[INFO] Copying 1 resource
[INFO] 
[INFO] --- maven-compiler-plugin:3.8.1:testCompile (default-testCompile) @ jvms-compare ---
[INFO] Toolchain in maven-compiler-plugin: JDK[/Library/Java/JavaVirtualMachines/oraclejdk-11.0.6.jdk/Contents/Home/]
[INFO] Changes detected - recompiling the module!
[INFO] Compiling 2 source files to /Users/cguntur/projects/conf/jvms-compare/target/test-classes
[INFO] 
[INFO] --- maven-surefire-plugin:2.12.4:test (default-test) @ jvms-compare ---
[INFO] Toolchain in surefire-plugin: JDK[/Library/Java/JavaVirtualMachines/oraclejdk-11.0.6.jdk/Contents/Home/]
[INFO] Surefire report directory: /Users/cguntur/projects/conf/jvms-compare/target/surefire-reports

-------------------------------------------------------
 T E S T S
-------------------------------------------------------
Running jvmscompare.PersonTest
Tests run: 3, Failures: 0, Errors: 0, Skipped: 0, Time elapsed: 1.466 sec
Running jvmscompare.IntListTest
Tests run: 3, Failures: 0, Errors: 0, Skipped: 0, Time elapsed: 1.356 sec

Results :

Tests run: 6, Failures: 0, Errors: 0, Skipped: 0

[INFO] 
[INFO] --- exec-maven-plugin:1.6.0:exec (combinedSummaryStats) @ jvms-compare ---
[INFO] Toolchain in exec-maven-plugin: JDK[/Library/Java/JavaVirtualMachines/oraclejdk-11.0.6.jdk/Contents/Home/]
Java Runtime Environment version: 11.0.6
Java Runtime Environment vendor: Oracle Corporation

Java Runtime Name: Java(TM) SE Runtime Environment
Java Runtime Version: 11.0.6+8-LTS

Java Virtual Machine name: anonymous
Java Virtual Machine vendor: Oracle Corporation
Java Virtual Machine version: 11.0.6+8-LTS

Java Class Version: 55.0

Benchmark size: 1000
Benchmark forks: 2
Benchmark warmups: 20
Benchmark measurements: 10

WARNING: An illegal reflective access operation has occurred
WARNING: Illegal reflective access by org.openjdk.jmh.util.Utils (file:/Users/cguntur/.m2/repository/org/openjdk/jmh/jmh-core/1.23/jmh-core-1.23.jar) to field java.io.PrintStream.charOut
WARNING: Please consider reporting this to the maintainers of org.openjdk.jmh.util.Utils
WARNING: Use --illegal-access=warn to enable warnings of further illegal reflective access operations
WARNING: All illegal access operations will be denied in a future release
# JMH version: 1.23
# VM version: JDK 11.0.6, anonymous, 11.0.6+8-LTS
# *** WARNING: This VM is not supported by JMH. The produced benchmark data can be completely wrong.
# VM invoker: /Library/Java/JavaVirtualMachines/oraclejdk-11.0.6.jdk/Contents/Home/bin/java
# VM options: <none>
# Warmup: 20 iterations, 10 s each
# Measurement: 10 iterations, 10 s each
# Timeout: 10 min per iteration
# Threads: 1 thread, will synchronize iterations
# Benchmark mode: Throughput, ops/time
# Benchmark: jvmscompare.benchmark.PersonCombinedSummaryStats.combinedStatistics_EC_Eager_Serial

WARNING: Not a HotSpot compiler command compatible VM ("anonymous-11.0.6"), compilerHints are disabled.
# Run progress: 0.00% complete, ETA 00:50:00
# Fork: 1 of 2
# Warmup Iteration   1: 42547.293 ops/s
# Warmup Iteration   2: 44772.320 ops/s
# Warmup Iteration   3: 44655.323 ops/s
# Warmup Iteration   4: 44620.262 ops/s
# Warmup Iteration   5: 44602.699 ops/s
# Warmup Iteration   6: 44598.040 ops/s
# Warmup Iteration   7: 44689.574 ops/s
# Warmup Iteration   8: 44684.886 ops/s
# Warmup Iteration   9: 44659.060 ops/s
# Warmup Iteration  10: 44832.444 ops/s
# Warmup Iteration  11: 44765.130 ops/s
# Warmup Iteration  12: 44627.528 ops/s
# Warmup Iteration  13: 44675.149 ops/s
# Warmup Iteration  14: 44634.883 ops/s
# Warmup Iteration  15: 44668.829 ops/s
# Warmup Iteration  16: 44708.117 ops/s
# Warmup Iteration  17: 45220.232 ops/s
# Warmup Iteration  18: 45192.924 ops/s
# Warmup Iteration  19: 45270.494 ops/s
# Warmup Iteration  20: 45250.336 ops/s
Iteration   1: 45228.069 ops/s
Iteration   2: 45240.875 ops/s
Iteration   3: 45181.006 ops/s
Iteration   4: 45186.939 ops/s
Iteration   5: 45208.068 ops/s
Iteration   6: 45295.523 ops/s
Iteration   7: 45260.034 ops/s
Iteration   8: 45294.106 ops/s
Iteration   9: 45265.146 ops/s
Iteration  10: 45246.862 ops/s

WARNING: Not a HotSpot compiler command compatible VM ("anonymous-11.0.6"), compilerHints are disabled.
# Run progress: 10.00% complete, ETA 00:45:06
# Fork: 2 of 2
# Warmup Iteration   1: 90126.466 ops/s
# Warmup Iteration   2: 95358.197 ops/s
# Warmup Iteration   3: 95520.008 ops/s
# Warmup Iteration   4: 95660.386 ops/s
# Warmup Iteration   5: 95654.575 ops/s
# Warmup Iteration   6: 95651.641 ops/s
# Warmup Iteration   7: 95722.128 ops/s
# Warmup Iteration   8: 95718.124 ops/s
# Warmup Iteration   9: 95774.135 ops/s
# Warmup Iteration  10: 95843.938 ops/s
# Warmup Iteration  11: 95731.587 ops/s
# Warmup Iteration  12: 95787.699 ops/s
# Warmup Iteration  13: 95504.804 ops/s
# Warmup Iteration  14: 95351.264 ops/s
# Warmup Iteration  15: 95834.820 ops/s
# Warmup Iteration  16: 95813.953 ops/s
# Warmup Iteration  17: 95845.687 ops/s
# Warmup Iteration  18: 95870.340 ops/s
# Warmup Iteration  19: 95924.730 ops/s
# Warmup Iteration  20: 95846.100 ops/s
Iteration   1: 95643.603 ops/s
Iteration   2: 95858.018 ops/s
Iteration   3: 95870.744 ops/s
Iteration   4: 95848.319 ops/s
Iteration   5: 95894.485 ops/s
Iteration   6: 95830.091 ops/s
Iteration   7: 95845.368 ops/s
Iteration   8: 95860.428 ops/s
Iteration   9: 95809.770 ops/s
Iteration  10: 95816.473 ops/s


Result "jvmscompare.benchmark.PersonCombinedSummaryStats.combinedStatistics_EC_Eager_Serial":
  70534.196 ±(99.9%) 22534.424 ops/s [Average]
  (min, avg, max) = (45181.006, 70534.196, 95894.485), stdev = 25950.677
  CI (99.9%): [47999.772, 93068.621] (assumes normal distribution)


# JMH version: 1.23
# VM version: JDK 11.0.6, anonymous, 11.0.6+8-LTS
# *** WARNING: This VM is not supported by JMH. The produced benchmark data can be completely wrong.
# VM invoker: /Library/Java/JavaVirtualMachines/oraclejdk-11.0.6.jdk/Contents/Home/bin/java
# VM options: <none>
# Warmup: 20 iterations, 10 s each
# Measurement: 10 iterations, 10 s each
# Timeout: 10 min per iteration
# Threads: 1 thread, will synchronize iterations
# Benchmark mode: Throughput, ops/time
# Benchmark: jvmscompare.benchmark.PersonCombinedSummaryStats.combinedStatistics_EC_Lazy_Serial

WARNING: Not a HotSpot compiler command compatible VM ("anonymous-11.0.6"), compilerHints are disabled.
# Run progress: 20.00% complete, ETA 00:40:05
# Fork: 1 of 2
# Warmup Iteration   1: 82839.086 ops/s
# Warmup Iteration   2: 91097.517 ops/s
# Warmup Iteration   3: 91103.372 ops/s
# Warmup Iteration   4: 91103.175 ops/s
# Warmup Iteration   5: 91097.976 ops/s
# Warmup Iteration   6: 90952.668 ops/s
# Warmup Iteration   7: 91138.264 ops/s
# Warmup Iteration   8: 91127.924 ops/s
# Warmup Iteration   9: 91042.702 ops/s
# Warmup Iteration  10: 91133.369 ops/s
# Warmup Iteration  11: 91150.277 ops/s
# Warmup Iteration  12: 91152.997 ops/s
# Warmup Iteration  13: 91194.042 ops/s
# Warmup Iteration  14: 91078.585 ops/s
# Warmup Iteration  15: 91000.217 ops/s
# Warmup Iteration  16: 91204.391 ops/s
# Warmup Iteration  17: 91124.986 ops/s
# Warmup Iteration  18: 91084.574 ops/s
# Warmup Iteration  19: 91176.712 ops/s
# Warmup Iteration  20: 90877.208 ops/s
Iteration   1: 91107.985 ops/s
Iteration   2: 91177.687 ops/s
Iteration   3: 91032.287 ops/s
Iteration   4: 91160.511 ops/s
Iteration   5: 91177.340 ops/s
Iteration   6: 91150.823 ops/s
Iteration   7: 91089.005 ops/s
Iteration   8: 91217.134 ops/s
Iteration   9: 91046.877 ops/s
Iteration  10: 90881.331 ops/s

WARNING: Not a HotSpot compiler command compatible VM ("anonymous-11.0.6"), compilerHints are disabled.
# Run progress: 30.00% complete, ETA 00:35:04
# Fork: 2 of 2
# Warmup Iteration   1: 86260.295 ops/s
# Warmup Iteration   2: 93799.681 ops/s
# Warmup Iteration   3: 93896.075 ops/s
# Warmup Iteration   4: 94049.795 ops/s
# Warmup Iteration   5: 93259.929 ops/s
# Warmup Iteration   6: 93845.134 ops/s
# Warmup Iteration   7: 94060.111 ops/s
# Warmup Iteration   8: 94115.218 ops/s
# Warmup Iteration   9: 94000.419 ops/s
# Warmup Iteration  10: 94076.332 ops/s
# Warmup Iteration  11: 94065.748 ops/s
# Warmup Iteration  12: 94046.868 ops/s
# Warmup Iteration  13: 93663.865 ops/s
# Warmup Iteration  14: 93603.066 ops/s
# Warmup Iteration  15: 94058.424 ops/s
# Warmup Iteration  16: 94096.271 ops/s
# Warmup Iteration  17: 94142.666 ops/s
# Warmup Iteration  18: 94202.125 ops/s
# Warmup Iteration  19: 93869.466 ops/s
# Warmup Iteration  20: 94422.943 ops/s
Iteration   1: 94228.387 ops/s
Iteration   2: 94252.890 ops/s
Iteration   3: 94337.563 ops/s
Iteration   4: 94255.912 ops/s
Iteration   5: 94346.245 ops/s
Iteration   6: 94230.759 ops/s
Iteration   7: 94285.330 ops/s
Iteration   8: 94330.249 ops/s
Iteration   9: 94347.298 ops/s
Iteration  10: 94258.934 ops/s


Result "jvmscompare.benchmark.PersonCombinedSummaryStats.combinedStatistics_EC_Lazy_Serial":
  92695.727 ±(99.9%) 1419.520 ops/s [Average]
  (min, avg, max) = (90881.331, 92695.727, 94347.298), stdev = 1634.722
  CI (99.9%): [91276.207, 94115.248] (assumes normal distribution)


# JMH version: 1.23
# VM version: JDK 11.0.6, anonymous, 11.0.6+8-LTS
# *** WARNING: This VM is not supported by JMH. The produced benchmark data can be completely wrong.
# VM invoker: /Library/Java/JavaVirtualMachines/oraclejdk-11.0.6.jdk/Contents/Home/bin/java
# VM options: <none>
# Warmup: 20 iterations, 10 s each
# Measurement: 10 iterations, 10 s each
# Timeout: 10 min per iteration
# Threads: 1 thread, will synchronize iterations
# Benchmark mode: Throughput, ops/time
# Benchmark: jvmscompare.benchmark.PersonCombinedSummaryStats.combinedStatistics_EC_Stream_Parallel

WARNING: Not a HotSpot compiler command compatible VM ("anonymous-11.0.6"), compilerHints are disabled.
# Run progress: 40.00% complete, ETA 00:30:03
# Fork: 1 of 2
# Warmup Iteration   1: 10981.694 ops/s
# Warmup Iteration   2: 10853.252 ops/s
# Warmup Iteration   3: 10839.747 ops/s
# Warmup Iteration   4: 10853.302 ops/s
# Warmup Iteration   5: 11099.439 ops/s
# Warmup Iteration   6: 10865.543 ops/s
# Warmup Iteration   7: 10857.304 ops/s
# Warmup Iteration   8: 10842.783 ops/s
# Warmup Iteration   9: 10848.442 ops/s
# Warmup Iteration  10: 10858.518 ops/s
# Warmup Iteration  11: 11064.876 ops/s
# Warmup Iteration  12: 10903.106 ops/s
# Warmup Iteration  13: 10834.668 ops/s
# Warmup Iteration  14: 11348.193 ops/s
# Warmup Iteration  15: 12949.446 ops/s
# Warmup Iteration  16: 11110.795 ops/s
# Warmup Iteration  17: 10866.502 ops/s
# Warmup Iteration  18: 10881.243 ops/s
# Warmup Iteration  19: 10930.573 ops/s
# Warmup Iteration  20: 11271.255 ops/s
Iteration   1: 10880.811 ops/s
Iteration   2: 10851.377 ops/s
Iteration   3: 10858.197 ops/s
Iteration   4: 10845.004 ops/s
Iteration   5: 10879.050 ops/s
Iteration   6: 11088.679 ops/s
Iteration   7: 11159.203 ops/s
Iteration   8: 10910.005 ops/s
Iteration   9: 11203.423 ops/s
Iteration  10: 10859.242 ops/s

WARNING: Not a HotSpot compiler command compatible VM ("anonymous-11.0.6"), compilerHints are disabled.
# Run progress: 50.00% complete, ETA 00:25:02
# Fork: 2 of 2
# Warmup Iteration   1: 11860.810 ops/s
# Warmup Iteration   2: 11470.726 ops/s
# Warmup Iteration   3: 11522.887 ops/s
# Warmup Iteration   4: 11539.916 ops/s
# Warmup Iteration   5: 11552.251 ops/s
# Warmup Iteration   6: 11804.773 ops/s
# Warmup Iteration   7: 12039.767 ops/s
# Warmup Iteration   8: 11470.000 ops/s
# Warmup Iteration   9: 11840.904 ops/s
# Warmup Iteration  10: 11846.770 ops/s
# Warmup Iteration  11: 11773.167 ops/s
# Warmup Iteration  12: 11512.751 ops/s
# Warmup Iteration  13: 11618.585 ops/s
# Warmup Iteration  14: 11474.467 ops/s
# Warmup Iteration  15: 11792.667 ops/s
# Warmup Iteration  16: 11529.760 ops/s
# Warmup Iteration  17: 12240.150 ops/s
# Warmup Iteration  18: 11496.729 ops/s
# Warmup Iteration  19: 11482.042 ops/s
# Warmup Iteration  20: 11479.865 ops/s
Iteration   1: 11723.680 ops/s
Iteration   2: 11488.232 ops/s
Iteration   3: 11913.789 ops/s
Iteration   4: 11479.285 ops/s
Iteration   5: 11484.379 ops/s
Iteration   6: 12359.692 ops/s
Iteration   7: 11729.090 ops/s
Iteration   8: 11484.898 ops/s
Iteration   9: 11502.306 ops/s
Iteration  10: 12171.424 ops/s


Result "jvmscompare.benchmark.PersonCombinedSummaryStats.combinedStatistics_EC_Stream_Parallel":
  11343.588 ±(99.9%) 405.241 ops/s [Average]
  (min, avg, max) = (10845.004, 11343.588, 12359.692), stdev = 466.676
  CI (99.9%): [10938.348, 11748.829] (assumes normal distribution)


# JMH version: 1.23
# VM version: JDK 11.0.6, anonymous, 11.0.6+8-LTS
# *** WARNING: This VM is not supported by JMH. The produced benchmark data can be completely wrong.
# VM invoker: /Library/Java/JavaVirtualMachines/oraclejdk-11.0.6.jdk/Contents/Home/bin/java
# VM options: <none>
# Warmup: 20 iterations, 10 s each
# Measurement: 10 iterations, 10 s each
# Timeout: 10 min per iteration
# Threads: 1 thread, will synchronize iterations
# Benchmark mode: Throughput, ops/time
# Benchmark: jvmscompare.benchmark.PersonCombinedSummaryStats.combinedStatistics_JDK_Stream_Parallel

WARNING: Not a HotSpot compiler command compatible VM ("anonymous-11.0.6"), compilerHints are disabled.
# Run progress: 60.00% complete, ETA 00:20:02
# Fork: 1 of 2
# Warmup Iteration   1: 9176.802 ops/s
# Warmup Iteration   2: 9879.289 ops/s
# Warmup Iteration   3: 9411.915 ops/s
# Warmup Iteration   4: 9386.004 ops/s
# Warmup Iteration   5: 9391.129 ops/s
# Warmup Iteration   6: 11003.885 ops/s
# Warmup Iteration   7: 9401.960 ops/s
# Warmup Iteration   8: 9466.095 ops/s
# Warmup Iteration   9: 9976.081 ops/s
# Warmup Iteration  10: 9401.812 ops/s
# Warmup Iteration  11: 9393.112 ops/s
# Warmup Iteration  12: 9387.322 ops/s
# Warmup Iteration  13: 9383.238 ops/s
# Warmup Iteration  14: 9539.015 ops/s
# Warmup Iteration  15: 9783.126 ops/s
# Warmup Iteration  16: 9566.111 ops/s
# Warmup Iteration  17: 9529.410 ops/s
# Warmup Iteration  18: 9454.871 ops/s
# Warmup Iteration  19: 9411.458 ops/s
# Warmup Iteration  20: 9436.488 ops/s
Iteration   1: 9404.992 ops/s
Iteration   2: 9400.779 ops/s
Iteration   3: 9429.515 ops/s
Iteration   4: 9407.539 ops/s
Iteration   5: 9577.607 ops/s
Iteration   6: 9445.689 ops/s
Iteration   7: 9757.605 ops/s
Iteration   8: 9408.457 ops/s
Iteration   9: 9423.263 ops/s
Iteration  10: 9402.959 ops/s

WARNING: Not a HotSpot compiler command compatible VM ("anonymous-11.0.6"), compilerHints are disabled.
# Run progress: 70.00% complete, ETA 00:15:01
# Fork: 2 of 2
# Warmup Iteration   1: 12065.347 ops/s
# Warmup Iteration   2: 11024.452 ops/s
# Warmup Iteration   3: 11107.745 ops/s
# Warmup Iteration   4: 10855.303 ops/s
# Warmup Iteration   5: 11502.303 ops/s
# Warmup Iteration   6: 10912.004 ops/s
# Warmup Iteration   7: 10838.520 ops/s
# Warmup Iteration   8: 11194.860 ops/s
# Warmup Iteration   9: 11088.577 ops/s
# Warmup Iteration  10: 10870.532 ops/s
# Warmup Iteration  11: 11172.501 ops/s
# Warmup Iteration  12: 10871.563 ops/s
# Warmup Iteration  13: 11022.466 ops/s
# Warmup Iteration  14: 11231.734 ops/s
# Warmup Iteration  15: 10851.082 ops/s
# Warmup Iteration  16: 10851.658 ops/s
# Warmup Iteration  17: 10883.863 ops/s
# Warmup Iteration  18: 11238.986 ops/s
# Warmup Iteration  19: 10876.657 ops/s
# Warmup Iteration  20: 10872.972 ops/s
Iteration   1: 11334.422 ops/s
Iteration   2: 11340.735 ops/s
Iteration   3: 10858.413 ops/s
Iteration   4: 11387.239 ops/s
Iteration   5: 10873.754 ops/s
Iteration   6: 10892.214 ops/s
Iteration   7: 10866.915 ops/s
Iteration   8: 11267.795 ops/s
Iteration   9: 10906.711 ops/s
Iteration  10: 11041.690 ops/s


Result "jvmscompare.benchmark.PersonCombinedSummaryStats.combinedStatistics_JDK_Stream_Parallel":
  10271.415 ±(99.9%) 733.716 ops/s [Average]
  (min, avg, max) = (9400.779, 10271.415, 11387.239), stdev = 844.949
  CI (99.9%): [9537.699, 11005.131] (assumes normal distribution)


# JMH version: 1.23
# VM version: JDK 11.0.6, anonymous, 11.0.6+8-LTS
# *** WARNING: This VM is not supported by JMH. The produced benchmark data can be completely wrong.
# VM invoker: /Library/Java/JavaVirtualMachines/oraclejdk-11.0.6.jdk/Contents/Home/bin/java
# VM options: <none>
# Warmup: 20 iterations, 10 s each
# Measurement: 10 iterations, 10 s each
# Timeout: 10 min per iteration
# Threads: 1 thread, will synchronize iterations
# Benchmark mode: Throughput, ops/time
WARNING: Not a HotSpot compiler command compatible VM ("anonymous-11.0.6"), compilerHints are disabled.
# Benchmark: jvmscompare.benchmark.PersonCombinedSummaryStats.combinedStatistics_JDK_Stream_Serial

# Run progress: 80.00% complete, ETA 00:10:01
# Fork: 1 of 2
# Warmup Iteration   1: 25658.534 ops/s
# Warmup Iteration   2: 27170.644 ops/s
# Warmup Iteration   3: 27202.179 ops/s
# Warmup Iteration   4: 27118.092 ops/s
# Warmup Iteration   5: 27116.121 ops/s
# Warmup Iteration   6: 27191.780 ops/s
# Warmup Iteration   7: 27218.329 ops/s
# Warmup Iteration   8: 27187.667 ops/s
# Warmup Iteration   9: 27226.873 ops/s
# Warmup Iteration  10: 27220.733 ops/s
# Warmup Iteration  11: 27207.948 ops/s
# Warmup Iteration  12: 27228.088 ops/s
# Warmup Iteration  13: 27208.455 ops/s
# Warmup Iteration  14: 27145.392 ops/s
# Warmup Iteration  15: 27217.181 ops/s
# Warmup Iteration  16: 27215.447 ops/s
# Warmup Iteration  17: 27198.704 ops/s
# Warmup Iteration  18: 27214.767 ops/s
# Warmup Iteration  19: 27214.858 ops/s
# Warmup Iteration  20: 27198.636 ops/s
Iteration   1: 27226.911 ops/s
Iteration   2: 27210.770 ops/s
Iteration   3: 27196.814 ops/s
Iteration   4: 27232.200 ops/s
Iteration   5: 27237.261 ops/s
Iteration   6: 27157.807 ops/s
Iteration   7: 27238.754 ops/s
Iteration   8: 27214.610 ops/s
Iteration   9: 27203.886 ops/s
Iteration  10: 27213.093 ops/s

WARNING: Not a HotSpot compiler command compatible VM ("anonymous-11.0.6"), compilerHints are disabled.
# Run progress: 90.00% complete, ETA 00:05:00
# Fork: 2 of 2
# Warmup Iteration   1: 83541.585 ops/s
# Warmup Iteration   2: 88563.296 ops/s
# Warmup Iteration   3: 88649.273 ops/s
# Warmup Iteration   4: 88631.129 ops/s
# Warmup Iteration   5: 88558.774 ops/s
# Warmup Iteration   6: 88566.977 ops/s
# Warmup Iteration   7: 88643.477 ops/s
# Warmup Iteration   8: 88429.489 ops/s
# Warmup Iteration   9: 88635.942 ops/s
# Warmup Iteration  10: 88663.209 ops/s
# Warmup Iteration  11: 88565.113 ops/s
# Warmup Iteration  12: 88656.526 ops/s
# Warmup Iteration  13: 85104.351 ops/s
# Warmup Iteration  14: 87529.438 ops/s
# Warmup Iteration  15: 88674.480 ops/s
# Warmup Iteration  16: 88615.885 ops/s
# Warmup Iteration  17: 88654.986 ops/s
# Warmup Iteration  18: 88652.874 ops/s
# Warmup Iteration  19: 88655.241 ops/s
# Warmup Iteration  20: 88667.618 ops/s
Iteration   1: 88749.769 ops/s
Iteration   2: 88627.804 ops/s
Iteration   3: 88663.869 ops/s
Iteration   4: 88754.040 ops/s
Iteration   5: 88730.171 ops/s
Iteration   6: 88668.324 ops/s
Iteration   7: 88697.991 ops/s
Iteration   8: 88645.274 ops/s
Iteration   9: 88562.275 ops/s
Iteration  10: 88733.773 ops/s


Result "jvmscompare.benchmark.PersonCombinedSummaryStats.combinedStatistics_JDK_Stream_Serial":
  57948.270 ±(99.9%) 27382.336 ops/s [Average]
  (min, avg, max) = (27157.807, 57948.270, 88754.040), stdev = 31533.538
  CI (99.9%): [30565.934, 85330.605] (assumes normal distribution)


# Run complete. Total time: 00:50:05

REMEMBER: The numbers below are just data. To gain reusable insights, you need to follow up on
why the numbers are the way they are. Use profilers (see -prof, -lprof), design factorial
experiments, perform baseline and negative tests that provide experimental control, make sure
the benchmarking environment is safe on JVM/OS/HW level, ask for reviews from the domain experts.
Do not assume the numbers tell you what you want them to tell.

Benchmark                                                           Mode  Cnt      Score       Error  Units
PersonCombinedSummaryStats.combinedStatistics_EC_Eager_Serial      thrpt   20  70534.196 ± 22534.424  ops/s
PersonCombinedSummaryStats.combinedStatistics_EC_Lazy_Serial       thrpt   20  92695.727 ±  1419.520  ops/s
PersonCombinedSummaryStats.combinedStatistics_EC_Stream_Parallel   thrpt   20  11343.588 ±   405.241  ops/s
PersonCombinedSummaryStats.combinedStatistics_JDK_Stream_Parallel  thrpt   20  10271.415 ±   733.716  ops/s
PersonCombinedSummaryStats.combinedStatistics_JDK_Stream_Serial    thrpt   20  57948.270 ± 27382.336  ops/s

Benchmark result is saved to benchmark-results/person-combined-summary-stats/01_OracleJDKPersonCombinedSummaryStats.csv
[INFO] ------------------------------------------------------------------------
[INFO] BUILD SUCCESS
[INFO] ------------------------------------------------------------------------
[INFO] Total time:  50:17 min
[INFO] Finished at: 2020-01-26T06:44:18-05:00
[INFO] ------------------------------------------------------------------------
