[INFO] Scanning for projects...
[INFO] 
[INFO] ---------------------< jvms-compare:jvms-compare >----------------------
[INFO] Building JVMs Compare 1.0.0
[INFO] --------------------------------[ jar ]---------------------------------
[INFO] 
[INFO] --- maven-clean-plugin:2.5:clean (default-clean) @ jvms-compare ---
[INFO] Deleting /Users/cguntur/projects/conf/jvms-compare/target
[INFO] 
[INFO] --- maven-toolchains-plugin:1.1:toolchain (default) @ jvms-compare ---
[INFO] Required toolchain: jdk [ vendor='openjdk' version='11' ]
[INFO] Found matching toolchain for type jdk: JDK[/Library/Java/JavaVirtualMachines/openjdk-11.0.2.jdk/Contents/Home/]
[INFO] 
[INFO] --- maven-dependency-plugin:3.1.1:build-classpath (build-classpath) @ jvms-compare ---
[INFO] Dependencies classpath:
/Users/cguntur/.m2/repository/org/apache/commons/commons-math3/3.2/commons-math3-3.2.jar:/Users/cguntur/.m2/repository/org/junit/jupiter/junit-jupiter-api/5.5.0/junit-jupiter-api-5.5.0.jar:/Users/cguntur/.m2/repository/org/eclipse/collections/eclipse-collections/10.0.0/eclipse-collections-10.0.0.jar:/Users/cguntur/.m2/repository/javax/annotation/javax.annotation-api/1.3.1/javax.annotation-api-1.3.1.jar:/Users/cguntur/.m2/repository/org/junit/platform/junit-platform-engine/1.5.0/junit-platform-engine-1.5.0.jar:/Users/cguntur/.m2/repository/org/junit/platform/junit-platform-commons/1.5.0/junit-platform-commons-1.5.0.jar:/Users/cguntur/.m2/repository/org/junit/jupiter/junit-jupiter-params/5.5.0/junit-jupiter-params-5.5.0.jar:/Users/cguntur/.m2/repository/org/junit/jupiter/junit-jupiter-engine/5.5.0/junit-jupiter-engine-5.5.0.jar:/Users/cguntur/.m2/repository/org/junit/jupiter/junit-jupiter/5.5.0/junit-jupiter-5.5.0.jar:/Users/cguntur/.m2/repository/org/opentest4j/opentest4j/1.2.0/opentest4j-1.2.0.jar:/Users/cguntur/.m2/repository/org/openjdk/jmh/jmh-core/1.23/jmh-core-1.23.jar:/Users/cguntur/.m2/repository/org/apiguardian/apiguardian-api/1.1.0/apiguardian-api-1.1.0.jar:/Users/cguntur/.m2/repository/net/sf/jopt-simple/jopt-simple/4.6/jopt-simple-4.6.jar:/Users/cguntur/.m2/repository/org/eclipse/collections/eclipse-collections-api/10.0.0/eclipse-collections-api-10.0.0.jar
[INFO] 
[INFO] --- maven-resources-plugin:2.6:resources (default-resources) @ jvms-compare ---
[INFO] Using 'UTF-8' encoding to copy filtered resources.
[INFO] Copying 1 resource
[INFO] 
[INFO] --- maven-compiler-plugin:3.8.1:compile (default-compile) @ jvms-compare ---
[INFO] Toolchain in maven-compiler-plugin: JDK[/Library/Java/JavaVirtualMachines/openjdk-11.0.2.jdk/Contents/Home/]
[INFO] Changes detected - recompiling the module!
[INFO] Compiling 10 source files to /Users/cguntur/projects/conf/jvms-compare/target/classes
[INFO] 
[INFO] --- maven-resources-plugin:2.6:testResources (default-testResources) @ jvms-compare ---
[INFO] Using 'UTF-8' encoding to copy filtered resources.
[INFO] Copying 1 resource
[INFO] 
[INFO] --- maven-compiler-plugin:3.8.1:testCompile (default-testCompile) @ jvms-compare ---
[INFO] Toolchain in maven-compiler-plugin: JDK[/Library/Java/JavaVirtualMachines/openjdk-11.0.2.jdk/Contents/Home/]
[INFO] Changes detected - recompiling the module!
[INFO] Compiling 2 source files to /Users/cguntur/projects/conf/jvms-compare/target/test-classes
[INFO] 
[INFO] --- maven-surefire-plugin:2.12.4:test (default-test) @ jvms-compare ---
[INFO] Toolchain in surefire-plugin: JDK[/Library/Java/JavaVirtualMachines/openjdk-11.0.2.jdk/Contents/Home/]
[INFO] Surefire report directory: /Users/cguntur/projects/conf/jvms-compare/target/surefire-reports

-------------------------------------------------------
 T E S T S
-------------------------------------------------------
Running jvmscompare.PersonTest
Tests run: 3, Failures: 0, Errors: 0, Skipped: 0, Time elapsed: 1.374 sec
Running jvmscompare.IntListTest
Tests run: 3, Failures: 0, Errors: 0, Skipped: 0, Time elapsed: 1.257 sec

Results :

Tests run: 6, Failures: 0, Errors: 0, Skipped: 0

[INFO] 
[INFO] --- exec-maven-plugin:1.6.0:exec (combinedSummaryStats) @ jvms-compare ---
[INFO] Toolchain in exec-maven-plugin: JDK[/Library/Java/JavaVirtualMachines/openjdk-11.0.2.jdk/Contents/Home/]
Java Runtime Environment version: 11.0.2
Java Runtime Environment vendor: Oracle Corporation

Java Runtime Name: OpenJDK Runtime Environment
Java Runtime Version: 11.0.2+9

Java Virtual Machine name: anonymous
Java Virtual Machine vendor: Oracle Corporation
Java Virtual Machine version: 11.0.2+9

Java Class Version: 55.0

Benchmark size: 1000
Benchmark forks: 2
Benchmark warmups: 20
Benchmark measurements: 10

WARNING: An illegal reflective access operation has occurred
WARNING: Illegal reflective access by org.openjdk.jmh.util.Utils (file:/Users/cguntur/.m2/repository/org/openjdk/jmh/jmh-core/1.23/jmh-core-1.23.jar) to field java.io.PrintStream.charOut
WARNING: Please consider reporting this to the maintainers of org.openjdk.jmh.util.Utils
WARNING: Use --illegal-access=warn to enable warnings of further illegal reflective access operations
WARNING: All illegal access operations will be denied in a future release
# JMH version: 1.23
# VM version: JDK 11.0.2, anonymous, 11.0.2+9
# *** WARNING: This VM is not supported by JMH. The produced benchmark data can be completely wrong.
# VM invoker: /Library/Java/JavaVirtualMachines/openjdk-11.0.2.jdk/Contents/Home/bin/java
# VM options: <none>
# Warmup: 20 iterations, 10 s each
# Measurement: 10 iterations, 10 s each
# Timeout: 10 min per iteration
# Threads: 1 thread, will synchronize iterations
# Benchmark mode: Throughput, ops/time
# Benchmark: jvmscompare.benchmark.PersonCombinedSummaryStats.combinedStatistics_EC_Eager_Serial

WARNING: Not a HotSpot compiler command compatible VM ("anonymous-11.0.2"), compilerHints are disabled.
# Run progress: 0.00% complete, ETA 00:50:00
# Fork: 1 of 2
# Warmup Iteration   1: 93593.927 ops/s
# Warmup Iteration   2: 98443.515 ops/s
# Warmup Iteration   3: 99063.487 ops/s
# Warmup Iteration   4: 99385.104 ops/s
# Warmup Iteration   5: 99304.481 ops/s
# Warmup Iteration   6: 99357.828 ops/s
# Warmup Iteration   7: 99268.388 ops/s
# Warmup Iteration   8: 99287.530 ops/s
# Warmup Iteration   9: 99397.538 ops/s
# Warmup Iteration  10: 99358.080 ops/s
# Warmup Iteration  11: 99237.599 ops/s
# Warmup Iteration  12: 98908.681 ops/s
# Warmup Iteration  13: 98688.649 ops/s
# Warmup Iteration  14: 98527.950 ops/s
# Warmup Iteration  15: 98466.024 ops/s
# Warmup Iteration  16: 98771.467 ops/s
# Warmup Iteration  17: 98671.058 ops/s
# Warmup Iteration  18: 98748.692 ops/s
# Warmup Iteration  19: 98707.016 ops/s
# Warmup Iteration  20: 98657.342 ops/s
Iteration   1: 98714.740 ops/s
Iteration   2: 98707.850 ops/s
Iteration   3: 98616.297 ops/s
Iteration   4: 98667.941 ops/s
Iteration   5: 98696.967 ops/s
Iteration   6: 98419.365 ops/s
Iteration   7: 98628.294 ops/s
Iteration   8: 98614.139 ops/s
Iteration   9: 98652.803 ops/s
Iteration  10: 98684.143 ops/s

WARNING: Not a HotSpot compiler command compatible VM ("anonymous-11.0.2"), compilerHints are disabled.
# Run progress: 10.00% complete, ETA 00:45:06
# Fork: 2 of 2
# Warmup Iteration   1: 94335.400 ops/s
# Warmup Iteration   2: 99681.939 ops/s
# Warmup Iteration   3: 100320.061 ops/s
# Warmup Iteration   4: 100334.319 ops/s
# Warmup Iteration   5: 99660.696 ops/s
# Warmup Iteration   6: 100290.299 ops/s
# Warmup Iteration   7: 100301.740 ops/s
# Warmup Iteration   8: 100042.535 ops/s
# Warmup Iteration   9: 100356.230 ops/s
# Warmup Iteration  10: 100302.742 ops/s
# Warmup Iteration  11: 100327.965 ops/s
# Warmup Iteration  12: 100373.665 ops/s
# Warmup Iteration  13: 99448.768 ops/s
# Warmup Iteration  14: 99408.398 ops/s
# Warmup Iteration  15: 99386.848 ops/s
# Warmup Iteration  16: 99441.969 ops/s
# Warmup Iteration  17: 99274.090 ops/s
# Warmup Iteration  18: 99473.528 ops/s
# Warmup Iteration  19: 99387.083 ops/s
# Warmup Iteration  20: 99364.723 ops/s
Iteration   1: 99333.893 ops/s
Iteration   2: 99376.294 ops/s
Iteration   3: 99377.242 ops/s
Iteration   4: 99039.072 ops/s
Iteration   5: 99327.892 ops/s
Iteration   6: 99351.897 ops/s
Iteration   7: 99401.000 ops/s
Iteration   8: 99398.845 ops/s
Iteration   9: 99186.782 ops/s
Iteration  10: 99398.470 ops/s


Result "jvmscompare.benchmark.PersonCombinedSummaryStats.combinedStatistics_EC_Eager_Serial":
  98979.696 ±(99.9%) 314.615 ops/s [Average]
  (min, avg, max) = (98419.365, 98979.696, 99401.000), stdev = 362.311
  CI (99.9%): [98665.082, 99294.311] (assumes normal distribution)


# JMH version: 1.23
# VM version: JDK 11.0.2, anonymous, 11.0.2+9
# *** WARNING: This VM is not supported by JMH. The produced benchmark data can be completely wrong.
# VM invoker: /Library/Java/JavaVirtualMachines/openjdk-11.0.2.jdk/Contents/Home/bin/java
# VM options: <none>
# Warmup: 20 iterations, 10 s each
# Measurement: 10 iterations, 10 s each
# Timeout: 10 min per iteration
# Threads: 1 thread, will synchronize iterations
# Benchmark mode: Throughput, ops/time
# Benchmark: jvmscompare.benchmark.PersonCombinedSummaryStats.combinedStatistics_EC_Lazy_Serial

WARNING: Not a HotSpot compiler command compatible VM ("anonymous-11.0.2"), compilerHints are disabled.
# Run progress: 20.00% complete, ETA 00:40:05
# Fork: 1 of 2
# Warmup Iteration   1: 87734.331 ops/s
# Warmup Iteration   2: 95644.111 ops/s
# Warmup Iteration   3: 95964.817 ops/s
# Warmup Iteration   4: 96004.896 ops/s
# Warmup Iteration   5: 95959.393 ops/s
# Warmup Iteration   6: 96032.459 ops/s
# Warmup Iteration   7: 95873.989 ops/s
# Warmup Iteration   8: 95887.639 ops/s
# Warmup Iteration   9: 95946.193 ops/s
# Warmup Iteration  10: 95946.019 ops/s
# Warmup Iteration  11: 95993.910 ops/s
# Warmup Iteration  12: 95967.222 ops/s
# Warmup Iteration  13: 95969.385 ops/s
# Warmup Iteration  14: 95697.142 ops/s
# Warmup Iteration  15: 95891.559 ops/s
# Warmup Iteration  16: 95983.050 ops/s
# Warmup Iteration  17: 96050.000 ops/s
# Warmup Iteration  18: 96039.752 ops/s
# Warmup Iteration  19: 95967.674 ops/s
# Warmup Iteration  20: 95954.776 ops/s
Iteration   1: 95951.906 ops/s
Iteration   2: 96048.330 ops/s
Iteration   3: 95967.065 ops/s
Iteration   4: 96013.343 ops/s
Iteration   5: 95993.379 ops/s
Iteration   6: 96017.054 ops/s
Iteration   7: 96092.439 ops/s
Iteration   8: 95973.650 ops/s
Iteration   9: 96005.411 ops/s
Iteration  10: 96037.552 ops/s

WARNING: Not a HotSpot compiler command compatible VM ("anonymous-11.0.2"), compilerHints are disabled.
# Run progress: 30.00% complete, ETA 00:35:04
# Fork: 2 of 2
# Warmup Iteration   1: 88799.822 ops/s
# Warmup Iteration   2: 97250.225 ops/s
# Warmup Iteration   3: 97349.951 ops/s
# Warmup Iteration   4: 97376.155 ops/s
# Warmup Iteration   5: 96283.443 ops/s
# Warmup Iteration   6: 97003.280 ops/s
# Warmup Iteration   7: 97294.415 ops/s
# Warmup Iteration   8: 97244.040 ops/s
# Warmup Iteration   9: 97366.182 ops/s
# Warmup Iteration  10: 97391.696 ops/s
# Warmup Iteration  11: 97305.412 ops/s
# Warmup Iteration  12: 97408.189 ops/s
# Warmup Iteration  13: 97368.214 ops/s
# Warmup Iteration  14: 97230.920 ops/s
# Warmup Iteration  15: 97406.702 ops/s
# Warmup Iteration  16: 97354.240 ops/s
# Warmup Iteration  17: 97269.094 ops/s
# Warmup Iteration  18: 97292.935 ops/s
# Warmup Iteration  19: 97365.140 ops/s
# Warmup Iteration  20: 97288.488 ops/s
Iteration   1: 97334.017 ops/s
Iteration   2: 97297.772 ops/s
Iteration   3: 97338.824 ops/s
Iteration   4: 96711.443 ops/s
Iteration   5: 97364.133 ops/s
Iteration   6: 97265.697 ops/s
Iteration   7: 97431.153 ops/s
Iteration   8: 97315.935 ops/s
Iteration   9: 97319.501 ops/s
Iteration  10: 97343.377 ops/s


Result "jvmscompare.benchmark.PersonCombinedSummaryStats.combinedStatistics_EC_Lazy_Serial":
  96641.099 ±(99.9%) 575.577 ops/s [Average]
  (min, avg, max) = (95951.906, 96641.099, 97431.153), stdev = 662.835
  CI (99.9%): [96065.522, 97216.676] (assumes normal distribution)


# JMH version: 1.23
# VM version: JDK 11.0.2, anonymous, 11.0.2+9
# *** WARNING: This VM is not supported by JMH. The produced benchmark data can be completely wrong.
# VM invoker: /Library/Java/JavaVirtualMachines/openjdk-11.0.2.jdk/Contents/Home/bin/java
# VM options: <none>
# Warmup: 20 iterations, 10 s each
# Measurement: 10 iterations, 10 s each
# Timeout: 10 min per iteration
# Threads: 1 thread, will synchronize iterations
# Benchmark mode: Throughput, ops/time
# Benchmark: jvmscompare.benchmark.PersonCombinedSummaryStats.combinedStatistics_EC_Stream_Parallel

WARNING: Not a HotSpot compiler command compatible VM ("anonymous-11.0.2"), compilerHints are disabled.
# Run progress: 40.00% complete, ETA 00:30:03
# Fork: 1 of 2
# Warmup Iteration   1: 9288.577 ops/s
# Warmup Iteration   2: 9538.200 ops/s
# Warmup Iteration   3: 9140.841 ops/s
# Warmup Iteration   4: 9334.282 ops/s
# Warmup Iteration   5: 9144.033 ops/s
# Warmup Iteration   6: 9116.983 ops/s
# Warmup Iteration   7: 9283.374 ops/s
# Warmup Iteration   8: 9182.142 ops/s
# Warmup Iteration   9: 9116.089 ops/s
# Warmup Iteration  10: 9138.345 ops/s
# Warmup Iteration  11: 9139.553 ops/s
# Warmup Iteration  12: 9117.429 ops/s
# Warmup Iteration  13: 9375.794 ops/s
# Warmup Iteration  14: 9184.546 ops/s
# Warmup Iteration  15: 9236.155 ops/s
# Warmup Iteration  16: 9118.354 ops/s
# Warmup Iteration  17: 9157.360 ops/s
# Warmup Iteration  18: 9215.932 ops/s
# Warmup Iteration  19: 9156.992 ops/s
# Warmup Iteration  20: 9505.542 ops/s
Iteration   1: 9231.145 ops/s
Iteration   2: 9217.622 ops/s
Iteration   3: 9162.531 ops/s
Iteration   4: 9409.174 ops/s
Iteration   5: 9142.126 ops/s
Iteration   6: 9649.041 ops/s
Iteration   7: 9148.385 ops/s
Iteration   8: 9474.356 ops/s
Iteration   9: 9145.839 ops/s
Iteration  10: 9135.380 ops/s

WARNING: Not a HotSpot compiler command compatible VM ("anonymous-11.0.2"), compilerHints are disabled.
# Run progress: 50.00% complete, ETA 00:25:03
# Fork: 2 of 2
# Warmup Iteration   1: 10759.749 ops/s
# Warmup Iteration   2: 11574.655 ops/s
# Warmup Iteration   3: 10830.016 ops/s
# Warmup Iteration   4: 11604.662 ops/s
# Warmup Iteration   5: 10873.964 ops/s
# Warmup Iteration   6: 10855.128 ops/s
# Warmup Iteration   7: 10927.232 ops/s
# Warmup Iteration   8: 10873.092 ops/s
# Warmup Iteration   9: 10839.807 ops/s
# Warmup Iteration  10: 11318.149 ops/s
# Warmup Iteration  11: 10890.624 ops/s
# Warmup Iteration  12: 11403.261 ops/s
# Warmup Iteration  13: 11229.111 ops/s
# Warmup Iteration  14: 11164.072 ops/s
# Warmup Iteration  15: 11092.703 ops/s
# Warmup Iteration  16: 10861.973 ops/s
# Warmup Iteration  17: 11287.187 ops/s
# Warmup Iteration  18: 10878.810 ops/s
# Warmup Iteration  19: 10884.895 ops/s
# Warmup Iteration  20: 10911.806 ops/s
Iteration   1: 10867.463 ops/s
Iteration   2: 10849.321 ops/s
Iteration   3: 10912.207 ops/s
Iteration   4: 10886.822 ops/s
Iteration   5: 10891.734 ops/s
Iteration   6: 11167.323 ops/s
Iteration   7: 10901.848 ops/s
Iteration   8: 11238.690 ops/s
Iteration   9: 11331.274 ops/s
Iteration  10: 10893.076 ops/s


Result "jvmscompare.benchmark.PersonCombinedSummaryStats.combinedStatistics_EC_Stream_Parallel":
  10132.768 ±(99.9%) 781.946 ops/s [Average]
  (min, avg, max) = (9135.380, 10132.768, 11331.274), stdev = 900.490
  CI (99.9%): [9350.822, 10914.714] (assumes normal distribution)


# JMH version: 1.23
# VM version: JDK 11.0.2, anonymous, 11.0.2+9
# *** WARNING: This VM is not supported by JMH. The produced benchmark data can be completely wrong.
# VM invoker: /Library/Java/JavaVirtualMachines/openjdk-11.0.2.jdk/Contents/Home/bin/java
# VM options: <none>
# Warmup: 20 iterations, 10 s each
# Measurement: 10 iterations, 10 s each
# Timeout: 10 min per iteration
# Threads: 1 thread, will synchronize iterations
# Benchmark mode: Throughput, ops/time
# Benchmark: jvmscompare.benchmark.PersonCombinedSummaryStats.combinedStatistics_JDK_Stream_Parallel

WARNING: Not a HotSpot compiler command compatible VM ("anonymous-11.0.2"), compilerHints are disabled.
# Run progress: 60.00% complete, ETA 00:20:02
# Fork: 1 of 2
# Warmup Iteration   1: 12383.458 ops/s
# Warmup Iteration   2: 11549.920 ops/s
# Warmup Iteration   3: 12072.404 ops/s
# Warmup Iteration   4: 11715.702 ops/s
# Warmup Iteration   5: 12158.690 ops/s
# Warmup Iteration   6: 11862.918 ops/s
# Warmup Iteration   7: 12795.474 ops/s
# Warmup Iteration   8: 12313.115 ops/s
# Warmup Iteration   9: 11508.785 ops/s
# Warmup Iteration  10: 11718.694 ops/s
# Warmup Iteration  11: 11556.430 ops/s
# Warmup Iteration  12: 12018.928 ops/s
# Warmup Iteration  13: 12172.395 ops/s
# Warmup Iteration  14: 11517.871 ops/s
# Warmup Iteration  15: 11490.395 ops/s
# Warmup Iteration  16: 11790.748 ops/s
# Warmup Iteration  17: 11525.932 ops/s
# Warmup Iteration  18: 11541.761 ops/s
# Warmup Iteration  19: 11541.841 ops/s
# Warmup Iteration  20: 12100.105 ops/s
Iteration   1: 11938.054 ops/s
Iteration   2: 11557.214 ops/s
Iteration   3: 11925.385 ops/s
Iteration   4: 11551.175 ops/s
Iteration   5: 12197.486 ops/s
Iteration   6: 11522.960 ops/s
Iteration   7: 11942.298 ops/s
Iteration   8: 12247.345 ops/s
Iteration   9: 12503.004 ops/s
Iteration  10: 11532.486 ops/s

WARNING: Not a HotSpot compiler command compatible VM ("anonymous-11.0.2"), compilerHints are disabled.
# Run progress: 70.00% complete, ETA 00:15:01
# Fork: 2 of 2
# Warmup Iteration   1: 10510.923 ops/s
# Warmup Iteration   2: 10858.442 ops/s
# Warmup Iteration   3: 10875.856 ops/s
# Warmup Iteration   4: 10860.531 ops/s
# Warmup Iteration   5: 11036.407 ops/s
# Warmup Iteration   6: 10857.855 ops/s
# Warmup Iteration   7: 11147.561 ops/s
# Warmup Iteration   8: 10886.943 ops/s
# Warmup Iteration   9: 11931.317 ops/s
# Warmup Iteration  10: 11270.905 ops/s
# Warmup Iteration  11: 10868.135 ops/s
# Warmup Iteration  12: 10860.301 ops/s
# Warmup Iteration  13: 10813.486 ops/s
# Warmup Iteration  14: 11039.313 ops/s
# Warmup Iteration  15: 11045.714 ops/s
# Warmup Iteration  16: 10868.315 ops/s
# Warmup Iteration  17: 10853.008 ops/s
# Warmup Iteration  18: 10878.828 ops/s
# Warmup Iteration  19: 11261.623 ops/s
# Warmup Iteration  20: 10855.236 ops/s
Iteration   1: 10895.999 ops/s
Iteration   2: 11058.765 ops/s
Iteration   3: 11904.187 ops/s
Iteration   4: 10868.624 ops/s
Iteration   5: 10878.675 ops/s
Iteration   6: 10853.289 ops/s
Iteration   7: 10865.982 ops/s
Iteration   8: 10868.972 ops/s
Iteration   9: 10895.182 ops/s
Iteration  10: 10863.105 ops/s


Result "jvmscompare.benchmark.PersonCombinedSummaryStats.combinedStatistics_JDK_Stream_Parallel":
  11443.509 ±(99.9%) 490.430 ops/s [Average]
  (min, avg, max) = (10853.289, 11443.509, 12503.004), stdev = 564.780
  CI (99.9%): [10953.079, 11933.939] (assumes normal distribution)


# JMH version: 1.23
# VM version: JDK 11.0.2, anonymous, 11.0.2+9
# *** WARNING: This VM is not supported by JMH. The produced benchmark data can be completely wrong.
# VM invoker: /Library/Java/JavaVirtualMachines/openjdk-11.0.2.jdk/Contents/Home/bin/java
# VM options: <none>
# Warmup: 20 iterations, 10 s each
# Measurement: 10 iterations, 10 s each
# Timeout: 10 min per iteration
# Threads: 1 thread, will synchronize iterations
# Benchmark mode: Throughput, ops/time
# Benchmark: jvmscompare.benchmark.PersonCombinedSummaryStats.combinedStatistics_JDK_Stream_Serial

WARNING: Not a HotSpot compiler command compatible VM ("anonymous-11.0.2"), compilerHints are disabled.
# Run progress: 80.00% complete, ETA 00:10:01
# Fork: 1 of 2
# Warmup Iteration   1: 86942.040 ops/s
# Warmup Iteration   2: 91798.449 ops/s
# Warmup Iteration   3: 92123.205 ops/s
# Warmup Iteration   4: 92030.785 ops/s
# Warmup Iteration   5: 92145.540 ops/s
# Warmup Iteration   6: 92175.401 ops/s
# Warmup Iteration   7: 92069.067 ops/s
# Warmup Iteration   8: 92093.953 ops/s
# Warmup Iteration   9: 92117.132 ops/s
# Warmup Iteration  10: 91739.827 ops/s
# Warmup Iteration  11: 91995.958 ops/s
# Warmup Iteration  12: 92068.738 ops/s
# Warmup Iteration  13: 92087.561 ops/s
# Warmup Iteration  14: 92128.540 ops/s
# Warmup Iteration  15: 92116.868 ops/s
# Warmup Iteration  16: 92005.466 ops/s
# Warmup Iteration  17: 92170.790 ops/s
# Warmup Iteration  18: 92087.798 ops/s
# Warmup Iteration  19: 92082.530 ops/s
# Warmup Iteration  20: 92127.369 ops/s
Iteration   1: 92091.497 ops/s
Iteration   2: 92135.951 ops/s
Iteration   3: 92103.008 ops/s
Iteration   4: 92030.154 ops/s
Iteration   5: 92065.037 ops/s
Iteration   6: 92121.379 ops/s
Iteration   7: 92106.319 ops/s
Iteration   8: 91925.963 ops/s
Iteration   9: 91794.270 ops/s
Iteration  10: 92097.843 ops/s

WARNING: Not a HotSpot compiler command compatible VM ("anonymous-11.0.2"), compilerHints are disabled.
# Run progress: 90.00% complete, ETA 00:05:00
# Fork: 2 of 2
# Warmup Iteration   1: 87452.948 ops/s
# Warmup Iteration   2: 92736.665 ops/s
# Warmup Iteration   3: 92955.366 ops/s
# Warmup Iteration   4: 92790.585 ops/s
# Warmup Iteration   5: 92826.283 ops/s
# Warmup Iteration   6: 92910.050 ops/s
# Warmup Iteration   7: 92854.911 ops/s
# Warmup Iteration   8: 92764.789 ops/s
# Warmup Iteration   9: 92870.536 ops/s
# Warmup Iteration  10: 92869.767 ops/s
# Warmup Iteration  11: 92827.715 ops/s
# Warmup Iteration  12: 92852.261 ops/s
# Warmup Iteration  13: 92751.097 ops/s
# Warmup Iteration  14: 92841.811 ops/s
# Warmup Iteration  15: 92874.176 ops/s
# Warmup Iteration  16: 92684.979 ops/s
# Warmup Iteration  17: 92625.944 ops/s
# Warmup Iteration  18: 92839.983 ops/s
# Warmup Iteration  19: 92854.420 ops/s
# Warmup Iteration  20: 92935.463 ops/s
Iteration   1: 92893.463 ops/s
Iteration   2: 92784.526 ops/s
Iteration   3: 92948.434 ops/s
Iteration   4: 92827.856 ops/s
Iteration   5: 92834.370 ops/s
Iteration   6: 92837.092 ops/s
Iteration   7: 92823.710 ops/s
Iteration   8: 92811.372 ops/s
Iteration   9: 92923.285 ops/s
Iteration  10: 92867.664 ops/s


Result "jvmscompare.benchmark.PersonCombinedSummaryStats.combinedStatistics_JDK_Stream_Serial":
  92451.160 ±(99.9%) 366.942 ops/s [Average]
  (min, avg, max) = (91794.270, 92451.160, 92948.434), stdev = 422.571
  CI (99.9%): [92084.217, 92818.102] (assumes normal distribution)


# Run complete. Total time: 00:50:05

REMEMBER: The numbers below are just data. To gain reusable insights, you need to follow up on
why the numbers are the way they are. Use profilers (see -prof, -lprof), design factorial
experiments, perform baseline and negative tests that provide experimental control, make sure
the benchmarking environment is safe on JVM/OS/HW level, ask for reviews from the domain experts.
Do not assume the numbers tell you what you want them to tell.

Benchmark                                                           Mode  Cnt      Score     Error  Units
PersonCombinedSummaryStats.combinedStatistics_EC_Eager_Serial      thrpt   20  98979.696 ± 314.615  ops/s
PersonCombinedSummaryStats.combinedStatistics_EC_Lazy_Serial       thrpt   20  96641.099 ± 575.577  ops/s
PersonCombinedSummaryStats.combinedStatistics_EC_Stream_Parallel   thrpt   20  10132.768 ± 781.946  ops/s
PersonCombinedSummaryStats.combinedStatistics_JDK_Stream_Parallel  thrpt   20  11443.509 ± 490.430  ops/s
PersonCombinedSummaryStats.combinedStatistics_JDK_Stream_Serial    thrpt   20  92451.160 ± 366.942  ops/s

Benchmark result is saved to benchmark-results/person-combined-summary-stats/06_OpenJDKHotspotPersonCombinedSummaryStats.csv
[INFO] ------------------------------------------------------------------------
[INFO] BUILD SUCCESS
[INFO] ------------------------------------------------------------------------
[INFO] Total time:  50:18 min
[INFO] Finished at: 2020-01-27T18:49:40-05:00
[INFO] ------------------------------------------------------------------------
