[INFO] Scanning for projects...
[INFO] 
[INFO] ---------------------< jvms-compare:jvms-compare >----------------------
[INFO] Building JVMs Compare 1.0.0
[INFO] --------------------------------[ jar ]---------------------------------
[INFO] 
[INFO] --- maven-clean-plugin:2.5:clean (default-clean) @ jvms-compare ---
[INFO] Deleting /Users/cguntur/projects/conf/jvms-compare/target
[INFO] 
[INFO] --- maven-toolchains-plugin:1.1:toolchain (default) @ jvms-compare ---
[INFO] Required toolchain: jdk [ vendor='openjdk' version='11' ]
[INFO] Found matching toolchain for type jdk: JDK[/Library/Java/JavaVirtualMachines/openjdk-11.0.2.jdk/Contents/Home/]
[INFO] 
[INFO] --- maven-dependency-plugin:3.1.1:build-classpath (build-classpath) @ jvms-compare ---
[INFO] Dependencies classpath:
/Users/cguntur/.m2/repository/org/apache/commons/commons-math3/3.2/commons-math3-3.2.jar:/Users/cguntur/.m2/repository/org/junit/jupiter/junit-jupiter-api/5.5.0/junit-jupiter-api-5.5.0.jar:/Users/cguntur/.m2/repository/org/eclipse/collections/eclipse-collections/10.0.0/eclipse-collections-10.0.0.jar:/Users/cguntur/.m2/repository/javax/annotation/javax.annotation-api/1.3.1/javax.annotation-api-1.3.1.jar:/Users/cguntur/.m2/repository/org/junit/platform/junit-platform-engine/1.5.0/junit-platform-engine-1.5.0.jar:/Users/cguntur/.m2/repository/org/junit/platform/junit-platform-commons/1.5.0/junit-platform-commons-1.5.0.jar:/Users/cguntur/.m2/repository/org/junit/jupiter/junit-jupiter-params/5.5.0/junit-jupiter-params-5.5.0.jar:/Users/cguntur/.m2/repository/org/junit/jupiter/junit-jupiter-engine/5.5.0/junit-jupiter-engine-5.5.0.jar:/Users/cguntur/.m2/repository/org/junit/jupiter/junit-jupiter/5.5.0/junit-jupiter-5.5.0.jar:/Users/cguntur/.m2/repository/org/opentest4j/opentest4j/1.2.0/opentest4j-1.2.0.jar:/Users/cguntur/.m2/repository/org/openjdk/jmh/jmh-core/1.23/jmh-core-1.23.jar:/Users/cguntur/.m2/repository/org/apiguardian/apiguardian-api/1.1.0/apiguardian-api-1.1.0.jar:/Users/cguntur/.m2/repository/net/sf/jopt-simple/jopt-simple/4.6/jopt-simple-4.6.jar:/Users/cguntur/.m2/repository/org/eclipse/collections/eclipse-collections-api/10.0.0/eclipse-collections-api-10.0.0.jar
[INFO] 
[INFO] --- maven-resources-plugin:2.6:resources (default-resources) @ jvms-compare ---
[INFO] Using 'UTF-8' encoding to copy filtered resources.
[INFO] Copying 1 resource
[INFO] 
[INFO] --- maven-compiler-plugin:3.8.1:compile (default-compile) @ jvms-compare ---
[INFO] Toolchain in maven-compiler-plugin: JDK[/Library/Java/JavaVirtualMachines/openjdk-11.0.2.jdk/Contents/Home/]
[INFO] Changes detected - recompiling the module!
[INFO] Compiling 10 source files to /Users/cguntur/projects/conf/jvms-compare/target/classes
[INFO] 
[INFO] --- maven-resources-plugin:2.6:testResources (default-testResources) @ jvms-compare ---
[INFO] Using 'UTF-8' encoding to copy filtered resources.
[INFO] Copying 1 resource
[INFO] 
[INFO] --- maven-compiler-plugin:3.8.1:testCompile (default-testCompile) @ jvms-compare ---
[INFO] Toolchain in maven-compiler-plugin: JDK[/Library/Java/JavaVirtualMachines/openjdk-11.0.2.jdk/Contents/Home/]
[INFO] Changes detected - recompiling the module!
[INFO] Compiling 2 source files to /Users/cguntur/projects/conf/jvms-compare/target/test-classes
[INFO] 
[INFO] --- maven-surefire-plugin:2.12.4:test (default-test) @ jvms-compare ---
[INFO] Toolchain in surefire-plugin: JDK[/Library/Java/JavaVirtualMachines/openjdk-11.0.2.jdk/Contents/Home/]
[INFO] Surefire report directory: /Users/cguntur/projects/conf/jvms-compare/target/surefire-reports

-------------------------------------------------------
 T E S T S
-------------------------------------------------------
Running jvmscompare.PersonTest
Tests run: 3, Failures: 0, Errors: 0, Skipped: 0, Time elapsed: 1.466 sec
Running jvmscompare.IntListTest
Tests run: 3, Failures: 0, Errors: 0, Skipped: 0, Time elapsed: 1.318 sec

Results :

Tests run: 6, Failures: 0, Errors: 0, Skipped: 0

[INFO] 
[INFO] --- exec-maven-plugin:1.6.0:exec (combinedSummaryStats) @ jvms-compare ---
[INFO] Toolchain in exec-maven-plugin: JDK[/Library/Java/JavaVirtualMachines/openjdk-11.0.2.jdk/Contents/Home/]
Java Runtime Environment version: 11.0.2
Java Runtime Environment vendor: Oracle Corporation

Java Runtime Name: OpenJDK Runtime Environment
Java Runtime Version: 11.0.2+9

Java Virtual Machine name: anonymous
Java Virtual Machine vendor: Oracle Corporation
Java Virtual Machine version: 11.0.2+9

Java Class Version: 55.0

Benchmark size: 1000
Benchmark forks: 2
Benchmark warmups: 20
Benchmark measurements: 10

WARNING: An illegal reflective access operation has occurred
WARNING: Illegal reflective access by org.openjdk.jmh.util.Utils (file:/Users/cguntur/.m2/repository/org/openjdk/jmh/jmh-core/1.23/jmh-core-1.23.jar) to field java.io.PrintStream.charOut
WARNING: Please consider reporting this to the maintainers of org.openjdk.jmh.util.Utils
WARNING: Use --illegal-access=warn to enable warnings of further illegal reflective access operations
WARNING: All illegal access operations will be denied in a future release
# JMH version: 1.23
# VM version: JDK 11.0.2, anonymous, 11.0.2+9
# *** WARNING: This VM is not supported by JMH. The produced benchmark data can be completely wrong.
# VM invoker: /Library/Java/JavaVirtualMachines/openjdk-11.0.2.jdk/Contents/Home/bin/java
# VM options: -XX:+UnlockExperimentalVMOptions -XX:+EnableJVMCI -XX:+UseJVMCICompiler
# Warmup: 20 iterations, 10 s each
# Measurement: 10 iterations, 10 s each
# Timeout: 10 min per iteration
# Threads: 1 thread, will synchronize iterations
# Benchmark mode: Throughput, ops/time
# Benchmark: jvmscompare.benchmark.PersonCombinedSummaryStats.combinedStatistics_EC_Eager_Serial

WARNING: Not a HotSpot compiler command compatible VM ("anonymous-11.0.2"), compilerHints are disabled.
# Run progress: 0.00% complete, ETA 00:50:00
# Fork: 1 of 2
# Warmup Iteration   1: 73184.194 ops/s
# Warmup Iteration   2: 91344.488 ops/s
# Warmup Iteration   3: 92923.617 ops/s
# Warmup Iteration   4: 92746.186 ops/s
# Warmup Iteration   5: 92531.474 ops/s
# Warmup Iteration   6: 92544.378 ops/s
# Warmup Iteration   7: 92881.793 ops/s
# Warmup Iteration   8: 92960.645 ops/s
# Warmup Iteration   9: 92628.437 ops/s
# Warmup Iteration  10: 92767.426 ops/s
# Warmup Iteration  11: 92765.415 ops/s
# Warmup Iteration  12: 92749.360 ops/s
# Warmup Iteration  13: 92789.994 ops/s
# Warmup Iteration  14: 93050.133 ops/s
# Warmup Iteration  15: 92904.632 ops/s
# Warmup Iteration  16: 92641.566 ops/s
# Warmup Iteration  17: 92913.375 ops/s
# Warmup Iteration  18: 92968.080 ops/s
# Warmup Iteration  19: 92933.535 ops/s
# Warmup Iteration  20: 92830.014 ops/s
Iteration   1: 92898.008 ops/s
Iteration   2: 92814.235 ops/s
Iteration   3: 92858.269 ops/s
Iteration   4: 92966.854 ops/s
Iteration   5: 92750.989 ops/s
Iteration   6: 92746.636 ops/s
Iteration   7: 92823.590 ops/s
Iteration   8: 92836.078 ops/s
Iteration   9: 92788.048 ops/s
Iteration  10: 92966.578 ops/s

WARNING: Not a HotSpot compiler command compatible VM ("anonymous-11.0.2"), compilerHints are disabled.
# Run progress: 10.00% complete, ETA 00:45:09
# Fork: 2 of 2
# Warmup Iteration   1: 77493.511 ops/s
# Warmup Iteration   2: 89552.297 ops/s
# Warmup Iteration   3: 90305.522 ops/s
# Warmup Iteration   4: 91772.238 ops/s
# Warmup Iteration   5: 90916.240 ops/s
# Warmup Iteration   6: 91230.596 ops/s
# Warmup Iteration   7: 91519.793 ops/s
# Warmup Iteration   8: 91371.925 ops/s
# Warmup Iteration   9: 91413.046 ops/s
# Warmup Iteration  10: 91355.852 ops/s
# Warmup Iteration  11: 91552.262 ops/s
# Warmup Iteration  12: 91409.114 ops/s
# Warmup Iteration  13: 91492.049 ops/s
# Warmup Iteration  14: 91548.090 ops/s
# Warmup Iteration  15: 91284.926 ops/s
# Warmup Iteration  16: 91267.888 ops/s
# Warmup Iteration  17: 91614.500 ops/s
# Warmup Iteration  18: 91626.124 ops/s
# Warmup Iteration  19: 91634.879 ops/s
# Warmup Iteration  20: 91570.944 ops/s
Iteration   1: 91606.888 ops/s
Iteration   2: 91641.039 ops/s
Iteration   3: 91579.074 ops/s
Iteration   4: 91628.104 ops/s
Iteration   5: 91640.317 ops/s
Iteration   6: 91708.023 ops/s
Iteration   7: 91595.528 ops/s
Iteration   8: 91503.584 ops/s
Iteration   9: 91612.819 ops/s
Iteration  10: 91677.974 ops/s


Result "jvmscompare.benchmark.PersonCombinedSummaryStats.combinedStatistics_EC_Eager_Serial":
  92232.132 ±(99.9%) 548.992 ops/s [Average]
  (min, avg, max) = (91503.584, 92232.132, 92966.854), stdev = 632.220
  CI (99.9%): [91683.140, 92781.123] (assumes normal distribution)


# JMH version: 1.23
# VM version: JDK 11.0.2, anonymous, 11.0.2+9
# *** WARNING: This VM is not supported by JMH. The produced benchmark data can be completely wrong.
# VM invoker: /Library/Java/JavaVirtualMachines/openjdk-11.0.2.jdk/Contents/Home/bin/java
# VM options: -XX:+UnlockExperimentalVMOptions -XX:+EnableJVMCI -XX:+UseJVMCICompiler
# Warmup: 20 iterations, 10 s each
# Measurement: 10 iterations, 10 s each
# Timeout: 10 min per iteration
# Threads: 1 thread, will synchronize iterations
# Benchmark mode: Throughput, ops/time
# Benchmark: jvmscompare.benchmark.PersonCombinedSummaryStats.combinedStatistics_EC_Lazy_Serial

WARNING: Not a HotSpot compiler command compatible VM ("anonymous-11.0.2"), compilerHints are disabled.
# Run progress: 20.00% complete, ETA 00:40:07
# Fork: 1 of 2
# Warmup Iteration   1: 44855.981 ops/s
# Warmup Iteration   2: 55382.042 ops/s
# Warmup Iteration   3: 55413.214 ops/s
# Warmup Iteration   4: 55393.899 ops/s
# Warmup Iteration   5: 55190.860 ops/s
# Warmup Iteration   6: 55325.997 ops/s
# Warmup Iteration   7: 55423.354 ops/s
# Warmup Iteration   8: 55394.681 ops/s
# Warmup Iteration   9: 55399.505 ops/s
# Warmup Iteration  10: 55381.109 ops/s
# Warmup Iteration  11: 55401.570 ops/s
# Warmup Iteration  12: 55415.355 ops/s
# Warmup Iteration  13: 55400.058 ops/s
# Warmup Iteration  14: 55437.024 ops/s
# Warmup Iteration  15: 55424.701 ops/s
# Warmup Iteration  16: 55025.599 ops/s
# Warmup Iteration  17: 55488.471 ops/s
# Warmup Iteration  18: 55337.060 ops/s
# Warmup Iteration  19: 55477.039 ops/s
# Warmup Iteration  20: 55490.524 ops/s
Iteration   1: 55215.074 ops/s
Iteration   2: 55452.251 ops/s
Iteration   3: 55525.556 ops/s
Iteration   4: 55530.173 ops/s
Iteration   5: 55480.662 ops/s
Iteration   6: 55546.040 ops/s
Iteration   7: 55504.010 ops/s
Iteration   8: 55515.280 ops/s
Iteration   9: 55519.062 ops/s
Iteration  10: 55544.626 ops/s

WARNING: Not a HotSpot compiler command compatible VM ("anonymous-11.0.2"), compilerHints are disabled.
# Run progress: 30.00% complete, ETA 00:35:05
# Fork: 2 of 2
# Warmup Iteration   1: 44589.378 ops/s
# Warmup Iteration   2: 55089.264 ops/s
# Warmup Iteration   3: 55308.207 ops/s
# Warmup Iteration   4: 55308.574 ops/s
# Warmup Iteration   5: 55350.107 ops/s
# Warmup Iteration   6: 55177.656 ops/s
# Warmup Iteration   7: 55313.615 ops/s
# Warmup Iteration   8: 55360.375 ops/s
# Warmup Iteration   9: 55358.656 ops/s
# Warmup Iteration  10: 55328.927 ops/s
# Warmup Iteration  11: 55337.146 ops/s
# Warmup Iteration  12: 55180.953 ops/s
# Warmup Iteration  13: 55287.890 ops/s
# Warmup Iteration  14: 55335.094 ops/s
# Warmup Iteration  15: 55296.231 ops/s
# Warmup Iteration  16: 54978.393 ops/s
# Warmup Iteration  17: 55324.485 ops/s
# Warmup Iteration  18: 55386.749 ops/s
# Warmup Iteration  19: 55431.852 ops/s
# Warmup Iteration  20: 55465.457 ops/s
Iteration   1: 55393.499 ops/s
Iteration   2: 55322.576 ops/s
Iteration   3: 55476.557 ops/s
Iteration   4: 55247.012 ops/s
Iteration   5: 55425.319 ops/s
Iteration   6: 55444.289 ops/s
Iteration   7: 55479.433 ops/s
Iteration   8: 55380.931 ops/s
Iteration   9: 55447.920 ops/s
Iteration  10: 55448.827 ops/s


Result "jvmscompare.benchmark.PersonCombinedSummaryStats.combinedStatistics_EC_Lazy_Serial":
  55444.955 ±(99.9%) 81.047 ops/s [Average]
  (min, avg, max) = (55215.074, 55444.955, 55546.040), stdev = 93.333
  CI (99.9%): [55363.908, 55526.002] (assumes normal distribution)


# JMH version: 1.23
# VM version: JDK 11.0.2, anonymous, 11.0.2+9
# *** WARNING: This VM is not supported by JMH. The produced benchmark data can be completely wrong.
# VM invoker: /Library/Java/JavaVirtualMachines/openjdk-11.0.2.jdk/Contents/Home/bin/java
# VM options: -XX:+UnlockExperimentalVMOptions -XX:+EnableJVMCI -XX:+UseJVMCICompiler
# Warmup: 20 iterations, 10 s each
# Measurement: 10 iterations, 10 s each
# Timeout: 10 min per iteration
# Threads: 1 thread, will synchronize iterations
# Benchmark mode: Throughput, ops/time
# Benchmark: jvmscompare.benchmark.PersonCombinedSummaryStats.combinedStatistics_EC_Stream_Parallel

WARNING: Not a HotSpot compiler command compatible VM ("anonymous-11.0.2"), compilerHints are disabled.
# Run progress: 40.00% complete, ETA 00:30:04
# Fork: 1 of 2
# Warmup Iteration   1: 12254.293 ops/s
# Warmup Iteration   2: 10592.627 ops/s
# Warmup Iteration   3: 11226.798 ops/s
# Warmup Iteration   4: 10531.169 ops/s
# Warmup Iteration   5: 10538.282 ops/s
# Warmup Iteration   6: 11544.402 ops/s
# Warmup Iteration   7: 10564.716 ops/s
# Warmup Iteration   8: 10542.060 ops/s
# Warmup Iteration   9: 11762.067 ops/s
# Warmup Iteration  10: 11090.154 ops/s
# Warmup Iteration  11: 10540.235 ops/s
# Warmup Iteration  12: 11662.898 ops/s
# Warmup Iteration  13: 10819.644 ops/s
# Warmup Iteration  14: 11788.432 ops/s
# Warmup Iteration  15: 11231.818 ops/s
# Warmup Iteration  16: 11574.984 ops/s
# Warmup Iteration  17: 10579.345 ops/s
# Warmup Iteration  18: 10662.041 ops/s
# Warmup Iteration  19: 10570.845 ops/s
# Warmup Iteration  20: 10521.509 ops/s
Iteration   1: 10527.810 ops/s
Iteration   2: 10816.239 ops/s
Iteration   3: 11113.251 ops/s
Iteration   4: 10793.464 ops/s
Iteration   5: 10569.046 ops/s
Iteration   6: 10650.891 ops/s
Iteration   7: 10537.721 ops/s
Iteration   8: 10572.448 ops/s
Iteration   9: 10795.368 ops/s
Iteration  10: 11134.624 ops/s

WARNING: Not a HotSpot compiler command compatible VM ("anonymous-11.0.2"), compilerHints are disabled.
# Run progress: 50.00% complete, ETA 00:25:03
# Fork: 2 of 2
# Warmup Iteration   1: 10849.046 ops/s
# Warmup Iteration   2: 11141.717 ops/s
# Warmup Iteration   3: 11160.235 ops/s
# Warmup Iteration   4: 11675.376 ops/s
# Warmup Iteration   5: 11203.152 ops/s
# Warmup Iteration   6: 12236.306 ops/s
# Warmup Iteration   7: 10667.990 ops/s
# Warmup Iteration   8: 10659.858 ops/s
# Warmup Iteration   9: 10748.840 ops/s
# Warmup Iteration  10: 10663.274 ops/s
# Warmup Iteration  11: 11273.606 ops/s
# Warmup Iteration  12: 10657.284 ops/s
# Warmup Iteration  13: 11361.988 ops/s
# Warmup Iteration  14: 10681.687 ops/s
# Warmup Iteration  15: 10645.287 ops/s
# Warmup Iteration  16: 10921.442 ops/s
# Warmup Iteration  17: 10671.355 ops/s
# Warmup Iteration  18: 10679.666 ops/s
# Warmup Iteration  19: 10961.647 ops/s
# Warmup Iteration  20: 10654.151 ops/s
Iteration   1: 10663.140 ops/s
Iteration   2: 11386.886 ops/s
Iteration   3: 10950.630 ops/s
Iteration   4: 11031.782 ops/s
Iteration   5: 11141.697 ops/s
Iteration   6: 11012.133 ops/s
Iteration   7: 10664.307 ops/s
Iteration   8: 10672.597 ops/s
Iteration   9: 10657.528 ops/s
Iteration  10: 10670.486 ops/s


Result "jvmscompare.benchmark.PersonCombinedSummaryStats.combinedStatistics_EC_Stream_Parallel":
  10818.103 ±(99.9%) 213.369 ops/s [Average]
  (min, avg, max) = (10527.810, 10818.103, 11386.886), stdev = 245.717
  CI (99.9%): [10604.733, 11031.472] (assumes normal distribution)


# JMH version: 1.23
# VM version: JDK 11.0.2, anonymous, 11.0.2+9
# *** WARNING: This VM is not supported by JMH. The produced benchmark data can be completely wrong.
# VM invoker: /Library/Java/JavaVirtualMachines/openjdk-11.0.2.jdk/Contents/Home/bin/java
# VM options: -XX:+UnlockExperimentalVMOptions -XX:+EnableJVMCI -XX:+UseJVMCICompiler
# Warmup: 20 iterations, 10 s each
# Measurement: 10 iterations, 10 s each
# Timeout: 10 min per iteration
# Threads: 1 thread, will synchronize iterations
# Benchmark mode: Throughput, ops/time
# Benchmark: jvmscompare.benchmark.PersonCombinedSummaryStats.combinedStatistics_JDK_Stream_Parallel

WARNING: Not a HotSpot compiler command compatible VM ("anonymous-11.0.2"), compilerHints are disabled.
# Run progress: 60.00% complete, ETA 00:20:02
# Fork: 1 of 2
# Warmup Iteration   1: 10193.979 ops/s
# Warmup Iteration   2: 10501.899 ops/s
# Warmup Iteration   3: 10270.089 ops/s
# Warmup Iteration   4: 11197.502 ops/s
# Warmup Iteration   5: 10295.427 ops/s
# Warmup Iteration   6: 10627.227 ops/s
# Warmup Iteration   7: 10272.394 ops/s
# Warmup Iteration   8: 10287.899 ops/s
# Warmup Iteration   9: 10308.470 ops/s
# Warmup Iteration  10: 10292.649 ops/s
# Warmup Iteration  11: 10292.903 ops/s
# Warmup Iteration  12: 10292.814 ops/s
# Warmup Iteration  13: 10308.958 ops/s
# Warmup Iteration  14: 10293.013 ops/s
# Warmup Iteration  15: 10297.108 ops/s
# Warmup Iteration  16: 10304.352 ops/s
# Warmup Iteration  17: 10940.751 ops/s
# Warmup Iteration  18: 10264.895 ops/s
# Warmup Iteration  19: 10946.405 ops/s
# Warmup Iteration  20: 10278.426 ops/s
Iteration   1: 10299.431 ops/s
Iteration   2: 10288.710 ops/s
Iteration   3: 10282.039 ops/s
Iteration   4: 10290.039 ops/s
Iteration   5: 11130.940 ops/s
Iteration   6: 10268.029 ops/s
Iteration   7: 10264.983 ops/s
Iteration   8: 10261.145 ops/s
Iteration   9: 10257.643 ops/s
Iteration  10: 10953.342 ops/s

WARNING: Not a HotSpot compiler command compatible VM ("anonymous-11.0.2"), compilerHints are disabled.
# Run progress: 70.00% complete, ETA 00:15:02
# Fork: 2 of 2
# Warmup Iteration   1: 10188.071 ops/s
# Warmup Iteration   2: 10355.980 ops/s
# Warmup Iteration   3: 10728.978 ops/s
# Warmup Iteration   4: 10397.198 ops/s
# Warmup Iteration   5: 11320.218 ops/s
# Warmup Iteration   6: 10410.628 ops/s
# Warmup Iteration   7: 12059.862 ops/s
# Warmup Iteration   8: 10552.410 ops/s
# Warmup Iteration   9: 10399.716 ops/s
# Warmup Iteration  10: 10915.904 ops/s
# Warmup Iteration  11: 10403.179 ops/s
# Warmup Iteration  12: 11013.705 ops/s
# Warmup Iteration  13: 10515.504 ops/s
# Warmup Iteration  14: 11312.240 ops/s
# Warmup Iteration  15: 10668.685 ops/s
# Warmup Iteration  16: 10745.790 ops/s
# Warmup Iteration  17: 10374.234 ops/s
# Warmup Iteration  18: 10378.770 ops/s
# Warmup Iteration  19: 10373.158 ops/s
# Warmup Iteration  20: 10369.547 ops/s
Iteration   1: 11343.640 ops/s
Iteration   2: 10408.010 ops/s
Iteration   3: 11365.720 ops/s
Iteration   4: 11270.483 ops/s
Iteration   5: 11554.470 ops/s
Iteration   6: 10368.084 ops/s
Iteration   7: 10398.118 ops/s
Iteration   8: 10828.569 ops/s
Iteration   9: 10395.977 ops/s
Iteration  10: 10337.185 ops/s


Result "jvmscompare.benchmark.PersonCombinedSummaryStats.combinedStatistics_JDK_Stream_Parallel":
  10628.328 ±(99.9%) 399.614 ops/s [Average]
  (min, avg, max) = (10257.643, 10628.328, 11554.470), stdev = 460.196
  CI (99.9%): [10228.714, 11027.941] (assumes normal distribution)


# JMH version: 1.23
# VM version: JDK 11.0.2, anonymous, 11.0.2+9
# *** WARNING: This VM is not supported by JMH. The produced benchmark data can be completely wrong.
# VM invoker: /Library/Java/JavaVirtualMachines/openjdk-11.0.2.jdk/Contents/Home/bin/java
# VM options: -XX:+UnlockExperimentalVMOptions -XX:+EnableJVMCI -XX:+UseJVMCICompiler
# Warmup: 20 iterations, 10 s each
# Measurement: 10 iterations, 10 s each
# Timeout: 10 min per iteration
# Threads: 1 thread, will synchronize iterations
# Benchmark mode: Throughput, ops/time
# Benchmark: jvmscompare.benchmark.PersonCombinedSummaryStats.combinedStatistics_JDK_Stream_Serial

WARNING: Not a HotSpot compiler command compatible VM ("anonymous-11.0.2"), compilerHints are disabled.
# Run progress: 80.00% complete, ETA 00:10:01
# Fork: 1 of 2
# Warmup Iteration   1: 47288.362 ops/s
# Warmup Iteration   2: 55721.687 ops/s
# Warmup Iteration   3: 56373.801 ops/s
# Warmup Iteration   4: 56373.305 ops/s
# Warmup Iteration   5: 56396.068 ops/s
# Warmup Iteration   6: 56352.565 ops/s
# Warmup Iteration   7: 56512.972 ops/s
# Warmup Iteration   8: 56518.624 ops/s
# Warmup Iteration   9: 56456.463 ops/s
# Warmup Iteration  10: 56531.963 ops/s
# Warmup Iteration  11: 56499.354 ops/s
# Warmup Iteration  12: 56294.647 ops/s
# Warmup Iteration  13: 56430.781 ops/s
# Warmup Iteration  14: 56491.939 ops/s
# Warmup Iteration  15: 56452.779 ops/s
# Warmup Iteration  16: 56397.200 ops/s
# Warmup Iteration  17: 56476.637 ops/s
# Warmup Iteration  18: 56432.369 ops/s
# Warmup Iteration  19: 56479.945 ops/s
# Warmup Iteration  20: 56543.888 ops/s
Iteration   1: 56452.762 ops/s
Iteration   2: 56526.589 ops/s
Iteration   3: 56488.137 ops/s
Iteration   4: 56445.048 ops/s
Iteration   5: 56145.008 ops/s
Iteration   6: 56474.080 ops/s
Iteration   7: 56434.402 ops/s
Iteration   8: 56484.907 ops/s
Iteration   9: 56464.502 ops/s
Iteration  10: 56462.511 ops/s

WARNING: Not a HotSpot compiler command compatible VM ("anonymous-11.0.2"), compilerHints are disabled.
# Run progress: 90.00% complete, ETA 00:05:00
# Fork: 2 of 2
# Warmup Iteration   1: 46467.363 ops/s
# Warmup Iteration   2: 55929.399 ops/s
# Warmup Iteration   3: 56004.195 ops/s
# Warmup Iteration   4: 56058.620 ops/s
# Warmup Iteration   5: 56080.652 ops/s
# Warmup Iteration   6: 55999.872 ops/s
# Warmup Iteration   7: 56103.345 ops/s
# Warmup Iteration   8: 56097.462 ops/s
# Warmup Iteration   9: 56020.677 ops/s
# Warmup Iteration  10: 56080.569 ops/s
# Warmup Iteration  11: 56002.950 ops/s
# Warmup Iteration  12: 56038.109 ops/s
# Warmup Iteration  13: 56097.202 ops/s
# Warmup Iteration  14: 55846.032 ops/s
# Warmup Iteration  15: 56075.491 ops/s
# Warmup Iteration  16: 56111.984 ops/s
# Warmup Iteration  17: 56139.158 ops/s
# Warmup Iteration  18: 56102.947 ops/s
# Warmup Iteration  19: 55387.550 ops/s
# Warmup Iteration  20: 56155.790 ops/s
Iteration   1: 56105.628 ops/s
Iteration   2: 56148.737 ops/s
Iteration   3: 56129.295 ops/s
Iteration   4: 56071.875 ops/s
Iteration   5: 56133.200 ops/s
Iteration   6: 56108.397 ops/s
Iteration   7: 56111.761 ops/s
Iteration   8: 56165.412 ops/s
Iteration   9: 56120.488 ops/s
Iteration  10: 55653.236 ops/s


Result "jvmscompare.benchmark.PersonCombinedSummaryStats.combinedStatistics_JDK_Stream_Serial":
  56256.299 ±(99.9%) 195.537 ops/s [Average]
  (min, avg, max) = (55653.236, 56256.299, 56526.589), stdev = 225.181
  CI (99.9%): [56060.762, 56451.836] (assumes normal distribution)


# Run complete. Total time: 00:50:06

REMEMBER: The numbers below are just data. To gain reusable insights, you need to follow up on
why the numbers are the way they are. Use profilers (see -prof, -lprof), design factorial
experiments, perform baseline and negative tests that provide experimental control, make sure
the benchmarking environment is safe on JVM/OS/HW level, ask for reviews from the domain experts.
Do not assume the numbers tell you what you want them to tell.

Benchmark                                                           Mode  Cnt      Score     Error  Units
PersonCombinedSummaryStats.combinedStatistics_EC_Eager_Serial      thrpt   20  92232.132 ± 548.992  ops/s
PersonCombinedSummaryStats.combinedStatistics_EC_Lazy_Serial       thrpt   20  55444.955 ±  81.047  ops/s
PersonCombinedSummaryStats.combinedStatistics_EC_Stream_Parallel   thrpt   20  10818.103 ± 213.369  ops/s
PersonCombinedSummaryStats.combinedStatistics_JDK_Stream_Parallel  thrpt   20  10628.328 ± 399.614  ops/s
PersonCombinedSummaryStats.combinedStatistics_JDK_Stream_Serial    thrpt   20  56256.299 ± 195.537  ops/s

Benchmark result is saved to benchmark-results/person-combined-summary-stats/07_OpenJDKGraalPersonCombinedSummaryStats.csv
[INFO] ------------------------------------------------------------------------
[INFO] BUILD SUCCESS
[INFO] ------------------------------------------------------------------------
[INFO] Total time:  50:19 min
[INFO] Finished at: 2020-01-28T01:52:51-05:00
[INFO] ------------------------------------------------------------------------
