[INFO] Scanning for projects...
[INFO] 
[INFO] ---------------------< jvms-compare:jvms-compare >----------------------
[INFO] Building JVMs Compare 1.0.0
[INFO] --------------------------------[ jar ]---------------------------------
[INFO] 
[INFO] --- maven-clean-plugin:2.5:clean (default-clean) @ jvms-compare ---
[INFO] Deleting /Users/cguntur/projects/conf/jvms-compare/target
[INFO] 
[INFO] --- maven-toolchains-plugin:1.1:toolchain (default) @ jvms-compare ---
[INFO] Required toolchain: jdk [ vendor='openjdk' version='11' ]
[INFO] Found matching toolchain for type jdk: JDK[/Library/Java/JavaVirtualMachines/openjdk-11.0.2.jdk/Contents/Home/]
[INFO] 
[INFO] --- maven-dependency-plugin:3.1.1:build-classpath (build-classpath) @ jvms-compare ---
[INFO] Dependencies classpath:
/Users/cguntur/.m2/repository/org/apache/commons/commons-math3/3.2/commons-math3-3.2.jar:/Users/cguntur/.m2/repository/org/junit/jupiter/junit-jupiter-api/5.5.0/junit-jupiter-api-5.5.0.jar:/Users/cguntur/.m2/repository/org/eclipse/collections/eclipse-collections/10.0.0/eclipse-collections-10.0.0.jar:/Users/cguntur/.m2/repository/javax/annotation/javax.annotation-api/1.3.1/javax.annotation-api-1.3.1.jar:/Users/cguntur/.m2/repository/org/junit/platform/junit-platform-engine/1.5.0/junit-platform-engine-1.5.0.jar:/Users/cguntur/.m2/repository/org/junit/platform/junit-platform-commons/1.5.0/junit-platform-commons-1.5.0.jar:/Users/cguntur/.m2/repository/org/junit/jupiter/junit-jupiter-params/5.5.0/junit-jupiter-params-5.5.0.jar:/Users/cguntur/.m2/repository/org/junit/jupiter/junit-jupiter-engine/5.5.0/junit-jupiter-engine-5.5.0.jar:/Users/cguntur/.m2/repository/org/openjdk/jmh/jmh-core/1.21/jmh-core-1.21.jar:/Users/cguntur/.m2/repository/org/junit/jupiter/junit-jupiter/5.5.0/junit-jupiter-5.5.0.jar:/Users/cguntur/.m2/repository/org/opentest4j/opentest4j/1.2.0/opentest4j-1.2.0.jar:/Users/cguntur/.m2/repository/org/apiguardian/apiguardian-api/1.1.0/apiguardian-api-1.1.0.jar:/Users/cguntur/.m2/repository/net/sf/jopt-simple/jopt-simple/4.6/jopt-simple-4.6.jar:/Users/cguntur/.m2/repository/org/eclipse/collections/eclipse-collections-api/10.0.0/eclipse-collections-api-10.0.0.jar
[INFO] 
[INFO] --- maven-resources-plugin:2.6:resources (default-resources) @ jvms-compare ---
[INFO] Using 'UTF-8' encoding to copy filtered resources.
[INFO] Copying 1 resource
[INFO] 
[INFO] --- maven-compiler-plugin:3.8.1:compile (default-compile) @ jvms-compare ---
[INFO] Toolchain in maven-compiler-plugin: JDK[/Library/Java/JavaVirtualMachines/openjdk-11.0.2.jdk/Contents/Home/]
[INFO] Changes detected - recompiling the module!
[INFO] Compiling 10 source files to /Users/cguntur/projects/conf/jvms-compare/target/classes
[INFO] 
[INFO] --- maven-resources-plugin:2.6:testResources (default-testResources) @ jvms-compare ---
[INFO] Using 'UTF-8' encoding to copy filtered resources.
[INFO] Copying 1 resource
[INFO] 
[INFO] --- maven-compiler-plugin:3.8.1:testCompile (default-testCompile) @ jvms-compare ---
[INFO] Toolchain in maven-compiler-plugin: JDK[/Library/Java/JavaVirtualMachines/openjdk-11.0.2.jdk/Contents/Home/]
[INFO] Changes detected - recompiling the module!
[INFO] Compiling 2 source files to /Users/cguntur/projects/conf/jvms-compare/target/test-classes
[INFO] 
[INFO] --- maven-surefire-plugin:2.12.4:test (default-test) @ jvms-compare ---
[INFO] Toolchain in surefire-plugin: JDK[/Library/Java/JavaVirtualMachines/openjdk-11.0.2.jdk/Contents/Home/]
[INFO] Surefire report directory: /Users/cguntur/projects/conf/jvms-compare/target/surefire-reports

-------------------------------------------------------
 T E S T S
-------------------------------------------------------
Running jvmscompare.PersonTest
Tests run: 3, Failures: 0, Errors: 0, Skipped: 0, Time elapsed: 1.43 sec
Running jvmscompare.IntListTest
Tests run: 3, Failures: 0, Errors: 0, Skipped: 0, Time elapsed: 1.407 sec

Results :

Tests run: 6, Failures: 0, Errors: 0, Skipped: 0

[INFO] 
[INFO] --- exec-maven-plugin:1.6.0:exec (combinedSummaryStats) @ jvms-compare ---
[INFO] Toolchain in exec-maven-plugin: JDK[/Library/Java/JavaVirtualMachines/openjdk-11.0.2.jdk/Contents/Home/]
Java Runtime Environment version: 11.0.2
Java Runtime Environment vendor: Oracle Corporation

Java Runtime Name: OpenJDK Runtime Environment
Java Runtime Version: 11.0.2+9

Java Virtual Machine name: OpenJDK 64-Bit Server VM
Java Virtual Machine vendor: Oracle Corporation
Java Virtual Machine version: 11.0.2+9

Java Class Version: 55.0

Benchmark size: 100
Benchmark forks: 2
Benchmark warmups: 20
Benchmark measurements: 10

WARNING: An illegal reflective access operation has occurred
WARNING: Illegal reflective access by org.openjdk.jmh.util.Utils (file:/Users/cguntur/.m2/repository/org/openjdk/jmh/jmh-core/1.21/jmh-core-1.21.jar) to field java.io.PrintStream.charOut
WARNING: Please consider reporting this to the maintainers of org.openjdk.jmh.util.Utils
WARNING: Use --illegal-access=warn to enable warnings of further illegal reflective access operations
WARNING: All illegal access operations will be denied in a future release
# JMH version: 1.21
# VM version: JDK 11.0.2, OpenJDK 64-Bit Server VM, 11.0.2+9
# VM invoker: /Library/Java/JavaVirtualMachines/openjdk-11.0.2.jdk/Contents/Home/bin/java
# VM options: -XX:+UnlockExperimentalVMOptions -XX:+EnableJVMCI -XX:+UseJVMCICompiler
# Warmup: 20 iterations, 10 s each
# Measurement: 10 iterations, 10 s each
# Timeout: 10 min per iteration
# Threads: 1 thread, will synchronize iterations
# Benchmark mode: Throughput, ops/time
# Benchmark: jvmscompare.benchmark.PersonCombinedSummaryStats.combinedStatistics_EC_Eager_Serial

# Run progress: 0.00% complete, ETA 00:50:00
# Fork: 1 of 2
# Warmup Iteration   1: 716164.391 ops/s
# Warmup Iteration   2: 922190.395 ops/s
# Warmup Iteration   3: 935324.862 ops/s
# Warmup Iteration   4: 937614.046 ops/s
# Warmup Iteration   5: 937720.265 ops/s
# Warmup Iteration   6: 937469.854 ops/s
# Warmup Iteration   7: 938463.701 ops/s
# Warmup Iteration   8: 938319.194 ops/s
# Warmup Iteration   9: 937057.031 ops/s
# Warmup Iteration  10: 938575.637 ops/s
# Warmup Iteration  11: 936356.947 ops/s
# Warmup Iteration  12: 935660.557 ops/s
# Warmup Iteration  13: 931774.732 ops/s
# Warmup Iteration  14: 930434.847 ops/s
# Warmup Iteration  15: 937118.587 ops/s
# Warmup Iteration  16: 935118.629 ops/s
# Warmup Iteration  17: 902821.882 ops/s
# Warmup Iteration  18: 935459.921 ops/s
# Warmup Iteration  19: 934479.781 ops/s
# Warmup Iteration  20: 935829.251 ops/s
Iteration   1: 937064.351 ops/s
Iteration   2: 935483.069 ops/s
Iteration   3: 937332.444 ops/s
Iteration   4: 937817.875 ops/s
Iteration   5: 937122.629 ops/s
Iteration   6: 936322.008 ops/s
Iteration   7: 936240.339 ops/s
Iteration   8: 937658.728 ops/s
Iteration   9: 936502.955 ops/s
Iteration  10: 937024.151 ops/s

# Run progress: 10.00% complete, ETA 00:45:08
# Fork: 2 of 2
# Warmup Iteration   1: 799315.219 ops/s
# Warmup Iteration   2: 930923.091 ops/s
# Warmup Iteration   3: 941355.714 ops/s
# Warmup Iteration   4: 934793.961 ops/s
# Warmup Iteration   5: 942593.316 ops/s
# Warmup Iteration   6: 942652.117 ops/s
# Warmup Iteration   7: 942117.123 ops/s
# Warmup Iteration   8: 942599.315 ops/s
# Warmup Iteration   9: 942328.683 ops/s
# Warmup Iteration  10: 942561.261 ops/s
# Warmup Iteration  11: 943129.542 ops/s
# Warmup Iteration  12: 942238.072 ops/s
# Warmup Iteration  13: 942720.847 ops/s
# Warmup Iteration  14: 941763.926 ops/s
# Warmup Iteration  15: 942816.871 ops/s
# Warmup Iteration  16: 942115.162 ops/s
# Warmup Iteration  17: 940582.845 ops/s
# Warmup Iteration  18: 940399.254 ops/s
# Warmup Iteration  19: 941693.361 ops/s
# Warmup Iteration  20: 942682.739 ops/s
Iteration   1: 941212.160 ops/s
Iteration   2: 941918.884 ops/s
Iteration   3: 941893.124 ops/s
Iteration   4: 940550.185 ops/s
Iteration   5: 941682.843 ops/s
Iteration   6: 941500.324 ops/s
Iteration   7: 941588.306 ops/s
Iteration   8: 942745.623 ops/s
Iteration   9: 942742.703 ops/s
Iteration  10: 941213.459 ops/s


Result "jvmscompare.benchmark.PersonCombinedSummaryStats.combinedStatistics_EC_Eager_Serial":
  939280.808 ±(99.9%) 2238.298 ops/s [Average]
  (min, avg, max) = (935483.069, 939280.808, 942745.623), stdev = 2577.627
  CI (99.9%): [937042.510, 941519.106] (assumes normal distribution)


# JMH version: 1.21
# VM version: JDK 11.0.2, OpenJDK 64-Bit Server VM, 11.0.2+9
# VM invoker: /Library/Java/JavaVirtualMachines/openjdk-11.0.2.jdk/Contents/Home/bin/java
# VM options: -XX:+UnlockExperimentalVMOptions -XX:+EnableJVMCI -XX:+UseJVMCICompiler
# Warmup: 20 iterations, 10 s each
# Measurement: 10 iterations, 10 s each
# Timeout: 10 min per iteration
# Threads: 1 thread, will synchronize iterations
# Benchmark mode: Throughput, ops/time
# Benchmark: jvmscompare.benchmark.PersonCombinedSummaryStats.combinedStatistics_EC_Lazy_Serial

# Run progress: 20.00% complete, ETA 00:40:06
# Fork: 1 of 2
# Warmup Iteration   1: 439864.572 ops/s
# Warmup Iteration   2: 544176.193 ops/s
# Warmup Iteration   3: 553086.400 ops/s
# Warmup Iteration   4: 553491.449 ops/s
# Warmup Iteration   5: 553805.194 ops/s
# Warmup Iteration   6: 553547.583 ops/s
# Warmup Iteration   7: 553290.107 ops/s
# Warmup Iteration   8: 552735.218 ops/s
# Warmup Iteration   9: 553093.805 ops/s
# Warmup Iteration  10: 553888.246 ops/s
# Warmup Iteration  11: 553520.031 ops/s
# Warmup Iteration  12: 553523.767 ops/s
# Warmup Iteration  13: 548600.618 ops/s
# Warmup Iteration  14: 552251.431 ops/s
# Warmup Iteration  15: 552324.506 ops/s
# Warmup Iteration  16: 549678.955 ops/s
# Warmup Iteration  17: 553445.653 ops/s
# Warmup Iteration  18: 552078.186 ops/s
# Warmup Iteration  19: 553397.958 ops/s
# Warmup Iteration  20: 553713.573 ops/s
Iteration   1: 553281.259 ops/s
Iteration   2: 553738.541 ops/s
Iteration   3: 553235.183 ops/s
Iteration   4: 552875.692 ops/s
Iteration   5: 553031.158 ops/s
Iteration   6: 553708.150 ops/s
Iteration   7: 553352.127 ops/s
Iteration   8: 553562.751 ops/s
Iteration   9: 553529.699 ops/s
Iteration  10: 552850.109 ops/s

# Run progress: 30.00% complete, ETA 00:35:05
# Fork: 2 of 2
# Warmup Iteration   1: 441421.123 ops/s
# Warmup Iteration   2: 556366.148 ops/s
# Warmup Iteration   3: 561104.784 ops/s
# Warmup Iteration   4: 562250.694 ops/s
# Warmup Iteration   5: 562219.117 ops/s
# Warmup Iteration   6: 561614.266 ops/s
# Warmup Iteration   7: 562153.940 ops/s
# Warmup Iteration   8: 562298.248 ops/s
# Warmup Iteration   9: 560979.860 ops/s
# Warmup Iteration  10: 562331.370 ops/s
# Warmup Iteration  11: 560273.745 ops/s
# Warmup Iteration  12: 561187.300 ops/s
# Warmup Iteration  13: 561693.650 ops/s
# Warmup Iteration  14: 561784.138 ops/s
# Warmup Iteration  15: 561854.674 ops/s
# Warmup Iteration  16: 562162.543 ops/s
# Warmup Iteration  17: 562066.359 ops/s
# Warmup Iteration  18: 561381.072 ops/s
# Warmup Iteration  19: 558535.101 ops/s
# Warmup Iteration  20: 562937.441 ops/s
Iteration   1: 565135.232 ops/s
Iteration   2: 565274.003 ops/s
Iteration   3: 565265.057 ops/s
Iteration   4: 565009.107 ops/s
Iteration   5: 564719.908 ops/s
Iteration   6: 565138.025 ops/s
Iteration   7: 565246.978 ops/s
Iteration   8: 565072.039 ops/s
Iteration   9: 565188.373 ops/s
Iteration  10: 564824.253 ops/s


Result "jvmscompare.benchmark.PersonCombinedSummaryStats.combinedStatistics_EC_Lazy_Serial":
  559201.882 ±(99.9%) 5248.158 ops/s [Average]
  (min, avg, max) = (552850.109, 559201.882, 565274.003), stdev = 6043.787
  CI (99.9%): [553953.724, 564450.040] (assumes normal distribution)


# JMH version: 1.21
# VM version: JDK 11.0.2, OpenJDK 64-Bit Server VM, 11.0.2+9
# VM invoker: /Library/Java/JavaVirtualMachines/openjdk-11.0.2.jdk/Contents/Home/bin/java
# VM options: -XX:+UnlockExperimentalVMOptions -XX:+EnableJVMCI -XX:+UseJVMCICompiler
# Warmup: 20 iterations, 10 s each
# Measurement: 10 iterations, 10 s each
# Timeout: 10 min per iteration
# Threads: 1 thread, will synchronize iterations
# Benchmark mode: Throughput, ops/time
# Benchmark: jvmscompare.benchmark.PersonCombinedSummaryStats.combinedStatistics_EC_Stream_Parallel

# Run progress: 40.00% complete, ETA 00:30:04
# Fork: 1 of 2
# Warmup Iteration   1: 18714.837 ops/s
# Warmup Iteration   2: 18126.492 ops/s
# Warmup Iteration   3: 16335.394 ops/s
# Warmup Iteration   4: 16363.195 ops/s
# Warmup Iteration   5: 16408.265 ops/s
# Warmup Iteration   6: 16413.870 ops/s
# Warmup Iteration   7: 16378.864 ops/s
# Warmup Iteration   8: 16363.511 ops/s
# Warmup Iteration   9: 16409.126 ops/s
# Warmup Iteration  10: 16371.067 ops/s
# Warmup Iteration  11: 16711.844 ops/s
# Warmup Iteration  12: 19014.417 ops/s
# Warmup Iteration  13: 16205.995 ops/s
# Warmup Iteration  14: 16919.042 ops/s
# Warmup Iteration  15: 17628.640 ops/s
# Warmup Iteration  16: 16378.259 ops/s
# Warmup Iteration  17: 16425.530 ops/s
# Warmup Iteration  18: 16974.689 ops/s
# Warmup Iteration  19: 16370.116 ops/s
# Warmup Iteration  20: 16404.235 ops/s
Iteration   1: 16737.354 ops/s
Iteration   2: 16404.853 ops/s
Iteration   3: 16366.959 ops/s
Iteration   4: 16357.850 ops/s
Iteration   5: 16393.972 ops/s
Iteration   6: 16369.844 ops/s
Iteration   7: 16728.090 ops/s
Iteration   8: 16772.328 ops/s
Iteration   9: 16397.852 ops/s
Iteration  10: 16381.169 ops/s

# Run progress: 50.00% complete, ETA 00:25:03
# Fork: 2 of 2
# Warmup Iteration   1: 19443.534 ops/s
# Warmup Iteration   2: 18148.968 ops/s
# Warmup Iteration   3: 16539.068 ops/s
# Warmup Iteration   4: 16553.005 ops/s
# Warmup Iteration   5: 20464.688 ops/s
# Warmup Iteration   6: 16561.778 ops/s
# Warmup Iteration   7: 16722.013 ops/s
# Warmup Iteration   8: 16593.669 ops/s
# Warmup Iteration   9: 16965.411 ops/s
# Warmup Iteration  10: 16730.755 ops/s
# Warmup Iteration  11: 19168.923 ops/s
# Warmup Iteration  12: 20567.501 ops/s
# Warmup Iteration  13: 16884.560 ops/s
# Warmup Iteration  14: 16542.800 ops/s
# Warmup Iteration  15: 16545.748 ops/s
# Warmup Iteration  16: 16573.218 ops/s
# Warmup Iteration  17: 16958.485 ops/s
# Warmup Iteration  18: 16509.509 ops/s
# Warmup Iteration  19: 16547.866 ops/s
# Warmup Iteration  20: 16550.680 ops/s
Iteration   1: 16509.749 ops/s
Iteration   2: 16552.496 ops/s
Iteration   3: 17362.569 ops/s
Iteration   4: 16457.445 ops/s
Iteration   5: 16820.349 ops/s
Iteration   6: 16489.090 ops/s
Iteration   7: 16720.296 ops/s
Iteration   8: 16547.918 ops/s
Iteration   9: 16569.053 ops/s
Iteration  10: 16525.816 ops/s


Result "jvmscompare.benchmark.PersonCombinedSummaryStats.combinedStatistics_EC_Stream_Parallel":
  16573.253 ±(99.9%) 207.278 ops/s [Average]
  (min, avg, max) = (16357.850, 16573.253, 17362.569), stdev = 238.702
  CI (99.9%): [16365.974, 16780.531] (assumes normal distribution)


# JMH version: 1.21
# VM version: JDK 11.0.2, OpenJDK 64-Bit Server VM, 11.0.2+9
# VM invoker: /Library/Java/JavaVirtualMachines/openjdk-11.0.2.jdk/Contents/Home/bin/java
# VM options: -XX:+UnlockExperimentalVMOptions -XX:+EnableJVMCI -XX:+UseJVMCICompiler
# Warmup: 20 iterations, 10 s each
# Measurement: 10 iterations, 10 s each
# Timeout: 10 min per iteration
# Threads: 1 thread, will synchronize iterations
# Benchmark mode: Throughput, ops/time
# Benchmark: jvmscompare.benchmark.PersonCombinedSummaryStats.combinedStatistics_JDK_Stream_Parallel

# Run progress: 60.00% complete, ETA 00:20:02
# Fork: 1 of 2
# Warmup Iteration   1: 19959.961 ops/s
# Warmup Iteration   2: 16865.189 ops/s
# Warmup Iteration   3: 17134.779 ops/s
# Warmup Iteration   4: 16836.596 ops/s
# Warmup Iteration   5: 16820.077 ops/s
# Warmup Iteration   6: 16838.231 ops/s
# Warmup Iteration   7: 16888.662 ops/s
# Warmup Iteration   8: 16798.664 ops/s
# Warmup Iteration   9: 17184.895 ops/s
# Warmup Iteration  10: 16804.469 ops/s
# Warmup Iteration  11: 16803.624 ops/s
# Warmup Iteration  12: 16822.824 ops/s
# Warmup Iteration  13: 16628.749 ops/s
# Warmup Iteration  14: 24512.391 ops/s
# Warmup Iteration  15: 16766.829 ops/s
# Warmup Iteration  16: 16799.070 ops/s
# Warmup Iteration  17: 16834.091 ops/s
# Warmup Iteration  18: 17165.534 ops/s
# Warmup Iteration  19: 16778.530 ops/s
# Warmup Iteration  20: 17015.793 ops/s
Iteration   1: 16828.815 ops/s
Iteration   2: 17167.699 ops/s
Iteration   3: 17306.563 ops/s
Iteration   4: 16791.707 ops/s
Iteration   5: 16811.210 ops/s
Iteration   6: 17199.670 ops/s
Iteration   7: 17662.421 ops/s
Iteration   8: 16750.657 ops/s
Iteration   9: 16810.603 ops/s
Iteration  10: 17146.537 ops/s

# Run progress: 70.00% complete, ETA 00:15:02
# Fork: 2 of 2
# Warmup Iteration   1: 21756.109 ops/s
# Warmup Iteration   2: 17632.750 ops/s
# Warmup Iteration   3: 16850.801 ops/s
# Warmup Iteration   4: 16520.864 ops/s
# Warmup Iteration   5: 16541.140 ops/s
# Warmup Iteration   6: 16885.602 ops/s
# Warmup Iteration   7: 16523.223 ops/s
# Warmup Iteration   8: 16557.092 ops/s
# Warmup Iteration   9: 16560.815 ops/s
# Warmup Iteration  10: 16541.182 ops/s
# Warmup Iteration  11: 16943.008 ops/s
# Warmup Iteration  12: 16558.630 ops/s
# Warmup Iteration  13: 16693.285 ops/s
# Warmup Iteration  14: 16539.082 ops/s
# Warmup Iteration  15: 16577.916 ops/s
# Warmup Iteration  16: 16564.282 ops/s
# Warmup Iteration  17: 16922.278 ops/s
# Warmup Iteration  18: 16468.983 ops/s
# Warmup Iteration  19: 16562.126 ops/s
# Warmup Iteration  20: 16517.837 ops/s
Iteration   1: 16485.234 ops/s
Iteration   2: 16505.558 ops/s
Iteration   3: 16521.340 ops/s
Iteration   4: 16488.644 ops/s
Iteration   5: 16514.584 ops/s
Iteration   6: 17204.566 ops/s
Iteration   7: 16528.771 ops/s
Iteration   8: 16904.863 ops/s
Iteration   9: 16467.427 ops/s
Iteration  10: 17048.982 ops/s


Result "jvmscompare.benchmark.PersonCombinedSummaryStats.combinedStatistics_JDK_Stream_Parallel":
  16857.293 ±(99.9%) 296.555 ops/s [Average]
  (min, avg, max) = (16467.427, 16857.293, 17662.421), stdev = 341.513
  CI (99.9%): [16560.738, 17153.847] (assumes normal distribution)


# JMH version: 1.21
# VM version: JDK 11.0.2, OpenJDK 64-Bit Server VM, 11.0.2+9
# VM invoker: /Library/Java/JavaVirtualMachines/openjdk-11.0.2.jdk/Contents/Home/bin/java
# VM options: -XX:+UnlockExperimentalVMOptions -XX:+EnableJVMCI -XX:+UseJVMCICompiler
# Warmup: 20 iterations, 10 s each
# Measurement: 10 iterations, 10 s each
# Timeout: 10 min per iteration
# Threads: 1 thread, will synchronize iterations
# Benchmark mode: Throughput, ops/time
# Benchmark: jvmscompare.benchmark.PersonCombinedSummaryStats.combinedStatistics_JDK_Stream_Serial

# Run progress: 80.00% complete, ETA 00:10:01
# Fork: 1 of 2
# Warmup Iteration   1: 401137.836 ops/s
# Warmup Iteration   2: 491918.168 ops/s
# Warmup Iteration   3: 494490.717 ops/s
# Warmup Iteration   4: 494305.383 ops/s
# Warmup Iteration   5: 494807.855 ops/s
# Warmup Iteration   6: 494330.001 ops/s
# Warmup Iteration   7: 495002.104 ops/s
# Warmup Iteration   8: 494857.311 ops/s
# Warmup Iteration   9: 494623.631 ops/s
# Warmup Iteration  10: 495078.610 ops/s
# Warmup Iteration  11: 495096.430 ops/s
# Warmup Iteration  12: 494557.889 ops/s
# Warmup Iteration  13: 492283.367 ops/s
# Warmup Iteration  14: 493547.780 ops/s
# Warmup Iteration  15: 494355.066 ops/s
# Warmup Iteration  16: 494995.828 ops/s
# Warmup Iteration  17: 495280.234 ops/s
# Warmup Iteration  18: 494956.187 ops/s
# Warmup Iteration  19: 495014.550 ops/s
# Warmup Iteration  20: 495334.438 ops/s
Iteration   1: 495014.067 ops/s
Iteration   2: 495394.747 ops/s
Iteration   3: 494930.812 ops/s
Iteration   4: 494744.988 ops/s
Iteration   5: 495131.885 ops/s
Iteration   6: 495151.781 ops/s
Iteration   7: 493919.942 ops/s
Iteration   8: 494375.029 ops/s
Iteration   9: 495185.631 ops/s
Iteration  10: 494805.285 ops/s

# Run progress: 90.00% complete, ETA 00:05:00
# Fork: 2 of 2
# Warmup Iteration   1: 404034.905 ops/s
# Warmup Iteration   2: 495848.195 ops/s
# Warmup Iteration   3: 504507.175 ops/s
# Warmup Iteration   4: 505016.504 ops/s
# Warmup Iteration   5: 504904.392 ops/s
# Warmup Iteration   6: 504615.597 ops/s
# Warmup Iteration   7: 505116.135 ops/s
# Warmup Iteration   8: 504982.427 ops/s
# Warmup Iteration   9: 504572.235 ops/s
# Warmup Iteration  10: 505061.331 ops/s
# Warmup Iteration  11: 504348.641 ops/s
# Warmup Iteration  12: 504458.504 ops/s
# Warmup Iteration  13: 504708.702 ops/s
# Warmup Iteration  14: 503969.789 ops/s
# Warmup Iteration  15: 504394.657 ops/s
# Warmup Iteration  16: 505053.162 ops/s
# Warmup Iteration  17: 505355.668 ops/s
# Warmup Iteration  18: 505038.614 ops/s
# Warmup Iteration  19: 491171.986 ops/s
# Warmup Iteration  20: 505380.388 ops/s
Iteration   1: 505298.268 ops/s
Iteration   2: 505420.857 ops/s
Iteration   3: 505426.615 ops/s
Iteration   4: 503920.600 ops/s
Iteration   5: 505429.463 ops/s
Iteration   6: 505653.535 ops/s
Iteration   7: 505233.843 ops/s
Iteration   8: 505129.230 ops/s
Iteration   9: 505428.640 ops/s
Iteration  10: 505105.658 ops/s


Result "jvmscompare.benchmark.PersonCombinedSummaryStats.combinedStatistics_JDK_Stream_Serial":
  500035.044 ±(99.9%) 4621.981 ops/s [Average]
  (min, avg, max) = (493919.942, 500035.044, 505653.535), stdev = 5322.681
  CI (99.9%): [495413.062, 504657.025] (assumes normal distribution)


# Run complete. Total time: 00:50:06

REMEMBER: The numbers below are just data. To gain reusable insights, you need to follow up on
why the numbers are the way they are. Use profilers (see -prof, -lprof), design factorial
experiments, perform baseline and negative tests that provide experimental control, make sure
the benchmarking environment is safe on JVM/OS/HW level, ask for reviews from the domain experts.
Do not assume the numbers tell you what you want them to tell.

Benchmark                                                           Mode  Cnt       Score      Error  Units
PersonCombinedSummaryStats.combinedStatistics_EC_Eager_Serial      thrpt   20  939280.808 ± 2238.298  ops/s
PersonCombinedSummaryStats.combinedStatistics_EC_Lazy_Serial       thrpt   20  559201.882 ± 5248.158  ops/s
PersonCombinedSummaryStats.combinedStatistics_EC_Stream_Parallel   thrpt   20   16573.253 ±  207.278  ops/s
PersonCombinedSummaryStats.combinedStatistics_JDK_Stream_Parallel  thrpt   20   16857.293 ±  296.555  ops/s
PersonCombinedSummaryStats.combinedStatistics_JDK_Stream_Serial    thrpt   20  500035.044 ± 4621.981  ops/s

Benchmark result is saved to benchmark-results/person-combined-summary-stats/07_OpenJDKGraalPersonCombinedSummaryStats.csv
[INFO] ------------------------------------------------------------------------
[INFO] BUILD SUCCESS
[INFO] ------------------------------------------------------------------------
[INFO] Total time:  50:20 min
[INFO] Finished at: 2020-01-20T18:31:57-05:00
[INFO] ------------------------------------------------------------------------
