[INFO] Scanning for projects...
[INFO] 
[INFO] ---------------------< jvms-compare:jvms-compare >----------------------
[INFO] Building JVMs Compare 1.0.0
[INFO] --------------------------------[ jar ]---------------------------------
[INFO] 
[INFO] --- maven-clean-plugin:2.5:clean (default-clean) @ jvms-compare ---
[INFO] Deleting /Users/dr/projects/jvms-compare/target
[INFO] 
[INFO] --- maven-toolchains-plugin:1.1:toolchain (default) @ jvms-compare ---
[INFO] Required toolchain: jdk [ vendor='graalvmee' version='11' ]
[INFO] Found matching toolchain for type jdk: JDK[/Library/Java/JavaVirtualMachines/graalvm-ee-java11-19.3.1/]
[INFO] 
[INFO] --- maven-dependency-plugin:3.1.1:build-classpath (build-classpath) @ jvms-compare ---
[INFO] Dependencies classpath:
/Users/dr/.m2/repository/org/apache/commons/commons-math3/3.2/commons-math3-3.2.jar:/Users/dr/.m2/repository/org/junit/jupiter/junit-jupiter-api/5.5.0/junit-jupiter-api-5.5.0.jar:/Users/dr/.m2/repository/org/eclipse/collections/eclipse-collections/10.0.0/eclipse-collections-10.0.0.jar:/Users/dr/.m2/repository/javax/annotation/javax.annotation-api/1.3.1/javax.annotation-api-1.3.1.jar:/Users/dr/.m2/repository/org/junit/platform/junit-platform-engine/1.5.0/junit-platform-engine-1.5.0.jar:/Users/dr/.m2/repository/org/junit/platform/junit-platform-commons/1.5.0/junit-platform-commons-1.5.0.jar:/Users/dr/.m2/repository/org/junit/jupiter/junit-jupiter-params/5.5.0/junit-jupiter-params-5.5.0.jar:/Users/dr/.m2/repository/org/junit/jupiter/junit-jupiter-engine/5.5.0/junit-jupiter-engine-5.5.0.jar:/Users/dr/.m2/repository/org/junit/jupiter/junit-jupiter/5.5.0/junit-jupiter-5.5.0.jar:/Users/dr/.m2/repository/org/opentest4j/opentest4j/1.2.0/opentest4j-1.2.0.jar:/Users/dr/.m2/repository/org/openjdk/jmh/jmh-core/1.23/jmh-core-1.23.jar:/Users/dr/.m2/repository/org/apiguardian/apiguardian-api/1.1.0/apiguardian-api-1.1.0.jar:/Users/dr/.m2/repository/net/sf/jopt-simple/jopt-simple/4.6/jopt-simple-4.6.jar:/Users/dr/.m2/repository/org/eclipse/collections/eclipse-collections-api/10.0.0/eclipse-collections-api-10.0.0.jar
[INFO] 
[INFO] --- maven-resources-plugin:2.6:resources (default-resources) @ jvms-compare ---
[INFO] Using 'UTF-8' encoding to copy filtered resources.
[INFO] Copying 1 resource
[INFO] 
[INFO] --- maven-compiler-plugin:3.8.1:compile (default-compile) @ jvms-compare ---
[INFO] Toolchain in maven-compiler-plugin: JDK[/Library/Java/JavaVirtualMachines/graalvm-ee-java11-19.3.1/]
[INFO] Changes detected - recompiling the module!
[INFO] Compiling 10 source files to /Users/dr/projects/jvms-compare/target/classes
[INFO] 
[INFO] --- maven-resources-plugin:2.6:testResources (default-testResources) @ jvms-compare ---
[INFO] Using 'UTF-8' encoding to copy filtered resources.
[INFO] Copying 1 resource
[INFO] 
[INFO] --- maven-compiler-plugin:3.8.1:testCompile (default-testCompile) @ jvms-compare ---
[INFO] Toolchain in maven-compiler-plugin: JDK[/Library/Java/JavaVirtualMachines/graalvm-ee-java11-19.3.1/]
[INFO] Changes detected - recompiling the module!
[INFO] Compiling 2 source files to /Users/dr/projects/jvms-compare/target/test-classes
[INFO] 
[INFO] --- maven-surefire-plugin:2.12.4:test (default-test) @ jvms-compare ---
[INFO] Toolchain in surefire-plugin: JDK[/Library/Java/JavaVirtualMachines/graalvm-ee-java11-19.3.1/]
[INFO] Surefire report directory: /Users/dr/projects/jvms-compare/target/surefire-reports

-------------------------------------------------------
 T E S T S
-------------------------------------------------------
Running jvmscompare.PersonTest
Tests run: 3, Failures: 0, Errors: 0, Skipped: 0, Time elapsed: 1.41 sec
Running jvmscompare.IntListTest
Tests run: 3, Failures: 0, Errors: 0, Skipped: 0, Time elapsed: 1.108 sec

Results :

Tests run: 6, Failures: 0, Errors: 0, Skipped: 0

[INFO] 
[INFO] --- exec-maven-plugin:1.6.0:exec (combinedSummaryStats) @ jvms-compare ---
[INFO] Toolchain in exec-maven-plugin: JDK[/Library/Java/JavaVirtualMachines/graalvm-ee-java11-19.3.1/]
Java Runtime Environment version: 11.0.6
Java Runtime Environment vendor: Oracle Corporation

Java Runtime Name: Java(TM) SE Runtime Environment
Java Runtime Version: 11.0.6+1-LTS-jvmci-19.3-b07

Java Virtual Machine name: anonymous
Java Virtual Machine vendor: Oracle Corporation
Java Virtual Machine version: 11.0.6+1-LTS-jvmci-19.3-b07

Java Class Version: 55.0

Benchmark size: 1000000
Benchmark forks: 2
Benchmark warmups: 20
Benchmark measurements: 10

WARNING: An illegal reflective access operation has occurred
WARNING: Illegal reflective access by org.openjdk.jmh.util.Utils (file:/Users/dr/.m2/repository/org/openjdk/jmh/jmh-core/1.23/jmh-core-1.23.jar) to field java.io.PrintStream.charOut
WARNING: Please consider reporting this to the maintainers of org.openjdk.jmh.util.Utils
WARNING: Use --illegal-access=warn to enable warnings of further illegal reflective access operations
WARNING: All illegal access operations will be denied in a future release
# JMH version: 1.23
# VM version: JDK 11.0.6, anonymous, 11.0.6+1-LTS-jvmci-19.3-b07
# *** WARNING: This VM is not supported by JMH. The produced benchmark data can be completely wrong.
# VM invoker: /Library/Java/JavaVirtualMachines/graalvm-ee-java11-19.3.1/Contents/Home/bin/java
# VM options: -XX:+UnlockExperimentalVMOptions -XX:+EnableJVMCIProduct -XX:-UnlockExperimentalVMOptions -XX:+UnlockExperimentalVMOptions -XX:-UseJVMCICompiler
# Warmup: 20 iterations, 10 s each
# Measurement: 10 iterations, 10 s each
# Timeout: 10 min per iteration
# Threads: 1 thread, will synchronize iterations
# Benchmark mode: Throughput, ops/time
# Benchmark: jvmscompare.benchmark.PersonCombinedSummaryStats.combinedStatistics_EC_Eager_Serial

WARNING: Not a HotSpot compiler command compatible VM ("anonymous-11.0.6"), compilerHints are disabled.
# Run progress: 0.00% complete, ETA 00:50:00
# Fork: 1 of 2
# Warmup Iteration   1: 10.667 ops/s
# Warmup Iteration   2: 11.735 ops/s
# Warmup Iteration   3: 11.882 ops/s
# Warmup Iteration   4: 11.652 ops/s
# Warmup Iteration   5: 11.707 ops/s
# Warmup Iteration   6: 11.642 ops/s
# Warmup Iteration   7: 11.754 ops/s
# Warmup Iteration   8: 11.723 ops/s
# Warmup Iteration   9: 11.669 ops/s
# Warmup Iteration  10: 11.666 ops/s
# Warmup Iteration  11: 11.829 ops/s
# Warmup Iteration  12: 11.591 ops/s
# Warmup Iteration  13: 11.667 ops/s
# Warmup Iteration  14: 11.734 ops/s
# Warmup Iteration  15: 11.638 ops/s
# Warmup Iteration  16: 11.758 ops/s
# Warmup Iteration  17: 11.812 ops/s
# Warmup Iteration  18: 11.644 ops/s
# Warmup Iteration  19: 11.632 ops/s
# Warmup Iteration  20: 11.790 ops/s
Iteration   1: 11.742 ops/s
Iteration   2: 11.636 ops/s
Iteration   3: 11.757 ops/s
Iteration   4: 11.743 ops/s
Iteration   5: 11.752 ops/s
Iteration   6: 11.637 ops/s
Iteration   7: 11.633 ops/s
Iteration   8: 11.661 ops/s
Iteration   9: 11.634 ops/s
Iteration  10: 11.535 ops/s

WARNING: Not a HotSpot compiler command compatible VM ("anonymous-11.0.6"), compilerHints are disabled.
# Run progress: 10.00% complete, ETA 00:45:18
# Fork: 2 of 2
# Warmup Iteration   1: 10.604 ops/s
# Warmup Iteration   2: 11.622 ops/s
# Warmup Iteration   3: 12.216 ops/s
# Warmup Iteration   4: 12.380 ops/s
# Warmup Iteration   5: 12.415 ops/s
# Warmup Iteration   6: 12.273 ops/s
# Warmup Iteration   7: 12.337 ops/s
# Warmup Iteration   8: 12.342 ops/s
# Warmup Iteration   9: 12.373 ops/s
# Warmup Iteration  10: 12.414 ops/s
# Warmup Iteration  11: 12.311 ops/s
# Warmup Iteration  12: 12.325 ops/s
# Warmup Iteration  13: 12.301 ops/s
# Warmup Iteration  14: 12.444 ops/s
# Warmup Iteration  15: 12.406 ops/s
# Warmup Iteration  16: 12.418 ops/s
# Warmup Iteration  17: 12.290 ops/s
# Warmup Iteration  18: 12.440 ops/s
# Warmup Iteration  19: 12.374 ops/s
# Warmup Iteration  20: 12.367 ops/s
Iteration   1: 12.410 ops/s
Iteration   2: 12.452 ops/s
Iteration   3: 12.456 ops/s
Iteration   4: 12.331 ops/s
Iteration   5: 12.315 ops/s
Iteration   6: 12.347 ops/s
Iteration   7: 12.357 ops/s
Iteration   8: 12.553 ops/s
Iteration   9: 12.269 ops/s
Iteration  10: 12.344 ops/s


Result "jvmscompare.benchmark.PersonCombinedSummaryStats.combinedStatistics_EC_Eager_Serial":
  12.028 ±(99.9%) 0.323 ops/s [Average]
  (min, avg, max) = (11.535, 12.028, 12.553), stdev = 0.372
  CI (99.9%): [11.705, 12.352] (assumes normal distribution)


# JMH version: 1.23
# VM version: JDK 11.0.6, anonymous, 11.0.6+1-LTS-jvmci-19.3-b07
# *** WARNING: This VM is not supported by JMH. The produced benchmark data can be completely wrong.
# VM invoker: /Library/Java/JavaVirtualMachines/graalvm-ee-java11-19.3.1/Contents/Home/bin/java
# VM options: -XX:+UnlockExperimentalVMOptions -XX:+EnableJVMCIProduct -XX:-UnlockExperimentalVMOptions -XX:+UnlockExperimentalVMOptions -XX:-UseJVMCICompiler
# Warmup: 20 iterations, 10 s each
# Measurement: 10 iterations, 10 s each
# Timeout: 10 min per iteration
# Threads: 1 thread, will synchronize iterations
# Benchmark mode: Throughput, ops/time
# Benchmark: jvmscompare.benchmark.PersonCombinedSummaryStats.combinedStatistics_EC_Lazy_Serial

WARNING: Not a HotSpot compiler command compatible VM ("anonymous-11.0.6"), compilerHints are disabled.
# Run progress: 20.00% complete, ETA 00:40:16
# Fork: 1 of 2
# Warmup Iteration   1: 9.737 ops/s
# Warmup Iteration   2: 11.209 ops/s
# Warmup Iteration   3: 11.175 ops/s
# Warmup Iteration   4: 11.239 ops/s
# Warmup Iteration   5: 11.216 ops/s
# Warmup Iteration   6: 11.225 ops/s
# Warmup Iteration   7: 11.202 ops/s
# Warmup Iteration   8: 10.950 ops/s
# Warmup Iteration   9: 10.517 ops/s
# Warmup Iteration  10: 10.535 ops/s
# Warmup Iteration  11: 10.554 ops/s
# Warmup Iteration  12: 10.546 ops/s
# Warmup Iteration  13: 10.597 ops/s
# Warmup Iteration  14: 10.533 ops/s
# Warmup Iteration  15: 10.595 ops/s
# Warmup Iteration  16: 10.623 ops/s
# Warmup Iteration  17: 10.561 ops/s
# Warmup Iteration  18: 10.591 ops/s
# Warmup Iteration  19: 10.544 ops/s
# Warmup Iteration  20: 10.550 ops/s
Iteration   1: 10.653 ops/s
Iteration   2: 10.581 ops/s
Iteration   3: 10.759 ops/s
Iteration   4: 10.674 ops/s
Iteration   5: 10.638 ops/s
Iteration   6: 10.649 ops/s
Iteration   7: 10.632 ops/s
Iteration   8: 10.738 ops/s
Iteration   9: 10.594 ops/s
Iteration  10: 10.656 ops/s

WARNING: Not a HotSpot compiler command compatible VM ("anonymous-11.0.6"), compilerHints are disabled.
# Run progress: 30.00% complete, ETA 00:35:15
# Fork: 2 of 2
# Warmup Iteration   1: 8.955 ops/s
# Warmup Iteration   2: 10.199 ops/s
# Warmup Iteration   3: 10.125 ops/s
# Warmup Iteration   4: 10.387 ops/s
# Warmup Iteration   5: 10.177 ops/s
# Warmup Iteration   6: 10.315 ops/s
# Warmup Iteration   7: 10.271 ops/s
# Warmup Iteration   8: 10.154 ops/s
# Warmup Iteration   9: 10.298 ops/s
# Warmup Iteration  10: 10.253 ops/s
# Warmup Iteration  11: 10.151 ops/s
# Warmup Iteration  12: 10.187 ops/s
# Warmup Iteration  13: 10.323 ops/s
# Warmup Iteration  14: 10.172 ops/s
# Warmup Iteration  15: 10.342 ops/s
# Warmup Iteration  16: 10.210 ops/s
# Warmup Iteration  17: 10.191 ops/s
# Warmup Iteration  18: 10.266 ops/s
# Warmup Iteration  19: 10.269 ops/s
# Warmup Iteration  20: 10.207 ops/s
Iteration   1: 10.154 ops/s
Iteration   2: 10.343 ops/s
Iteration   3: 10.384 ops/s
Iteration   4: 10.166 ops/s
Iteration   5: 10.287 ops/s
Iteration   6: 10.313 ops/s
Iteration   7: 10.261 ops/s
Iteration   8: 10.144 ops/s
Iteration   9: 10.299 ops/s
Iteration  10: 10.163 ops/s


Result "jvmscompare.benchmark.PersonCombinedSummaryStats.combinedStatistics_EC_Lazy_Serial":
  10.454 ±(99.9%) 0.191 ops/s [Average]
  (min, avg, max) = (10.144, 10.454, 10.759), stdev = 0.220
  CI (99.9%): [10.263, 10.646] (assumes normal distribution)


# JMH version: 1.23
# VM version: JDK 11.0.6, anonymous, 11.0.6+1-LTS-jvmci-19.3-b07
# *** WARNING: This VM is not supported by JMH. The produced benchmark data can be completely wrong.
# VM invoker: /Library/Java/JavaVirtualMachines/graalvm-ee-java11-19.3.1/Contents/Home/bin/java
# VM options: -XX:+UnlockExperimentalVMOptions -XX:+EnableJVMCIProduct -XX:-UnlockExperimentalVMOptions -XX:+UnlockExperimentalVMOptions -XX:-UseJVMCICompiler
# Warmup: 20 iterations, 10 s each
# Measurement: 10 iterations, 10 s each
# Timeout: 10 min per iteration
# Threads: 1 thread, will synchronize iterations
# Benchmark mode: Throughput, ops/time
# Benchmark: jvmscompare.benchmark.PersonCombinedSummaryStats.combinedStatistics_EC_Stream_Parallel

WARNING: Not a HotSpot compiler command compatible VM ("anonymous-11.0.6"), compilerHints are disabled.
# Run progress: 40.00% complete, ETA 00:30:13
# Fork: 1 of 2
# Warmup Iteration   1: 90.106 ops/s
# Warmup Iteration   2: 108.427 ops/s
# Warmup Iteration   3: 107.402 ops/s
# Warmup Iteration   4: 101.894 ops/s
# Warmup Iteration   5: 96.374 ops/s
# Warmup Iteration   6: 103.110 ops/s
# Warmup Iteration   7: 101.721 ops/s
# Warmup Iteration   8: 102.661 ops/s
# Warmup Iteration   9: 102.490 ops/s
# Warmup Iteration  10: 101.712 ops/s
# Warmup Iteration  11: 104.740 ops/s
# Warmup Iteration  12: 97.734 ops/s
# Warmup Iteration  13: 98.114 ops/s
# Warmup Iteration  14: 102.953 ops/s
# Warmup Iteration  15: 103.439 ops/s
# Warmup Iteration  16: 103.347 ops/s
# Warmup Iteration  17: 103.267 ops/s
# Warmup Iteration  18: 99.568 ops/s
# Warmup Iteration  19: 97.425 ops/s
# Warmup Iteration  20: 103.555 ops/s
Iteration   1: 96.337 ops/s
Iteration   2: 102.975 ops/s
Iteration   3: 96.253 ops/s
Iteration   4: 98.389 ops/s
Iteration   5: 98.302 ops/s
Iteration   6: 98.285 ops/s
Iteration   7: 94.296 ops/s
Iteration   8: 99.687 ops/s
Iteration   9: 104.109 ops/s
Iteration  10: 107.341 ops/s

WARNING: Not a HotSpot compiler command compatible VM ("anonymous-11.0.6"), compilerHints are disabled.
# Run progress: 50.00% complete, ETA 00:25:09
# Fork: 2 of 2
# Warmup Iteration   1: 93.201 ops/s
# Warmup Iteration   2: 110.790 ops/s
# Warmup Iteration   3: 113.633 ops/s
# Warmup Iteration   4: 113.915 ops/s
# Warmup Iteration   5: 114.064 ops/s
# Warmup Iteration   6: 114.403 ops/s
# Warmup Iteration   7: 111.094 ops/s
# Warmup Iteration   8: 99.849 ops/s
# Warmup Iteration   9: 94.803 ops/s
# Warmup Iteration  10: 99.049 ops/s
# Warmup Iteration  11: 95.169 ops/s
# Warmup Iteration  12: 100.917 ops/s
# Warmup Iteration  13: 94.285 ops/s
# Warmup Iteration  14: 97.430 ops/s
# Warmup Iteration  15: 90.545 ops/s
# Warmup Iteration  16: 96.361 ops/s
# Warmup Iteration  17: 99.633 ops/s
# Warmup Iteration  18: 92.132 ops/s
# Warmup Iteration  19: 95.051 ops/s
# Warmup Iteration  20: 98.865 ops/s
Iteration   1: 96.091 ops/s
Iteration   2: 96.637 ops/s
Iteration   3: 100.472 ops/s
Iteration   4: 95.865 ops/s
Iteration   5: 97.292 ops/s
Iteration   6: 99.037 ops/s
Iteration   7: 96.171 ops/s
Iteration   8: 91.486 ops/s
Iteration   9: 105.657 ops/s
Iteration  10: 97.135 ops/s


Result "jvmscompare.benchmark.PersonCombinedSummaryStats.combinedStatistics_EC_Stream_Parallel":
  98.591 ±(99.9%) 3.381 ops/s [Average]
  (min, avg, max) = (91.486, 98.591, 107.341), stdev = 3.893
  CI (99.9%): [95.210, 101.971] (assumes normal distribution)


# JMH version: 1.23
# VM version: JDK 11.0.6, anonymous, 11.0.6+1-LTS-jvmci-19.3-b07
# *** WARNING: This VM is not supported by JMH. The produced benchmark data can be completely wrong.
# VM invoker: /Library/Java/JavaVirtualMachines/graalvm-ee-java11-19.3.1/Contents/Home/bin/java
# VM options: -XX:+UnlockExperimentalVMOptions -XX:+EnableJVMCIProduct -XX:-UnlockExperimentalVMOptions -XX:+UnlockExperimentalVMOptions -XX:-UseJVMCICompiler
# Warmup: 20 iterations, 10 s each
# Measurement: 10 iterations, 10 s each
# Timeout: 10 min per iteration
# Threads: 1 thread, will synchronize iterations
# Benchmark mode: Throughput, ops/time
# Benchmark: jvmscompare.benchmark.PersonCombinedSummaryStats.combinedStatistics_JDK_Stream_Parallel

WARNING: Not a HotSpot compiler command compatible VM ("anonymous-11.0.6"), compilerHints are disabled.
# Run progress: 60.00% complete, ETA 00:20:06
# Fork: 1 of 2
# Warmup Iteration   1: 87.193 ops/s
# Warmup Iteration   2: 95.808 ops/s
# Warmup Iteration   3: 96.593 ops/s
# Warmup Iteration   4: 93.187 ops/s
# Warmup Iteration   5: 96.974 ops/s
# Warmup Iteration   6: 93.441 ops/s
# Warmup Iteration   7: 96.014 ops/s
# Warmup Iteration   8: 95.063 ops/s
# Warmup Iteration   9: 96.375 ops/s
# Warmup Iteration  10: 91.668 ops/s
# Warmup Iteration  11: 92.726 ops/s
# Warmup Iteration  12: 95.694 ops/s
# Warmup Iteration  13: 95.299 ops/s
# Warmup Iteration  14: 93.885 ops/s
# Warmup Iteration  15: 100.795 ops/s
# Warmup Iteration  16: 96.982 ops/s
# Warmup Iteration  17: 90.920 ops/s
# Warmup Iteration  18: 90.132 ops/s
# Warmup Iteration  19: 89.753 ops/s
# Warmup Iteration  20: 94.889 ops/s
Iteration   1: 96.141 ops/s
Iteration   2: 95.342 ops/s
Iteration   3: 99.529 ops/s
Iteration   4: 90.159 ops/s
Iteration   5: 96.371 ops/s
Iteration   6: 101.437 ops/s
Iteration   7: 96.951 ops/s
Iteration   8: 102.049 ops/s
Iteration   9: 98.469 ops/s
Iteration  10: 94.790 ops/s

WARNING: Not a HotSpot compiler command compatible VM ("anonymous-11.0.6"), compilerHints are disabled.
# Run progress: 70.00% complete, ETA 00:15:04
# Fork: 2 of 2
# Warmup Iteration   1: 81.412 ops/s
# Warmup Iteration   2: 93.389 ops/s
# Warmup Iteration   3: 103.737 ops/s
# Warmup Iteration   4: 98.641 ops/s
# Warmup Iteration   5: 93.790 ops/s
# Warmup Iteration   6: 95.740 ops/s
# Warmup Iteration   7: 97.292 ops/s
# Warmup Iteration   8: 97.258 ops/s
# Warmup Iteration   9: 102.998 ops/s
# Warmup Iteration  10: 97.221 ops/s
# Warmup Iteration  11: 95.976 ops/s
# Warmup Iteration  12: 93.001 ops/s
# Warmup Iteration  13: 95.730 ops/s
# Warmup Iteration  14: 101.337 ops/s
# Warmup Iteration  15: 96.382 ops/s
# Warmup Iteration  16: 97.585 ops/s
# Warmup Iteration  17: 104.789 ops/s
# Warmup Iteration  18: 99.262 ops/s
# Warmup Iteration  19: 97.563 ops/s
# Warmup Iteration  20: 92.658 ops/s
Iteration   1: 101.604 ops/s
Iteration   2: 95.337 ops/s
Iteration   3: 100.098 ops/s
Iteration   4: 97.364 ops/s
Iteration   5: 100.614 ops/s
Iteration   6: 93.853 ops/s
Iteration   7: 94.731 ops/s
Iteration   8: 98.161 ops/s
Iteration   9: 98.661 ops/s
Iteration  10: 93.135 ops/s


Result "jvmscompare.benchmark.PersonCombinedSummaryStats.combinedStatistics_JDK_Stream_Parallel":
  97.240 ±(99.9%) 2.739 ops/s [Average]
  (min, avg, max) = (90.159, 97.240, 102.049), stdev = 3.154
  CI (99.9%): [94.501, 99.979] (assumes normal distribution)


# JMH version: 1.23
# VM version: JDK 11.0.6, anonymous, 11.0.6+1-LTS-jvmci-19.3-b07
# *** WARNING: This VM is not supported by JMH. The produced benchmark data can be completely wrong.
# VM invoker: /Library/Java/JavaVirtualMachines/graalvm-ee-java11-19.3.1/Contents/Home/bin/java
# VM options: -XX:+UnlockExperimentalVMOptions -XX:+EnableJVMCIProduct -XX:-UnlockExperimentalVMOptions -XX:+UnlockExperimentalVMOptions -XX:-UseJVMCICompiler
# Warmup: 20 iterations, 10 s each
# Measurement: 10 iterations, 10 s each
# Timeout: 10 min per iteration
# Threads: 1 thread, will synchronize iterations
# Benchmark mode: Throughput, ops/time
# Benchmark: jvmscompare.benchmark.PersonCombinedSummaryStats.combinedStatistics_JDK_Stream_Serial

WARNING: Not a HotSpot compiler command compatible VM ("anonymous-11.0.6"), compilerHints are disabled.
# Run progress: 80.00% complete, ETA 00:10:03
# Fork: 1 of 2
# Warmup Iteration   1: 9.652 ops/s
# Warmup Iteration   2: 11.164 ops/s
# Warmup Iteration   3: 11.456 ops/s
# Warmup Iteration   4: 11.632 ops/s
# Warmup Iteration   5: 11.476 ops/s
# Warmup Iteration   6: 11.376 ops/s
# Warmup Iteration   7: 11.516 ops/s
# Warmup Iteration   8: 11.549 ops/s
# Warmup Iteration   9: 11.413 ops/s
# Warmup Iteration  10: 11.533 ops/s
# Warmup Iteration  11: 11.438 ops/s
# Warmup Iteration  12: 11.520 ops/s
# Warmup Iteration  13: 11.594 ops/s
# Warmup Iteration  14: 11.414 ops/s
# Warmup Iteration  15: 11.583 ops/s
# Warmup Iteration  16: 11.537 ops/s
# Warmup Iteration  17: 11.437 ops/s
# Warmup Iteration  18: 11.482 ops/s
# Warmup Iteration  19: 11.519 ops/s
# Warmup Iteration  20: 11.658 ops/s
Iteration   1: 11.677 ops/s
Iteration   2: 11.398 ops/s
Iteration   3: 11.641 ops/s
Iteration   4: 11.617 ops/s
Iteration   5: 11.446 ops/s
Iteration   6: 11.622 ops/s
Iteration   7: 11.520 ops/s
Iteration   8: 11.465 ops/s
Iteration   9: 11.558 ops/s
Iteration  10: 11.556 ops/s

WARNING: Not a HotSpot compiler command compatible VM ("anonymous-11.0.6"), compilerHints are disabled.
# Run progress: 90.00% complete, ETA 00:05:01
# Fork: 2 of 2
# Warmup Iteration   1: 10.530 ops/s
# Warmup Iteration   2: 11.586 ops/s
# Warmup Iteration   3: 11.390 ops/s
# Warmup Iteration   4: 11.483 ops/s
# Warmup Iteration   5: 11.622 ops/s
# Warmup Iteration   6: 11.443 ops/s
# Warmup Iteration   7: 11.469 ops/s
# Warmup Iteration   8: 11.721 ops/s
# Warmup Iteration   9: 11.623 ops/s
# Warmup Iteration  10: 11.457 ops/s
# Warmup Iteration  11: 11.450 ops/s
# Warmup Iteration  12: 11.627 ops/s
# Warmup Iteration  13: 11.479 ops/s
# Warmup Iteration  14: 11.582 ops/s
# Warmup Iteration  15: 11.658 ops/s
# Warmup Iteration  16: 11.654 ops/s
# Warmup Iteration  17: 11.513 ops/s
# Warmup Iteration  18: 11.663 ops/s
# Warmup Iteration  19: 11.438 ops/s
# Warmup Iteration  20: 11.568 ops/s
Iteration   1: 11.543 ops/s
Iteration   2: 11.520 ops/s
Iteration   3: 11.465 ops/s
Iteration   4: 11.526 ops/s
Iteration   5: 11.409 ops/s
Iteration   6: 11.410 ops/s
Iteration   7: 11.561 ops/s
Iteration   8: 11.745 ops/s
Iteration   9: 11.421 ops/s
Iteration  10: 11.502 ops/s


Result "jvmscompare.benchmark.PersonCombinedSummaryStats.combinedStatistics_JDK_Stream_Serial":
  11.530 ±(99.9%) 0.083 ops/s [Average]
  (min, avg, max) = (11.398, 11.530, 11.745), stdev = 0.096
  CI (99.9%): [11.447, 11.613] (assumes normal distribution)


# Run complete. Total time: 00:50:16

REMEMBER: The numbers below are just data. To gain reusable insights, you need to follow up on
why the numbers are the way they are. Use profilers (see -prof, -lprof), design factorial
experiments, perform baseline and negative tests that provide experimental control, make sure
the benchmarking environment is safe on JVM/OS/HW level, ask for reviews from the domain experts.
Do not assume the numbers tell you what you want them to tell.

Benchmark                                                           Mode  Cnt   Score   Error  Units
PersonCombinedSummaryStats.combinedStatistics_EC_Eager_Serial      thrpt   20  12.028 ± 0.323  ops/s
PersonCombinedSummaryStats.combinedStatistics_EC_Lazy_Serial       thrpt   20  10.454 ± 0.191  ops/s
PersonCombinedSummaryStats.combinedStatistics_EC_Stream_Parallel   thrpt   20  98.591 ± 3.381  ops/s
PersonCombinedSummaryStats.combinedStatistics_JDK_Stream_Parallel  thrpt   20  97.240 ± 2.739  ops/s
PersonCombinedSummaryStats.combinedStatistics_JDK_Stream_Serial    thrpt   20  11.530 ± 0.083  ops/s

Benchmark result is saved to benchmark-results/person-combined-summary-stats/08_GraalEEC2PersonCombinedSummaryStats.csv
[INFO] ------------------------------------------------------------------------
[INFO] BUILD SUCCESS
[INFO] ------------------------------------------------------------------------
[INFO] Total time:  50:28 min
[INFO] Finished at: 2020-01-29T01:36:13-05:00
[INFO] ------------------------------------------------------------------------
