[INFO] Scanning for projects...
[INFO] 
[INFO] ---------------------< jvms-compare:jvms-compare >----------------------
[INFO] Building JVMs Compare 1.0.0
[INFO] --------------------------------[ jar ]---------------------------------
[INFO] 
[INFO] --- maven-clean-plugin:2.5:clean (default-clean) @ jvms-compare ---
[INFO] Deleting /Users/cguntur/projects/conf/jvms-compare/target
[INFO] 
[INFO] --- maven-toolchains-plugin:1.1:toolchain (default) @ jvms-compare ---
[INFO] Required toolchain: jdk [ vendor='oracle' version='11' ]
[INFO] Found matching toolchain for type jdk: JDK[/Library/Java/JavaVirtualMachines/oraclejdk-11.0.6.jdk/Contents/Home/]
[INFO] 
[INFO] --- maven-dependency-plugin:3.1.1:build-classpath (build-classpath) @ jvms-compare ---
[INFO] Dependencies classpath:
/Users/cguntur/.m2/repository/org/apache/commons/commons-math3/3.2/commons-math3-3.2.jar:/Users/cguntur/.m2/repository/org/junit/jupiter/junit-jupiter-api/5.5.0/junit-jupiter-api-5.5.0.jar:/Users/cguntur/.m2/repository/org/eclipse/collections/eclipse-collections/10.0.0/eclipse-collections-10.0.0.jar:/Users/cguntur/.m2/repository/org/junit/platform/junit-platform-engine/1.5.0/junit-platform-engine-1.5.0.jar:/Users/cguntur/.m2/repository/org/junit/platform/junit-platform-commons/1.5.0/junit-platform-commons-1.5.0.jar:/Users/cguntur/.m2/repository/org/junit/jupiter/junit-jupiter-params/5.5.0/junit-jupiter-params-5.5.0.jar:/Users/cguntur/.m2/repository/org/junit/jupiter/junit-jupiter-engine/5.5.0/junit-jupiter-engine-5.5.0.jar:/Users/cguntur/.m2/repository/org/junit/jupiter/junit-jupiter/5.5.0/junit-jupiter-5.5.0.jar:/Users/cguntur/.m2/repository/org/opentest4j/opentest4j/1.2.0/opentest4j-1.2.0.jar:/Users/cguntur/.m2/repository/org/openjdk/jmh/jmh-core/1.23/jmh-core-1.23.jar:/Users/cguntur/.m2/repository/org/apiguardian/apiguardian-api/1.1.0/apiguardian-api-1.1.0.jar:/Users/cguntur/.m2/repository/net/sf/jopt-simple/jopt-simple/4.6/jopt-simple-4.6.jar:/Users/cguntur/.m2/repository/org/eclipse/collections/eclipse-collections-api/10.0.0/eclipse-collections-api-10.0.0.jar
[INFO] 
[INFO] --- maven-resources-plugin:2.6:resources (default-resources) @ jvms-compare ---
[INFO] Using 'UTF-8' encoding to copy filtered resources.
[INFO] Copying 1 resource
[INFO] 
[INFO] --- maven-compiler-plugin:3.8.1:compile (default-compile) @ jvms-compare ---
[INFO] Toolchain in maven-compiler-plugin: JDK[/Library/Java/JavaVirtualMachines/oraclejdk-11.0.6.jdk/Contents/Home/]
[INFO] Changes detected - recompiling the module!
[INFO] Compiling 10 source files to /Users/cguntur/projects/conf/jvms-compare/target/classes
[INFO] 
[INFO] --- maven-resources-plugin:2.6:testResources (default-testResources) @ jvms-compare ---
[INFO] Using 'UTF-8' encoding to copy filtered resources.
[INFO] Copying 1 resource
[INFO] 
[INFO] --- maven-compiler-plugin:3.8.1:testCompile (default-testCompile) @ jvms-compare ---
[INFO] Toolchain in maven-compiler-plugin: JDK[/Library/Java/JavaVirtualMachines/oraclejdk-11.0.6.jdk/Contents/Home/]
[INFO] Changes detected - recompiling the module!
[INFO] Compiling 2 source files to /Users/cguntur/projects/conf/jvms-compare/target/test-classes
[INFO] 
[INFO] --- maven-surefire-plugin:2.12.4:test (default-test) @ jvms-compare ---
[INFO] Toolchain in surefire-plugin: JDK[/Library/Java/JavaVirtualMachines/oraclejdk-11.0.6.jdk/Contents/Home/]
[INFO] Surefire report directory: /Users/cguntur/projects/conf/jvms-compare/target/surefire-reports

-------------------------------------------------------
 T E S T S
-------------------------------------------------------
Running jvmscompare.PersonTest
Tests run: 3, Failures: 0, Errors: 0, Skipped: 0, Time elapsed: 1.366 sec
Running jvmscompare.IntListTest
Tests run: 3, Failures: 0, Errors: 0, Skipped: 0, Time elapsed: 1.312 sec

Results :

Tests run: 6, Failures: 0, Errors: 0, Skipped: 0

[INFO] 
[INFO] --- exec-maven-plugin:1.6.0:exec (combinedSummaryStats) @ jvms-compare ---
[INFO] Toolchain in exec-maven-plugin: JDK[/Library/Java/JavaVirtualMachines/oraclejdk-11.0.6.jdk/Contents/Home/]
##### Heap utilization statistics [MB] #####
Used Memory:4
Free Memory:1019
Total Memory:1024
Max Memory:1024
Java Runtime Environment version: 11.0.6
Java Runtime Environment vendor: Oracle Corporation

Java Runtime Name: Java(TM) SE Runtime Environment
Java Runtime Version: 11.0.6+8-LTS

Java Virtual Machine name: anonymous
Java Virtual Machine vendor: Oracle Corporation
Java Virtual Machine version: 11.0.6+8-LTS

Java Class Version: 55.0

Benchmark size: 1000
Benchmark forks: 2
Benchmark warmups: 20
Benchmark measurements: 10

WARNING: An illegal reflective access operation has occurred
WARNING: Illegal reflective access by org.openjdk.jmh.util.Utils (file:/Users/cguntur/.m2/repository/org/openjdk/jmh/jmh-core/1.23/jmh-core-1.23.jar) to field java.io.PrintStream.charOut
WARNING: Please consider reporting this to the maintainers of org.openjdk.jmh.util.Utils
WARNING: Use --illegal-access=warn to enable warnings of further illegal reflective access operations
WARNING: All illegal access operations will be denied in a future release
# JMH version: 1.23
# VM version: JDK 11.0.6, anonymous, 11.0.6+8-LTS
# *** WARNING: This VM is not supported by JMH. The produced benchmark data can be completely wrong.
# VM invoker: /Library/Java/JavaVirtualMachines/oraclejdk-11.0.6.jdk/Contents/Home/bin/java
# VM options: -Xms1024m -Xmx1024m
# Warmup: 20 iterations, 10 s each
# Measurement: 10 iterations, 10 s each
# Timeout: 10 min per iteration
# Threads: 1 thread, will synchronize iterations
# Benchmark mode: Throughput, ops/time
# Benchmark: jvmscompare.benchmark.PersonCombinedSummaryStats.combinedStatistics_EC_Eager_Serial

WARNING: Not a HotSpot compiler command compatible VM ("anonymous-11.0.6"), compilerHints are disabled.
# Run progress: 0.00% complete, ETA 00:50:00
# Fork: 1 of 2
# Warmup Iteration   1: 89278.092 ops/s
# Warmup Iteration   2: 91297.805 ops/s
# Warmup Iteration   3: 90478.640 ops/s
# Warmup Iteration   4: 91767.735 ops/s
# Warmup Iteration   5: 90859.152 ops/s
# Warmup Iteration   6: 92900.222 ops/s
# Warmup Iteration   7: 92519.738 ops/s
# Warmup Iteration   8: 93176.439 ops/s
# Warmup Iteration   9: 92498.740 ops/s
# Warmup Iteration  10: 93070.981 ops/s
# Warmup Iteration  11: 93145.323 ops/s
# Warmup Iteration  12: 93022.493 ops/s
# Warmup Iteration  13: 93133.764 ops/s
# Warmup Iteration  14: 92989.461 ops/s
# Warmup Iteration  15: 93191.807 ops/s
# Warmup Iteration  16: 93027.572 ops/s
# Warmup Iteration  17: 92992.074 ops/s
# Warmup Iteration  18: 92996.703 ops/s
# Warmup Iteration  19: 92799.466 ops/s
# Warmup Iteration  20: 92971.730 ops/s
Iteration   1: 93138.456 ops/s
Iteration   2: 93144.829 ops/s
Iteration   3: 93032.843 ops/s
Iteration   4: 93034.172 ops/s
Iteration   5: 93065.846 ops/s
Iteration   6: 93020.751 ops/s
Iteration   7: 93081.811 ops/s
Iteration   8: 93073.393 ops/s
Iteration   9: 93092.247 ops/s
Iteration  10: 92936.465 ops/s

WARNING: Not a HotSpot compiler command compatible VM ("anonymous-11.0.6"), compilerHints are disabled.
# Run progress: 10.00% complete, ETA 00:45:06
# Fork: 2 of 2
# Warmup Iteration   1: 88967.566 ops/s
# Warmup Iteration   2: 92310.920 ops/s
# Warmup Iteration   3: 92911.010 ops/s
# Warmup Iteration   4: 92067.686 ops/s
# Warmup Iteration   5: 92107.534 ops/s
# Warmup Iteration   6: 92770.366 ops/s
# Warmup Iteration   7: 92971.739 ops/s
# Warmup Iteration   8: 92463.928 ops/s
# Warmup Iteration   9: 92552.570 ops/s
# Warmup Iteration  10: 92984.108 ops/s
# Warmup Iteration  11: 92982.033 ops/s
# Warmup Iteration  12: 92890.687 ops/s
# Warmup Iteration  13: 93055.802 ops/s
# Warmup Iteration  14: 92993.904 ops/s
# Warmup Iteration  15: 93051.039 ops/s
# Warmup Iteration  16: 92977.016 ops/s
# Warmup Iteration  17: 93105.410 ops/s
# Warmup Iteration  18: 92836.861 ops/s
# Warmup Iteration  19: 92997.607 ops/s
# Warmup Iteration  20: 93017.631 ops/s
Iteration   1: 93079.820 ops/s
Iteration   2: 93139.865 ops/s
Iteration   3: 93012.383 ops/s
Iteration   4: 93059.417 ops/s
Iteration   5: 93163.077 ops/s
Iteration   6: 93039.386 ops/s
Iteration   7: 92938.027 ops/s
Iteration   8: 92999.469 ops/s
Iteration   9: 93090.910 ops/s
Iteration  10: 93054.557 ops/s


Result "jvmscompare.benchmark.PersonCombinedSummaryStats.combinedStatistics_EC_Eager_Serial":
  93059.886 ±(99.9%) 53.788 ops/s [Average]
  (min, avg, max) = (92936.465, 93059.886, 93163.077), stdev = 61.943
  CI (99.9%): [93006.098, 93113.675] (assumes normal distribution)


# JMH version: 1.23
# VM version: JDK 11.0.6, anonymous, 11.0.6+8-LTS
# *** WARNING: This VM is not supported by JMH. The produced benchmark data can be completely wrong.
# VM invoker: /Library/Java/JavaVirtualMachines/oraclejdk-11.0.6.jdk/Contents/Home/bin/java
# VM options: -Xms1024m -Xmx1024m
# Warmup: 20 iterations, 10 s each
# Measurement: 10 iterations, 10 s each
# Timeout: 10 min per iteration
# Threads: 1 thread, will synchronize iterations
# Benchmark mode: Throughput, ops/time
# Benchmark: jvmscompare.benchmark.PersonCombinedSummaryStats.combinedStatistics_EC_Lazy_Serial

WARNING: Not a HotSpot compiler command compatible VM ("anonymous-11.0.6"), compilerHints are disabled.
# Run progress: 20.00% complete, ETA 00:40:05
# Fork: 1 of 2
# Warmup Iteration   1: 86552.753 ops/s
# Warmup Iteration   2: 94475.536 ops/s
# Warmup Iteration   3: 94516.443 ops/s
# Warmup Iteration   4: 94529.415 ops/s
# Warmup Iteration   5: 94310.663 ops/s
# Warmup Iteration   6: 94767.982 ops/s
# Warmup Iteration   7: 94122.619 ops/s
# Warmup Iteration   8: 94611.650 ops/s
# Warmup Iteration   9: 94323.809 ops/s
# Warmup Iteration  10: 94787.884 ops/s
# Warmup Iteration  11: 94511.191 ops/s
# Warmup Iteration  12: 94747.645 ops/s
# Warmup Iteration  13: 94575.465 ops/s
# Warmup Iteration  14: 94671.588 ops/s
# Warmup Iteration  15: 94782.764 ops/s
# Warmup Iteration  16: 94789.479 ops/s
# Warmup Iteration  17: 94665.505 ops/s
# Warmup Iteration  18: 94488.441 ops/s
# Warmup Iteration  19: 94835.078 ops/s
# Warmup Iteration  20: 94765.407 ops/s
Iteration   1: 94737.118 ops/s
Iteration   2: 94694.002 ops/s
Iteration   3: 94745.212 ops/s
Iteration   4: 94863.761 ops/s
Iteration   5: 94691.856 ops/s
Iteration   6: 94443.034 ops/s
Iteration   7: 94809.887 ops/s
Iteration   8: 94890.396 ops/s
Iteration   9: 94796.117 ops/s
Iteration  10: 94652.322 ops/s

WARNING: Not a HotSpot compiler command compatible VM ("anonymous-11.0.6"), compilerHints are disabled.
# Run progress: 30.00% complete, ETA 00:35:04
# Fork: 2 of 2
# Warmup Iteration   1: 86483.792 ops/s
# Warmup Iteration   2: 93773.241 ops/s
# Warmup Iteration   3: 94012.482 ops/s
# Warmup Iteration   4: 93932.330 ops/s
# Warmup Iteration   5: 93847.119 ops/s
# Warmup Iteration   6: 93877.831 ops/s
# Warmup Iteration   7: 94300.134 ops/s
# Warmup Iteration   8: 93746.092 ops/s
# Warmup Iteration   9: 94242.379 ops/s
# Warmup Iteration  10: 93586.066 ops/s
# Warmup Iteration  11: 94326.896 ops/s
# Warmup Iteration  12: 94145.299 ops/s
# Warmup Iteration  13: 94288.620 ops/s
# Warmup Iteration  14: 93875.385 ops/s
# Warmup Iteration  15: 94261.855 ops/s
# Warmup Iteration  16: 94239.402 ops/s
# Warmup Iteration  17: 93605.164 ops/s
# Warmup Iteration  18: 94308.225 ops/s
# Warmup Iteration  19: 90900.938 ops/s
# Warmup Iteration  20: 94076.774 ops/s
Iteration   1: 94304.827 ops/s
Iteration   2: 94142.965 ops/s
Iteration   3: 94234.093 ops/s
Iteration   4: 94221.354 ops/s
Iteration   5: 94099.489 ops/s
Iteration   6: 94299.074 ops/s
Iteration   7: 94295.382 ops/s
Iteration   8: 94254.810 ops/s
Iteration   9: 94240.715 ops/s
Iteration  10: 94201.372 ops/s


Result "jvmscompare.benchmark.PersonCombinedSummaryStats.combinedStatistics_EC_Lazy_Serial":
  94480.889 ±(99.9%) 240.008 ops/s [Average]
  (min, avg, max) = (94099.489, 94480.889, 94890.396), stdev = 276.394
  CI (99.9%): [94240.881, 94720.898] (assumes normal distribution)


# JMH version: 1.23
# VM version: JDK 11.0.6, anonymous, 11.0.6+8-LTS
# *** WARNING: This VM is not supported by JMH. The produced benchmark data can be completely wrong.
# VM invoker: /Library/Java/JavaVirtualMachines/oraclejdk-11.0.6.jdk/Contents/Home/bin/java
# VM options: -Xms1024m -Xmx1024m
# Warmup: 20 iterations, 10 s each
# Measurement: 10 iterations, 10 s each
# Timeout: 10 min per iteration
# Threads: 1 thread, will synchronize iterations
# Benchmark mode: Throughput, ops/time
# Benchmark: jvmscompare.benchmark.PersonCombinedSummaryStats.combinedStatistics_EC_Stream_Parallel

WARNING: Not a HotSpot compiler command compatible VM ("anonymous-11.0.6"), compilerHints are disabled.
# Run progress: 40.00% complete, ETA 00:30:03
# Fork: 1 of 2
# Warmup Iteration   1: 12475.403 ops/s
# Warmup Iteration   2: 11978.274 ops/s
# Warmup Iteration   3: 12249.150 ops/s
# Warmup Iteration   4: 12061.478 ops/s
# Warmup Iteration   5: 12072.855 ops/s
# Warmup Iteration   6: 12749.041 ops/s
# Warmup Iteration   7: 12553.630 ops/s
# Warmup Iteration   8: 12312.776 ops/s
# Warmup Iteration   9: 12567.117 ops/s
# Warmup Iteration  10: 12340.187 ops/s
# Warmup Iteration  11: 12208.598 ops/s
# Warmup Iteration  12: 12588.514 ops/s
# Warmup Iteration  13: 12071.546 ops/s
# Warmup Iteration  14: 12805.493 ops/s
# Warmup Iteration  15: 12713.457 ops/s
# Warmup Iteration  16: 12531.535 ops/s
# Warmup Iteration  17: 13299.635 ops/s
# Warmup Iteration  18: 15174.808 ops/s
# Warmup Iteration  19: 12019.458 ops/s
# Warmup Iteration  20: 12051.774 ops/s
Iteration   1: 12066.425 ops/s
Iteration   2: 12410.893 ops/s
Iteration   3: 12042.780 ops/s
Iteration   4: 12000.121 ops/s
Iteration   5: 13099.927 ops/s
Iteration   6: 12047.965 ops/s
Iteration   7: 12242.487 ops/s
Iteration   8: 12105.757 ops/s
Iteration   9: 13094.014 ops/s
Iteration  10: 12040.572 ops/s

WARNING: Not a HotSpot compiler command compatible VM ("anonymous-11.0.6"), compilerHints are disabled.
# Run progress: 50.00% complete, ETA 00:25:03
# Fork: 2 of 2
# Warmup Iteration   1: 11752.674 ops/s
# Warmup Iteration   2: 11841.787 ops/s
# Warmup Iteration   3: 11861.477 ops/s
# Warmup Iteration   4: 12233.609 ops/s
# Warmup Iteration   5: 12622.579 ops/s
# Warmup Iteration   6: 12043.979 ops/s
# Warmup Iteration   7: 12468.667 ops/s
# Warmup Iteration   8: 11860.961 ops/s
# Warmup Iteration   9: 12523.732 ops/s
# Warmup Iteration  10: 11870.373 ops/s
# Warmup Iteration  11: 12170.252 ops/s
# Warmup Iteration  12: 11852.451 ops/s
# Warmup Iteration  13: 11816.087 ops/s
# Warmup Iteration  14: 12089.944 ops/s
# Warmup Iteration  15: 11831.735 ops/s
# Warmup Iteration  16: 11883.399 ops/s
# Warmup Iteration  17: 11857.508 ops/s
# Warmup Iteration  18: 12283.353 ops/s
# Warmup Iteration  19: 11857.070 ops/s
# Warmup Iteration  20: 12254.799 ops/s
Iteration   1: 11852.574 ops/s
Iteration   2: 12459.629 ops/s
Iteration   3: 12713.901 ops/s
Iteration   4: 12912.634 ops/s
Iteration   5: 12731.969 ops/s
Iteration   6: 12089.645 ops/s
Iteration   7: 12306.528 ops/s
Iteration   8: 11815.758 ops/s
Iteration   9: 12354.330 ops/s
Iteration  10: 12481.490 ops/s


Result "jvmscompare.benchmark.PersonCombinedSummaryStats.combinedStatistics_EC_Stream_Parallel":
  12343.470 ±(99.9%) 339.305 ops/s [Average]
  (min, avg, max) = (11815.758, 12343.470, 13099.927), stdev = 390.744
  CI (99.9%): [12004.165, 12682.775] (assumes normal distribution)


# JMH version: 1.23
# VM version: JDK 11.0.6, anonymous, 11.0.6+8-LTS
# *** WARNING: This VM is not supported by JMH. The produced benchmark data can be completely wrong.
# VM invoker: /Library/Java/JavaVirtualMachines/oraclejdk-11.0.6.jdk/Contents/Home/bin/java
# VM options: -Xms1024m -Xmx1024m
# Warmup: 20 iterations, 10 s each
# Measurement: 10 iterations, 10 s each
# Timeout: 10 min per iteration
# Threads: 1 thread, will synchronize iterations
# Benchmark mode: Throughput, ops/time
# Benchmark: jvmscompare.benchmark.PersonCombinedSummaryStats.combinedStatistics_JDK_Stream_Parallel

WARNING: Not a HotSpot compiler command compatible VM ("anonymous-11.0.6"), compilerHints are disabled.
# Run progress: 60.00% complete, ETA 00:20:02
# Fork: 1 of 2
# Warmup Iteration   1: 12837.480 ops/s
# Warmup Iteration   2: 12014.756 ops/s
# Warmup Iteration   3: 12138.416 ops/s
# Warmup Iteration   4: 12449.991 ops/s
# Warmup Iteration   5: 12995.694 ops/s
# Warmup Iteration   6: 12903.084 ops/s
# Warmup Iteration   7: 12727.176 ops/s
# Warmup Iteration   8: 13292.545 ops/s
# Warmup Iteration   9: 12066.759 ops/s
# Warmup Iteration  10: 12074.354 ops/s
# Warmup Iteration  11: 12635.468 ops/s
# Warmup Iteration  12: 12078.207 ops/s
# Warmup Iteration  13: 12128.836 ops/s
# Warmup Iteration  14: 12029.032 ops/s
# Warmup Iteration  15: 12063.162 ops/s
# Warmup Iteration  16: 12078.566 ops/s
# Warmup Iteration  17: 12316.120 ops/s
# Warmup Iteration  18: 15657.837 ops/s
# Warmup Iteration  19: 12712.632 ops/s
# Warmup Iteration  20: 12305.256 ops/s
Iteration   1: 12324.753 ops/s
Iteration   2: 12076.309 ops/s
Iteration   3: 12077.771 ops/s
Iteration   4: 12639.350 ops/s
Iteration   5: 12398.184 ops/s
Iteration   6: 12077.101 ops/s
Iteration   7: 12607.128 ops/s
Iteration   8: 12401.440 ops/s
Iteration   9: 12064.857 ops/s
Iteration  10: 12534.270 ops/s

WARNING: Not a HotSpot compiler command compatible VM ("anonymous-11.0.6"), compilerHints are disabled.
# Run progress: 70.00% complete, ETA 00:15:01
# Fork: 2 of 2
# Warmup Iteration   1: 11357.411 ops/s
# Warmup Iteration   2: 12069.667 ops/s
# Warmup Iteration   3: 11780.264 ops/s
# Warmup Iteration   4: 11944.807 ops/s
# Warmup Iteration   5: 11770.118 ops/s
# Warmup Iteration   6: 12004.869 ops/s
# Warmup Iteration   7: 11759.674 ops/s
# Warmup Iteration   8: 11817.063 ops/s
# Warmup Iteration   9: 12023.714 ops/s
# Warmup Iteration  10: 11789.138 ops/s
# Warmup Iteration  11: 12112.997 ops/s
# Warmup Iteration  12: 11795.726 ops/s
# Warmup Iteration  13: 11946.796 ops/s
# Warmup Iteration  14: 11791.373 ops/s
# Warmup Iteration  15: 12028.688 ops/s
# Warmup Iteration  16: 12667.398 ops/s
# Warmup Iteration  17: 12531.254 ops/s
# Warmup Iteration  18: 11763.336 ops/s
# Warmup Iteration  19: 11715.823 ops/s
# Warmup Iteration  20: 11772.016 ops/s
Iteration   1: 12606.595 ops/s
Iteration   2: 11846.875 ops/s
Iteration   3: 12140.763 ops/s
Iteration   4: 11800.038 ops/s
Iteration   5: 12348.690 ops/s
Iteration   6: 11776.819 ops/s
Iteration   7: 11892.331 ops/s
Iteration   8: 12778.865 ops/s
Iteration   9: 13285.737 ops/s
Iteration  10: 12307.797 ops/s


Result "jvmscompare.benchmark.PersonCombinedSummaryStats.combinedStatistics_JDK_Stream_Parallel":
  12299.284 ±(99.9%) 327.784 ops/s [Average]
  (min, avg, max) = (11776.819, 12299.284, 13285.737), stdev = 377.476
  CI (99.9%): [11971.500, 12627.067] (assumes normal distribution)


# JMH version: 1.23
# VM version: JDK 11.0.6, anonymous, 11.0.6+8-LTS
# *** WARNING: This VM is not supported by JMH. The produced benchmark data can be completely wrong.
# VM invoker: /Library/Java/JavaVirtualMachines/oraclejdk-11.0.6.jdk/Contents/Home/bin/java
# VM options: -Xms1024m -Xmx1024m
# Warmup: 20 iterations, 10 s each
# Measurement: 10 iterations, 10 s each
# Timeout: 10 min per iteration
# Threads: 1 thread, will synchronize iterations
# Benchmark mode: Throughput, ops/time
# Benchmark: jvmscompare.benchmark.PersonCombinedSummaryStats.combinedStatistics_JDK_Stream_Serial

WARNING: Not a HotSpot compiler command compatible VM ("anonymous-11.0.6"), compilerHints are disabled.
# Run progress: 80.00% complete, ETA 00:10:01
# Fork: 1 of 2
# Warmup Iteration   1: 77836.720 ops/s
# Warmup Iteration   2: 84864.065 ops/s
# Warmup Iteration   3: 85344.165 ops/s
# Warmup Iteration   4: 85274.545 ops/s
# Warmup Iteration   5: 85225.705 ops/s
# Warmup Iteration   6: 85365.785 ops/s
# Warmup Iteration   7: 85389.426 ops/s
# Warmup Iteration   8: 84139.057 ops/s
# Warmup Iteration   9: 85466.402 ops/s
# Warmup Iteration  10: 84718.156 ops/s
# Warmup Iteration  11: 85237.855 ops/s
# Warmup Iteration  12: 85388.910 ops/s
# Warmup Iteration  13: 85356.622 ops/s
# Warmup Iteration  14: 85443.541 ops/s
# Warmup Iteration  15: 85416.854 ops/s
# Warmup Iteration  16: 85349.079 ops/s
# Warmup Iteration  17: 85435.734 ops/s
# Warmup Iteration  18: 85441.356 ops/s
# Warmup Iteration  19: 85450.275 ops/s
# Warmup Iteration  20: 85466.255 ops/s
Iteration   1: 85508.747 ops/s
Iteration   2: 85291.665 ops/s
Iteration   3: 85279.286 ops/s
Iteration   4: 85093.756 ops/s
Iteration   5: 85336.255 ops/s
Iteration   6: 85410.043 ops/s
Iteration   7: 85465.216 ops/s
Iteration   8: 85439.223 ops/s
Iteration   9: 85429.488 ops/s
Iteration  10: 85443.848 ops/s

WARNING: Not a HotSpot compiler command compatible VM ("anonymous-11.0.6"), compilerHints are disabled.
# Run progress: 90.00% complete, ETA 00:05:00
# Fork: 2 of 2
# Warmup Iteration   1: 78205.588 ops/s
# Warmup Iteration   2: 85201.127 ops/s
# Warmup Iteration   3: 85448.657 ops/s
# Warmup Iteration   4: 85431.814 ops/s
# Warmup Iteration   5: 85529.946 ops/s
# Warmup Iteration   6: 85332.147 ops/s
# Warmup Iteration   7: 85430.252 ops/s
# Warmup Iteration   8: 85544.026 ops/s
# Warmup Iteration   9: 85551.880 ops/s
# Warmup Iteration  10: 85452.526 ops/s
# Warmup Iteration  11: 85526.688 ops/s
# Warmup Iteration  12: 85367.787 ops/s
# Warmup Iteration  13: 85321.792 ops/s
# Warmup Iteration  14: 85472.496 ops/s
# Warmup Iteration  15: 85466.535 ops/s
# Warmup Iteration  16: 85369.426 ops/s
# Warmup Iteration  17: 85577.372 ops/s
# Warmup Iteration  18: 83610.083 ops/s
# Warmup Iteration  19: 85576.582 ops/s
# Warmup Iteration  20: 85536.458 ops/s
Iteration   1: 85559.824 ops/s
Iteration   2: 85473.581 ops/s
Iteration   3: 85455.174 ops/s
Iteration   4: 85525.051 ops/s
Iteration   5: 85501.893 ops/s
Iteration   6: 85540.640 ops/s
Iteration   7: 85599.769 ops/s
Iteration   8: 85506.068 ops/s
Iteration   9: 85518.053 ops/s
Iteration  10: 85569.256 ops/s


Result "jvmscompare.benchmark.PersonCombinedSummaryStats.combinedStatistics_JDK_Stream_Serial":
  85447.342 ±(99.9%) 104.162 ops/s [Average]
  (min, avg, max) = (85093.756, 85447.342, 85599.769), stdev = 119.953
  CI (99.9%): [85343.180, 85551.504] (assumes normal distribution)


# Run complete. Total time: 00:50:06

REMEMBER: The numbers below are just data. To gain reusable insights, you need to follow up on
why the numbers are the way they are. Use profilers (see -prof, -lprof), design factorial
experiments, perform baseline and negative tests that provide experimental control, make sure
the benchmarking environment is safe on JVM/OS/HW level, ask for reviews from the domain experts.
Do not assume the numbers tell you what you want them to tell.

Benchmark                                                           Mode  Cnt      Score     Error  Units
PersonCombinedSummaryStats.combinedStatistics_EC_Eager_Serial      thrpt   20  93059.886 ±  53.788  ops/s
PersonCombinedSummaryStats.combinedStatistics_EC_Lazy_Serial       thrpt   20  94480.889 ± 240.008  ops/s
PersonCombinedSummaryStats.combinedStatistics_EC_Stream_Parallel   thrpt   20  12343.470 ± 339.305  ops/s
PersonCombinedSummaryStats.combinedStatistics_JDK_Stream_Parallel  thrpt   20  12299.284 ± 327.784  ops/s
PersonCombinedSummaryStats.combinedStatistics_JDK_Stream_Serial    thrpt   20  85447.342 ± 104.162  ops/s

Benchmark result is saved to benchmark-results/person-combined-summary-stats/01_OracleJDKPersonCombinedSummaryStats.csv
[INFO] ------------------------------------------------------------------------
[INFO] BUILD SUCCESS
[INFO] ------------------------------------------------------------------------
[INFO] Total time:  50:18 min
[INFO] Finished at: 2020-02-09T01:04:45-05:00
[INFO] ------------------------------------------------------------------------
