[INFO] Scanning for projects...
[INFO] 
[INFO] ---------------------< jvms-compare:jvms-compare >----------------------
[INFO] Building JVMs Compare 1.0.0
[INFO] --------------------------------[ jar ]---------------------------------
[INFO] 
[INFO] --- maven-clean-plugin:2.5:clean (default-clean) @ jvms-compare ---
[INFO] Deleting /Users/cguntur/projects/conf/jvms-compare/target
[INFO] 
[INFO] --- maven-toolchains-plugin:1.1:toolchain (default) @ jvms-compare ---
[INFO] Required toolchain: jdk [ vendor='graalvmee' version='11' ]
[INFO] Found matching toolchain for type jdk: JDK[/Library/Java/JavaVirtualMachines/graalvm-ee-java11-19.3.1/]
[INFO] 
[INFO] --- maven-dependency-plugin:3.1.1:build-classpath (build-classpath) @ jvms-compare ---
[INFO] Dependencies classpath:
/Users/cguntur/.m2/repository/org/apache/commons/commons-math3/3.2/commons-math3-3.2.jar:/Users/cguntur/.m2/repository/org/junit/jupiter/junit-jupiter-api/5.5.0/junit-jupiter-api-5.5.0.jar:/Users/cguntur/.m2/repository/org/eclipse/collections/eclipse-collections/10.0.0/eclipse-collections-10.0.0.jar:/Users/cguntur/.m2/repository/org/junit/platform/junit-platform-engine/1.5.0/junit-platform-engine-1.5.0.jar:/Users/cguntur/.m2/repository/org/junit/platform/junit-platform-commons/1.5.0/junit-platform-commons-1.5.0.jar:/Users/cguntur/.m2/repository/org/junit/jupiter/junit-jupiter-params/5.5.0/junit-jupiter-params-5.5.0.jar:/Users/cguntur/.m2/repository/org/junit/jupiter/junit-jupiter-engine/5.5.0/junit-jupiter-engine-5.5.0.jar:/Users/cguntur/.m2/repository/org/junit/jupiter/junit-jupiter/5.5.0/junit-jupiter-5.5.0.jar:/Users/cguntur/.m2/repository/org/opentest4j/opentest4j/1.2.0/opentest4j-1.2.0.jar:/Users/cguntur/.m2/repository/org/openjdk/jmh/jmh-core/1.23/jmh-core-1.23.jar:/Users/cguntur/.m2/repository/org/apiguardian/apiguardian-api/1.1.0/apiguardian-api-1.1.0.jar:/Users/cguntur/.m2/repository/net/sf/jopt-simple/jopt-simple/4.6/jopt-simple-4.6.jar:/Users/cguntur/.m2/repository/org/eclipse/collections/eclipse-collections-api/10.0.0/eclipse-collections-api-10.0.0.jar
[INFO] 
[INFO] --- maven-resources-plugin:2.6:resources (default-resources) @ jvms-compare ---
[INFO] Using 'UTF-8' encoding to copy filtered resources.
[INFO] Copying 1 resource
[INFO] 
[INFO] --- maven-compiler-plugin:3.8.1:compile (default-compile) @ jvms-compare ---
[INFO] Toolchain in maven-compiler-plugin: JDK[/Library/Java/JavaVirtualMachines/graalvm-ee-java11-19.3.1/]
[INFO] Changes detected - recompiling the module!
[INFO] Compiling 10 source files to /Users/cguntur/projects/conf/jvms-compare/target/classes
[INFO] 
[INFO] --- maven-resources-plugin:2.6:testResources (default-testResources) @ jvms-compare ---
[INFO] Using 'UTF-8' encoding to copy filtered resources.
[INFO] Copying 1 resource
[INFO] 
[INFO] --- maven-compiler-plugin:3.8.1:testCompile (default-testCompile) @ jvms-compare ---
[INFO] Toolchain in maven-compiler-plugin: JDK[/Library/Java/JavaVirtualMachines/graalvm-ee-java11-19.3.1/]
[INFO] Changes detected - recompiling the module!
[INFO] Compiling 2 source files to /Users/cguntur/projects/conf/jvms-compare/target/test-classes
[INFO] 
[INFO] --- maven-surefire-plugin:2.12.4:test (default-test) @ jvms-compare ---
[INFO] Toolchain in surefire-plugin: JDK[/Library/Java/JavaVirtualMachines/graalvm-ee-java11-19.3.1/]
[INFO] Surefire report directory: /Users/cguntur/projects/conf/jvms-compare/target/surefire-reports

-------------------------------------------------------
 T E S T S
-------------------------------------------------------
Running jvmscompare.PersonTest
Tests run: 3, Failures: 0, Errors: 0, Skipped: 0, Time elapsed: 1.655 sec
Running jvmscompare.IntListTest
Tests run: 3, Failures: 0, Errors: 0, Skipped: 0, Time elapsed: 1.476 sec

Results :

Tests run: 6, Failures: 0, Errors: 0, Skipped: 0

[INFO] 
[INFO] --- exec-maven-plugin:1.6.0:exec (combinedSummaryStats) @ jvms-compare ---
[INFO] Toolchain in exec-maven-plugin: JDK[/Library/Java/JavaVirtualMachines/graalvm-ee-java11-19.3.1/]
##### Heap utilization statistics [MB] #####
Used Memory:6
Free Memory:1017
Total Memory:1024
Max Memory:1024
Java Runtime Environment version: 11.0.6
Java Runtime Environment vendor: Oracle Corporation

Java Runtime Name: Java(TM) SE Runtime Environment
Java Runtime Version: 11.0.6+1-LTS-jvmci-19.3-b07

Java Virtual Machine name: anonymous
Java Virtual Machine vendor: Oracle Corporation
Java Virtual Machine version: 11.0.6+1-LTS-jvmci-19.3-b07

Java Class Version: 55.0

Benchmark size: 1000
Benchmark forks: 2
Benchmark warmups: 20
Benchmark measurements: 10

WARNING: An illegal reflective access operation has occurred
WARNING: Illegal reflective access by org.openjdk.jmh.util.Utils (file:/Users/cguntur/.m2/repository/org/openjdk/jmh/jmh-core/1.23/jmh-core-1.23.jar) to field java.io.PrintStream.charOut
WARNING: Please consider reporting this to the maintainers of org.openjdk.jmh.util.Utils
WARNING: Use --illegal-access=warn to enable warnings of further illegal reflective access operations
WARNING: All illegal access operations will be denied in a future release
# JMH version: 1.23
# VM version: JDK 11.0.6, anonymous, 11.0.6+1-LTS-jvmci-19.3-b07
# *** WARNING: This VM is not supported by JMH. The produced benchmark data can be completely wrong.
# VM invoker: /Library/Java/JavaVirtualMachines/graalvm-ee-java11-19.3.1/Contents/Home/bin/java
# VM options: -XX:+UnlockExperimentalVMOptions -XX:+EnableJVMCIProduct -XX:-UnlockExperimentalVMOptions -Xms1024m -Xmx1024m
# Warmup: 20 iterations, 10 s each
# Measurement: 10 iterations, 10 s each
# Timeout: 10 min per iteration
# Threads: 1 thread, will synchronize iterations
# Benchmark mode: Throughput, ops/time
# Benchmark: jvmscompare.benchmark.PersonCombinedSummaryStats.combinedStatistics_EC_Eager_Serial

WARNING: Not a HotSpot compiler command compatible VM ("anonymous-11.0.6"), compilerHints are disabled.
# Run progress: 0.00% complete, ETA 00:50:00
# Fork: 1 of 2
# Warmup Iteration   1: 82357.738 ops/s
# Warmup Iteration   2: 89330.944 ops/s
# Warmup Iteration   3: 90146.993 ops/s
# Warmup Iteration   4: 89255.020 ops/s
# Warmup Iteration   5: 90359.435 ops/s
# Warmup Iteration   6: 90939.622 ops/s
# Warmup Iteration   7: 91100.564 ops/s
# Warmup Iteration   8: 90879.893 ops/s
# Warmup Iteration   9: 90846.591 ops/s
# Warmup Iteration  10: 90890.860 ops/s
# Warmup Iteration  11: 90973.267 ops/s
# Warmup Iteration  12: 91008.088 ops/s
# Warmup Iteration  13: 91024.644 ops/s
# Warmup Iteration  14: 90981.666 ops/s
# Warmup Iteration  15: 90928.756 ops/s
# Warmup Iteration  16: 90943.949 ops/s
# Warmup Iteration  17: 90943.726 ops/s
# Warmup Iteration  18: 91028.269 ops/s
# Warmup Iteration  19: 90953.571 ops/s
# Warmup Iteration  20: 90978.214 ops/s
Iteration   1: 91072.042 ops/s
Iteration   2: 90975.074 ops/s
Iteration   3: 90662.884 ops/s
Iteration   4: 91005.517 ops/s
Iteration   5: 90293.889 ops/s
Iteration   6: 90834.991 ops/s
Iteration   7: 90901.932 ops/s
Iteration   8: 90925.827 ops/s
Iteration   9: 91017.227 ops/s
Iteration  10: 91060.752 ops/s

WARNING: Not a HotSpot compiler command compatible VM ("anonymous-11.0.6"), compilerHints are disabled.
# Run progress: 10.00% complete, ETA 00:45:06
# Fork: 2 of 2
# Warmup Iteration   1: 81827.310 ops/s
# Warmup Iteration   2: 88376.332 ops/s
# Warmup Iteration   3: 89140.816 ops/s
# Warmup Iteration   4: 89146.096 ops/s
# Warmup Iteration   5: 89720.597 ops/s
# Warmup Iteration   6: 90134.820 ops/s
# Warmup Iteration   7: 90119.213 ops/s
# Warmup Iteration   8: 90043.223 ops/s
# Warmup Iteration   9: 90188.553 ops/s
# Warmup Iteration  10: 90030.580 ops/s
# Warmup Iteration  11: 90109.964 ops/s
# Warmup Iteration  12: 90119.222 ops/s
# Warmup Iteration  13: 89860.935 ops/s
# Warmup Iteration  14: 90124.504 ops/s
# Warmup Iteration  15: 90125.177 ops/s
# Warmup Iteration  16: 90217.840 ops/s
# Warmup Iteration  17: 90186.460 ops/s
# Warmup Iteration  18: 90282.518 ops/s
# Warmup Iteration  19: 90071.680 ops/s
# Warmup Iteration  20: 90321.096 ops/s
Iteration   1: 90220.060 ops/s
Iteration   2: 90222.501 ops/s
Iteration   3: 90054.758 ops/s
Iteration   4: 90172.195 ops/s
Iteration   5: 90182.149 ops/s
Iteration   6: 89970.493 ops/s
Iteration   7: 90043.902 ops/s
Iteration   8: 90168.760 ops/s
Iteration   9: 90319.446 ops/s
Iteration  10: 90006.049 ops/s


Result "jvmscompare.benchmark.PersonCombinedSummaryStats.combinedStatistics_EC_Eager_Serial":
  90505.522 ±(99.9%) 364.663 ops/s [Average]
  (min, avg, max) = (89970.493, 90505.522, 91072.042), stdev = 419.947
  CI (99.9%): [90140.859, 90870.186] (assumes normal distribution)


# JMH version: 1.23
# VM version: JDK 11.0.6, anonymous, 11.0.6+1-LTS-jvmci-19.3-b07
# *** WARNING: This VM is not supported by JMH. The produced benchmark data can be completely wrong.
# VM invoker: /Library/Java/JavaVirtualMachines/graalvm-ee-java11-19.3.1/Contents/Home/bin/java
# VM options: -XX:+UnlockExperimentalVMOptions -XX:+EnableJVMCIProduct -XX:-UnlockExperimentalVMOptions -Xms1024m -Xmx1024m
# Warmup: 20 iterations, 10 s each
# Measurement: 10 iterations, 10 s each
# Timeout: 10 min per iteration
# Threads: 1 thread, will synchronize iterations
# Benchmark mode: Throughput, ops/time
# Benchmark: jvmscompare.benchmark.PersonCombinedSummaryStats.combinedStatistics_EC_Lazy_Serial

WARNING: Not a HotSpot compiler command compatible VM ("anonymous-11.0.6"), compilerHints are disabled.
# Run progress: 20.00% complete, ETA 00:40:05
# Fork: 1 of 2
# Warmup Iteration   1: 81519.223 ops/s
# Warmup Iteration   2: 94815.922 ops/s
# Warmup Iteration   3: 93998.977 ops/s
# Warmup Iteration   4: 93883.252 ops/s
# Warmup Iteration   5: 93926.730 ops/s
# Warmup Iteration   6: 94206.986 ops/s
# Warmup Iteration   7: 93769.557 ops/s
# Warmup Iteration   8: 94213.579 ops/s
# Warmup Iteration   9: 93858.057 ops/s
# Warmup Iteration  10: 94106.300 ops/s
# Warmup Iteration  11: 94052.468 ops/s
# Warmup Iteration  12: 93570.236 ops/s
# Warmup Iteration  13: 94146.997 ops/s
# Warmup Iteration  14: 94150.037 ops/s
# Warmup Iteration  15: 93672.788 ops/s
# Warmup Iteration  16: 94212.014 ops/s
# Warmup Iteration  17: 94195.561 ops/s
# Warmup Iteration  18: 94146.096 ops/s
# Warmup Iteration  19: 91764.390 ops/s
# Warmup Iteration  20: 94229.520 ops/s
Iteration   1: 94021.405 ops/s
Iteration   2: 94152.320 ops/s
Iteration   3: 94278.446 ops/s
Iteration   4: 94115.858 ops/s
Iteration   5: 94171.504 ops/s
Iteration   6: 94157.612 ops/s
Iteration   7: 94151.778 ops/s
Iteration   8: 94178.595 ops/s
Iteration   9: 94315.292 ops/s
Iteration  10: 92271.546 ops/s

WARNING: Not a HotSpot compiler command compatible VM ("anonymous-11.0.6"), compilerHints are disabled.
# Run progress: 30.00% complete, ETA 00:35:05
# Fork: 2 of 2
# Warmup Iteration   1: 81213.154 ops/s
# Warmup Iteration   2: 94766.546 ops/s
# Warmup Iteration   3: 93779.994 ops/s
# Warmup Iteration   4: 93556.515 ops/s
# Warmup Iteration   5: 93975.537 ops/s
# Warmup Iteration   6: 94198.228 ops/s
# Warmup Iteration   7: 93867.320 ops/s
# Warmup Iteration   8: 94227.944 ops/s
# Warmup Iteration   9: 94005.758 ops/s
# Warmup Iteration  10: 93878.005 ops/s
# Warmup Iteration  11: 93264.554 ops/s
# Warmup Iteration  12: 94190.428 ops/s
# Warmup Iteration  13: 94266.713 ops/s
# Warmup Iteration  14: 93772.295 ops/s
# Warmup Iteration  15: 94216.397 ops/s
# Warmup Iteration  16: 94186.196 ops/s
# Warmup Iteration  17: 93934.743 ops/s
# Warmup Iteration  18: 94013.684 ops/s
# Warmup Iteration  19: 94249.167 ops/s
# Warmup Iteration  20: 94108.621 ops/s
Iteration   1: 94119.476 ops/s
Iteration   2: 94142.263 ops/s
Iteration   3: 94152.557 ops/s
Iteration   4: 94172.959 ops/s
Iteration   5: 93945.135 ops/s
Iteration   6: 94131.462 ops/s
Iteration   7: 94213.223 ops/s
Iteration   8: 94141.050 ops/s
Iteration   9: 94122.342 ops/s
Iteration  10: 93561.131 ops/s


Result "jvmscompare.benchmark.PersonCombinedSummaryStats.combinedStatistics_EC_Lazy_Serial":
  94025.798 ±(99.9%) 382.076 ops/s [Average]
  (min, avg, max) = (92271.546, 94025.798, 94315.292), stdev = 439.999
  CI (99.9%): [93643.722, 94407.873] (assumes normal distribution)


# JMH version: 1.23
# VM version: JDK 11.0.6, anonymous, 11.0.6+1-LTS-jvmci-19.3-b07
# *** WARNING: This VM is not supported by JMH. The produced benchmark data can be completely wrong.
# VM invoker: /Library/Java/JavaVirtualMachines/graalvm-ee-java11-19.3.1/Contents/Home/bin/java
# VM options: -XX:+UnlockExperimentalVMOptions -XX:+EnableJVMCIProduct -XX:-UnlockExperimentalVMOptions -Xms1024m -Xmx1024m
# Warmup: 20 iterations, 10 s each
# Measurement: 10 iterations, 10 s each
# Timeout: 10 min per iteration
# Threads: 1 thread, will synchronize iterations
# Benchmark mode: Throughput, ops/time
# Benchmark: jvmscompare.benchmark.PersonCombinedSummaryStats.combinedStatistics_EC_Stream_Parallel

WARNING: Not a HotSpot compiler command compatible VM ("anonymous-11.0.6"), compilerHints are disabled.
# Run progress: 40.00% complete, ETA 00:30:04
# Fork: 1 of 2
# Warmup Iteration   1: 16033.553 ops/s
# Warmup Iteration   2: 11929.879 ops/s
# Warmup Iteration   3: 11883.463 ops/s
# Warmup Iteration   4: 12265.636 ops/s
# Warmup Iteration   5: 11880.314 ops/s
# Warmup Iteration   6: 11935.652 ops/s
# Warmup Iteration   7: 11846.911 ops/s
# Warmup Iteration   8: 12217.953 ops/s
# Warmup Iteration   9: 12664.097 ops/s
# Warmup Iteration  10: 11922.523 ops/s
# Warmup Iteration  11: 11907.186 ops/s
# Warmup Iteration  12: 11862.567 ops/s
# Warmup Iteration  13: 12060.212 ops/s
# Warmup Iteration  14: 12265.462 ops/s
# Warmup Iteration  15: 11941.320 ops/s
# Warmup Iteration  16: 14243.040 ops/s
# Warmup Iteration  17: 11867.161 ops/s
# Warmup Iteration  18: 11909.407 ops/s
# Warmup Iteration  19: 11809.983 ops/s
# Warmup Iteration  20: 11907.297 ops/s
Iteration   1: 11872.334 ops/s
Iteration   2: 11877.305 ops/s
Iteration   3: 11892.295 ops/s
Iteration   4: 11885.460 ops/s
Iteration   5: 11903.379 ops/s
Iteration   6: 12037.798 ops/s
Iteration   7: 12620.852 ops/s
Iteration   8: 11879.057 ops/s
Iteration   9: 11881.370 ops/s
Iteration  10: 11886.026 ops/s

WARNING: Not a HotSpot compiler command compatible VM ("anonymous-11.0.6"), compilerHints are disabled.
# Run progress: 50.00% complete, ETA 00:25:03
# Fork: 2 of 2
# Warmup Iteration   1: 13461.241 ops/s
# Warmup Iteration   2: 12854.315 ops/s
# Warmup Iteration   3: 12117.619 ops/s
# Warmup Iteration   4: 12116.326 ops/s
# Warmup Iteration   5: 12130.564 ops/s
# Warmup Iteration   6: 12149.031 ops/s
# Warmup Iteration   7: 12447.308 ops/s
# Warmup Iteration   8: 12262.168 ops/s
# Warmup Iteration   9: 12099.433 ops/s
# Warmup Iteration  10: 12187.222 ops/s
# Warmup Iteration  11: 12060.001 ops/s
# Warmup Iteration  12: 12088.625 ops/s
# Warmup Iteration  13: 12279.070 ops/s
# Warmup Iteration  14: 12095.799 ops/s
# Warmup Iteration  15: 12245.885 ops/s
# Warmup Iteration  16: 12102.645 ops/s
# Warmup Iteration  17: 12236.846 ops/s
# Warmup Iteration  18: 12084.023 ops/s
# Warmup Iteration  19: 13344.918 ops/s
# Warmup Iteration  20: 12088.513 ops/s
Iteration   1: 12438.849 ops/s
Iteration   2: 12082.494 ops/s
Iteration   3: 12252.627 ops/s
Iteration   4: 12081.357 ops/s
Iteration   5: 12062.154 ops/s
Iteration   6: 12406.138 ops/s
Iteration   7: 12090.132 ops/s
Iteration   8: 12109.803 ops/s
Iteration   9: 12249.054 ops/s
Iteration  10: 15628.460 ops/s


Result "jvmscompare.benchmark.PersonCombinedSummaryStats.combinedStatistics_EC_Stream_Parallel":
  12256.847 ±(99.9%) 714.432 ops/s [Average]
  (min, avg, max) = (11872.334, 12256.847, 15628.460), stdev = 822.741
  CI (99.9%): [11542.415, 12971.279] (assumes normal distribution)


# JMH version: 1.23
# VM version: JDK 11.0.6, anonymous, 11.0.6+1-LTS-jvmci-19.3-b07
# *** WARNING: This VM is not supported by JMH. The produced benchmark data can be completely wrong.
# VM invoker: /Library/Java/JavaVirtualMachines/graalvm-ee-java11-19.3.1/Contents/Home/bin/java
# VM options: -XX:+UnlockExperimentalVMOptions -XX:+EnableJVMCIProduct -XX:-UnlockExperimentalVMOptions -Xms1024m -Xmx1024m
# Warmup: 20 iterations, 10 s each
# Measurement: 10 iterations, 10 s each
# Timeout: 10 min per iteration
# Threads: 1 thread, will synchronize iterations
# Benchmark mode: Throughput, ops/time
# Benchmark: jvmscompare.benchmark.PersonCombinedSummaryStats.combinedStatistics_JDK_Stream_Parallel

WARNING: Not a HotSpot compiler command compatible VM ("anonymous-11.0.6"), compilerHints are disabled.
# Run progress: 60.00% complete, ETA 00:20:02
# Fork: 1 of 2
# Warmup Iteration   1: 13407.314 ops/s
# Warmup Iteration   2: 10918.637 ops/s
# Warmup Iteration   3: 11653.935 ops/s
# Warmup Iteration   4: 11266.773 ops/s
# Warmup Iteration   5: 11320.769 ops/s
# Warmup Iteration   6: 11272.471 ops/s
# Warmup Iteration   7: 10970.713 ops/s
# Warmup Iteration   8: 11656.209 ops/s
# Warmup Iteration   9: 11501.412 ops/s
# Warmup Iteration  10: 11238.887 ops/s
# Warmup Iteration  11: 10978.994 ops/s
# Warmup Iteration  12: 10993.563 ops/s
# Warmup Iteration  13: 10988.208 ops/s
# Warmup Iteration  14: 11390.858 ops/s
# Warmup Iteration  15: 11146.641 ops/s
# Warmup Iteration  16: 10993.199 ops/s
# Warmup Iteration  17: 10993.708 ops/s
# Warmup Iteration  18: 11008.987 ops/s
# Warmup Iteration  19: 11068.767 ops/s
# Warmup Iteration  20: 11007.111 ops/s
Iteration   1: 10962.344 ops/s
Iteration   2: 11294.803 ops/s
Iteration   3: 10974.197 ops/s
Iteration   4: 11492.867 ops/s
Iteration   5: 10992.314 ops/s
Iteration   6: 10989.450 ops/s
Iteration   7: 10996.664 ops/s
Iteration   8: 10997.001 ops/s
Iteration   9: 10996.233 ops/s
Iteration  10: 11023.681 ops/s

WARNING: Not a HotSpot compiler command compatible VM ("anonymous-11.0.6"), compilerHints are disabled.
# Run progress: 70.00% complete, ETA 00:15:02
# Fork: 2 of 2
# Warmup Iteration   1: 13490.546 ops/s
# Warmup Iteration   2: 12122.568 ops/s
# Warmup Iteration   3: 11215.910 ops/s
# Warmup Iteration   4: 11621.142 ops/s
# Warmup Iteration   5: 11206.413 ops/s
# Warmup Iteration   6: 11216.890 ops/s
# Warmup Iteration   7: 11196.046 ops/s
# Warmup Iteration   8: 11186.028 ops/s
# Warmup Iteration   9: 11216.481 ops/s
# Warmup Iteration  10: 11772.792 ops/s
# Warmup Iteration  11: 12082.669 ops/s
# Warmup Iteration  12: 12398.649 ops/s
# Warmup Iteration  13: 11244.620 ops/s
# Warmup Iteration  14: 11199.601 ops/s
# Warmup Iteration  15: 11226.813 ops/s
# Warmup Iteration  16: 12195.825 ops/s
# Warmup Iteration  17: 11816.330 ops/s
# Warmup Iteration  18: 11200.668 ops/s
# Warmup Iteration  19: 11518.098 ops/s
# Warmup Iteration  20: 11185.047 ops/s
Iteration   1: 11695.499 ops/s
Iteration   2: 11186.180 ops/s
Iteration   3: 11962.029 ops/s
Iteration   4: 11200.093 ops/s
Iteration   5: 11180.357 ops/s
Iteration   6: 11637.913 ops/s
Iteration   7: 11214.418 ops/s
Iteration   8: 11231.297 ops/s
Iteration   9: 12176.563 ops/s
Iteration  10: 12429.904 ops/s


Result "jvmscompare.benchmark.PersonCombinedSummaryStats.combinedStatistics_JDK_Stream_Parallel":
  11331.690 ±(99.9%) 377.147 ops/s [Average]
  (min, avg, max) = (10962.344, 11331.690, 12429.904), stdev = 434.323
  CI (99.9%): [10954.544, 11708.837] (assumes normal distribution)


# JMH version: 1.23
# VM version: JDK 11.0.6, anonymous, 11.0.6+1-LTS-jvmci-19.3-b07
# *** WARNING: This VM is not supported by JMH. The produced benchmark data can be completely wrong.
# VM invoker: /Library/Java/JavaVirtualMachines/graalvm-ee-java11-19.3.1/Contents/Home/bin/java
# VM options: -XX:+UnlockExperimentalVMOptions -XX:+EnableJVMCIProduct -XX:-UnlockExperimentalVMOptions -Xms1024m -Xmx1024m
# Warmup: 20 iterations, 10 s each
# Measurement: 10 iterations, 10 s each
# Timeout: 10 min per iteration
# Threads: 1 thread, will synchronize iterations
# Benchmark mode: Throughput, ops/time
# Benchmark: jvmscompare.benchmark.PersonCombinedSummaryStats.combinedStatistics_JDK_Stream_Serial

WARNING: Not a HotSpot compiler command compatible VM ("anonymous-11.0.6"), compilerHints are disabled.
# Run progress: 80.00% complete, ETA 00:10:01
# Fork: 1 of 2
# Warmup Iteration   1: 75019.753 ops/s
# Warmup Iteration   2: 86676.908 ops/s
# Warmup Iteration   3: 90259.700 ops/s
# Warmup Iteration   4: 90375.442 ops/s
# Warmup Iteration   5: 90882.426 ops/s
# Warmup Iteration   6: 90868.639 ops/s
# Warmup Iteration   7: 90811.200 ops/s
# Warmup Iteration   8: 90908.496 ops/s
# Warmup Iteration   9: 91007.979 ops/s
# Warmup Iteration  10: 90814.988 ops/s
# Warmup Iteration  11: 90937.540 ops/s
# Warmup Iteration  12: 90954.296 ops/s
# Warmup Iteration  13: 90992.528 ops/s
# Warmup Iteration  14: 90993.184 ops/s
# Warmup Iteration  15: 91048.282 ops/s
# Warmup Iteration  16: 90939.097 ops/s
# Warmup Iteration  17: 91020.843 ops/s
# Warmup Iteration  18: 91001.514 ops/s
# Warmup Iteration  19: 91044.478 ops/s
# Warmup Iteration  20: 91005.511 ops/s
Iteration   1: 90890.451 ops/s
Iteration   2: 90914.317 ops/s
Iteration   3: 90529.826 ops/s
Iteration   4: 90923.782 ops/s
Iteration   5: 90760.017 ops/s
Iteration   6: 91030.660 ops/s
Iteration   7: 90852.519 ops/s
Iteration   8: 90915.682 ops/s
Iteration   9: 91013.104 ops/s
Iteration  10: 88881.481 ops/s

WARNING: Not a HotSpot compiler command compatible VM ("anonymous-11.0.6"), compilerHints are disabled.
# Run progress: 90.00% complete, ETA 00:05:00
# Fork: 2 of 2
# Warmup Iteration   1: 79205.668 ops/s
# Warmup Iteration   2: 86558.888 ops/s
# Warmup Iteration   3: 90139.866 ops/s
# Warmup Iteration   4: 90360.777 ops/s
# Warmup Iteration   5: 91014.124 ops/s
# Warmup Iteration   6: 90960.220 ops/s
# Warmup Iteration   7: 90927.826 ops/s
# Warmup Iteration   8: 90974.068 ops/s
# Warmup Iteration   9: 90889.815 ops/s
# Warmup Iteration  10: 90813.469 ops/s
# Warmup Iteration  11: 90886.182 ops/s
# Warmup Iteration  12: 90689.086 ops/s
# Warmup Iteration  13: 90957.078 ops/s
# Warmup Iteration  14: 90963.967 ops/s
# Warmup Iteration  15: 90970.226 ops/s
# Warmup Iteration  16: 90910.268 ops/s
# Warmup Iteration  17: 90990.695 ops/s
# Warmup Iteration  18: 90989.209 ops/s
# Warmup Iteration  19: 90870.178 ops/s
# Warmup Iteration  20: 90888.005 ops/s
Iteration   1: 91012.689 ops/s
Iteration   2: 90383.142 ops/s
Iteration   3: 90750.191 ops/s
Iteration   4: 90997.429 ops/s
Iteration   5: 90979.747 ops/s
Iteration   6: 90990.744 ops/s
Iteration   7: 90936.076 ops/s
Iteration   8: 91003.478 ops/s
Iteration   9: 90908.772 ops/s
Iteration  10: 90672.878 ops/s


Result "jvmscompare.benchmark.PersonCombinedSummaryStats.combinedStatistics_JDK_Stream_Serial":
  90767.349 ±(99.9%) 413.215 ops/s [Average]
  (min, avg, max) = (88881.481, 90767.349, 91030.660), stdev = 475.859
  CI (99.9%): [90354.135, 91180.564] (assumes normal distribution)


# Run complete. Total time: 00:50:06

REMEMBER: The numbers below are just data. To gain reusable insights, you need to follow up on
why the numbers are the way they are. Use profilers (see -prof, -lprof), design factorial
experiments, perform baseline and negative tests that provide experimental control, make sure
the benchmarking environment is safe on JVM/OS/HW level, ask for reviews from the domain experts.
Do not assume the numbers tell you what you want them to tell.

Benchmark                                                           Mode  Cnt      Score     Error  Units
PersonCombinedSummaryStats.combinedStatistics_EC_Eager_Serial      thrpt   20  90505.522 ± 364.663  ops/s
PersonCombinedSummaryStats.combinedStatistics_EC_Lazy_Serial       thrpt   20  94025.798 ± 382.076  ops/s
PersonCombinedSummaryStats.combinedStatistics_EC_Stream_Parallel   thrpt   20  12256.847 ± 714.432  ops/s
PersonCombinedSummaryStats.combinedStatistics_JDK_Stream_Parallel  thrpt   20  11331.690 ± 377.147  ops/s
PersonCombinedSummaryStats.combinedStatistics_JDK_Stream_Serial    thrpt   20  90767.349 ± 413.215  ops/s

Benchmark result is saved to benchmark-results/person-combined-summary-stats/02_GraalEEPersonCombinedSummaryStats.csv
[INFO] ------------------------------------------------------------------------
[INFO] BUILD SUCCESS
[INFO] ------------------------------------------------------------------------
[INFO] Total time:  50:20 min
[INFO] Finished at: 2020-02-09T08:07:49-05:00
[INFO] ------------------------------------------------------------------------
