[INFO] Scanning for projects...
[INFO] 
[INFO] ---------------------< jvms-compare:jvms-compare >----------------------
[INFO] Building JVMs Compare 1.0.0
[INFO] --------------------------------[ jar ]---------------------------------
[INFO] 
[INFO] --- maven-clean-plugin:2.5:clean (default-clean) @ jvms-compare ---
[INFO] Deleting /Users/cguntur/projects/conf/jvms-compare/target
[INFO] 
[INFO] --- maven-toolchains-plugin:1.1:toolchain (default) @ jvms-compare ---
[INFO] Required toolchain: jdk [ vendor='AdoptOpenJDKHotspot' version='11' ]
[INFO] Found matching toolchain for type jdk: JDK[/Library/Java/JavaVirtualMachines/adoptopenjdk-11.jdk/Contents/Home/]
[INFO] 
[INFO] --- maven-dependency-plugin:3.1.1:build-classpath (build-classpath) @ jvms-compare ---
[INFO] Dependencies classpath:
/Users/cguntur/.m2/repository/org/apache/commons/commons-math3/3.2/commons-math3-3.2.jar:/Users/cguntur/.m2/repository/org/junit/jupiter/junit-jupiter-api/5.5.0/junit-jupiter-api-5.5.0.jar:/Users/cguntur/.m2/repository/org/eclipse/collections/eclipse-collections/10.0.0/eclipse-collections-10.0.0.jar:/Users/cguntur/.m2/repository/org/junit/platform/junit-platform-engine/1.5.0/junit-platform-engine-1.5.0.jar:/Users/cguntur/.m2/repository/org/junit/platform/junit-platform-commons/1.5.0/junit-platform-commons-1.5.0.jar:/Users/cguntur/.m2/repository/org/junit/jupiter/junit-jupiter-params/5.5.0/junit-jupiter-params-5.5.0.jar:/Users/cguntur/.m2/repository/org/junit/jupiter/junit-jupiter-engine/5.5.0/junit-jupiter-engine-5.5.0.jar:/Users/cguntur/.m2/repository/org/junit/jupiter/junit-jupiter/5.5.0/junit-jupiter-5.5.0.jar:/Users/cguntur/.m2/repository/org/opentest4j/opentest4j/1.2.0/opentest4j-1.2.0.jar:/Users/cguntur/.m2/repository/org/openjdk/jmh/jmh-core/1.23/jmh-core-1.23.jar:/Users/cguntur/.m2/repository/org/apiguardian/apiguardian-api/1.1.0/apiguardian-api-1.1.0.jar:/Users/cguntur/.m2/repository/net/sf/jopt-simple/jopt-simple/4.6/jopt-simple-4.6.jar:/Users/cguntur/.m2/repository/org/eclipse/collections/eclipse-collections-api/10.0.0/eclipse-collections-api-10.0.0.jar
[INFO] 
[INFO] --- maven-resources-plugin:2.6:resources (default-resources) @ jvms-compare ---
[INFO] Using 'UTF-8' encoding to copy filtered resources.
[INFO] Copying 1 resource
[INFO] 
[INFO] --- maven-compiler-plugin:3.8.1:compile (default-compile) @ jvms-compare ---
[INFO] Toolchain in maven-compiler-plugin: JDK[/Library/Java/JavaVirtualMachines/adoptopenjdk-11.jdk/Contents/Home/]
[INFO] Changes detected - recompiling the module!
[INFO] Compiling 10 source files to /Users/cguntur/projects/conf/jvms-compare/target/classes
[INFO] 
[INFO] --- maven-resources-plugin:2.6:testResources (default-testResources) @ jvms-compare ---
[INFO] Using 'UTF-8' encoding to copy filtered resources.
[INFO] Copying 1 resource
[INFO] 
[INFO] --- maven-compiler-plugin:3.8.1:testCompile (default-testCompile) @ jvms-compare ---
[INFO] Toolchain in maven-compiler-plugin: JDK[/Library/Java/JavaVirtualMachines/adoptopenjdk-11.jdk/Contents/Home/]
[INFO] Changes detected - recompiling the module!
[INFO] Compiling 2 source files to /Users/cguntur/projects/conf/jvms-compare/target/test-classes
[INFO] 
[INFO] --- maven-surefire-plugin:2.12.4:test (default-test) @ jvms-compare ---
[INFO] Toolchain in surefire-plugin: JDK[/Library/Java/JavaVirtualMachines/adoptopenjdk-11.jdk/Contents/Home/]
[INFO] Surefire report directory: /Users/cguntur/projects/conf/jvms-compare/target/surefire-reports

-------------------------------------------------------
 T E S T S
-------------------------------------------------------
Running jvmscompare.PersonTest
Tests run: 3, Failures: 0, Errors: 0, Skipped: 0, Time elapsed: 1.384 sec
Running jvmscompare.IntListTest
Tests run: 3, Failures: 0, Errors: 0, Skipped: 0, Time elapsed: 1.409 sec

Results :

Tests run: 6, Failures: 0, Errors: 0, Skipped: 0

[INFO] 
[INFO] --- exec-maven-plugin:1.6.0:exec (combinedSummaryStats) @ jvms-compare ---
[INFO] Toolchain in exec-maven-plugin: JDK[/Library/Java/JavaVirtualMachines/adoptopenjdk-11.jdk/Contents/Home/]
##### Heap utilization statistics [MB] #####
Used Memory:4
Free Memory:1019
Total Memory:1024
Max Memory:1024
Java Runtime Environment version: 11.0.6
Java Runtime Environment vendor: AdoptOpenJDK

Java Runtime Name: OpenJDK Runtime Environment
Java Runtime Version: 11.0.6+10

Java Virtual Machine name: anonymous
Java Virtual Machine vendor: AdoptOpenJDK
Java Virtual Machine version: 11.0.6+10

Java Class Version: 55.0

Benchmark size: 1000
Benchmark forks: 2
Benchmark warmups: 20
Benchmark measurements: 10

WARNING: An illegal reflective access operation has occurred
WARNING: Illegal reflective access by org.openjdk.jmh.util.Utils (file:/Users/cguntur/.m2/repository/org/openjdk/jmh/jmh-core/1.23/jmh-core-1.23.jar) to field java.io.PrintStream.charOut
WARNING: Please consider reporting this to the maintainers of org.openjdk.jmh.util.Utils
WARNING: Use --illegal-access=warn to enable warnings of further illegal reflective access operations
WARNING: All illegal access operations will be denied in a future release
# JMH version: 1.23
# VM version: JDK 11.0.6, anonymous, 11.0.6+10
# *** WARNING: This VM is not supported by JMH. The produced benchmark data can be completely wrong.
# VM invoker: /Library/Java/JavaVirtualMachines/adoptopenjdk-11.jdk/Contents/Home/bin/java
# VM options: -Xms1024m -Xmx1024m
# Warmup: 20 iterations, 10 s each
# Measurement: 10 iterations, 10 s each
# Timeout: 10 min per iteration
# Threads: 1 thread, will synchronize iterations
# Benchmark mode: Throughput, ops/time
# Benchmark: jvmscompare.benchmark.PersonCombinedSummaryStats.combinedStatistics_EC_Eager_Serial

WARNING: Not a HotSpot compiler command compatible VM ("anonymous-11.0.6"), compilerHints are disabled.
# Run progress: 0.00% complete, ETA 00:50:00
# Fork: 1 of 2
# Warmup Iteration   1: 89733.073 ops/s
# Warmup Iteration   2: 92545.361 ops/s
# Warmup Iteration   3: 92853.599 ops/s
# Warmup Iteration   4: 92320.452 ops/s
# Warmup Iteration   5: 92778.784 ops/s
# Warmup Iteration   6: 93384.110 ops/s
# Warmup Iteration   7: 93618.337 ops/s
# Warmup Iteration   8: 93532.739 ops/s
# Warmup Iteration   9: 93573.020 ops/s
# Warmup Iteration  10: 93560.354 ops/s
# Warmup Iteration  11: 93543.648 ops/s
# Warmup Iteration  12: 93661.058 ops/s
# Warmup Iteration  13: 93625.701 ops/s
# Warmup Iteration  14: 93107.187 ops/s
# Warmup Iteration  15: 92857.914 ops/s
# Warmup Iteration  16: 93594.257 ops/s
# Warmup Iteration  17: 93588.215 ops/s
# Warmup Iteration  18: 93635.203 ops/s
# Warmup Iteration  19: 93493.976 ops/s
# Warmup Iteration  20: 93538.679 ops/s
Iteration   1: 93644.943 ops/s
Iteration   2: 93710.257 ops/s
Iteration   3: 93560.219 ops/s
Iteration   4: 93579.405 ops/s
Iteration   5: 93536.587 ops/s
Iteration   6: 93601.443 ops/s
Iteration   7: 93543.477 ops/s
Iteration   8: 93689.276 ops/s
Iteration   9: 93608.674 ops/s
Iteration  10: 93605.285 ops/s

WARNING: Not a HotSpot compiler command compatible VM ("anonymous-11.0.6"), compilerHints are disabled.
# Run progress: 10.00% complete, ETA 00:45:06
# Fork: 2 of 2
# Warmup Iteration   1: 90339.923 ops/s
# Warmup Iteration   2: 93582.358 ops/s
# Warmup Iteration   3: 93156.676 ops/s
# Warmup Iteration   4: 93647.176 ops/s
# Warmup Iteration   5: 94273.198 ops/s
# Warmup Iteration   6: 94502.638 ops/s
# Warmup Iteration   7: 94463.401 ops/s
# Warmup Iteration   8: 94473.271 ops/s
# Warmup Iteration   9: 94412.021 ops/s
# Warmup Iteration  10: 94470.441 ops/s
# Warmup Iteration  11: 94383.598 ops/s
# Warmup Iteration  12: 94561.383 ops/s
# Warmup Iteration  13: 94508.794 ops/s
# Warmup Iteration  14: 94416.901 ops/s
# Warmup Iteration  15: 94361.045 ops/s
# Warmup Iteration  16: 94395.336 ops/s
# Warmup Iteration  17: 94428.837 ops/s
# Warmup Iteration  18: 94406.836 ops/s
# Warmup Iteration  19: 94488.010 ops/s
# Warmup Iteration  20: 94489.067 ops/s
Iteration   1: 94444.673 ops/s
Iteration   2: 94511.739 ops/s
Iteration   3: 94490.136 ops/s
Iteration   4: 94421.045 ops/s
Iteration   5: 92565.019 ops/s
Iteration   6: 94444.812 ops/s
Iteration   7: 94351.686 ops/s
Iteration   8: 94100.628 ops/s
Iteration   9: 94431.180 ops/s
Iteration  10: 94413.522 ops/s


Result "jvmscompare.benchmark.PersonCombinedSummaryStats.combinedStatistics_EC_Eager_Serial":
  93912.700 ±(99.9%) 447.248 ops/s [Average]
  (min, avg, max) = (92565.019, 93912.700, 94511.739), stdev = 515.051
  CI (99.9%): [93465.453, 94359.948] (assumes normal distribution)


# JMH version: 1.23
# VM version: JDK 11.0.6, anonymous, 11.0.6+10
# *** WARNING: This VM is not supported by JMH. The produced benchmark data can be completely wrong.
# VM invoker: /Library/Java/JavaVirtualMachines/adoptopenjdk-11.jdk/Contents/Home/bin/java
# VM options: -Xms1024m -Xmx1024m
# Warmup: 20 iterations, 10 s each
# Measurement: 10 iterations, 10 s each
# Timeout: 10 min per iteration
# Threads: 1 thread, will synchronize iterations
# Benchmark mode: Throughput, ops/time
# Benchmark: jvmscompare.benchmark.PersonCombinedSummaryStats.combinedStatistics_EC_Lazy_Serial

WARNING: Not a HotSpot compiler command compatible VM ("anonymous-11.0.6"), compilerHints are disabled.
# Run progress: 20.00% complete, ETA 00:40:05
# Fork: 1 of 2
# Warmup Iteration   1: 85697.727 ops/s
# Warmup Iteration   2: 93759.493 ops/s
# Warmup Iteration   3: 93780.875 ops/s
# Warmup Iteration   4: 93812.438 ops/s
# Warmup Iteration   5: 93673.206 ops/s
# Warmup Iteration   6: 93679.633 ops/s
# Warmup Iteration   7: 93925.941 ops/s
# Warmup Iteration   8: 93527.804 ops/s
# Warmup Iteration   9: 93961.113 ops/s
# Warmup Iteration  10: 93616.266 ops/s
# Warmup Iteration  11: 93986.323 ops/s
# Warmup Iteration  12: 94080.422 ops/s
# Warmup Iteration  13: 94003.819 ops/s
# Warmup Iteration  14: 93975.158 ops/s
# Warmup Iteration  15: 93473.463 ops/s
# Warmup Iteration  16: 93916.410 ops/s
# Warmup Iteration  17: 93595.970 ops/s
# Warmup Iteration  18: 94112.085 ops/s
# Warmup Iteration  19: 94038.129 ops/s
# Warmup Iteration  20: 93857.921 ops/s
Iteration   1: 93828.396 ops/s
Iteration   2: 91532.176 ops/s
Iteration   3: 93843.599 ops/s
Iteration   4: 93916.900 ops/s
Iteration   5: 93883.285 ops/s
Iteration   6: 93847.880 ops/s
Iteration   7: 93743.967 ops/s
Iteration   8: 93476.221 ops/s
Iteration   9: 93908.335 ops/s
Iteration  10: 93980.423 ops/s

WARNING: Not a HotSpot compiler command compatible VM ("anonymous-11.0.6"), compilerHints are disabled.
# Run progress: 30.00% complete, ETA 00:35:04
# Fork: 2 of 2
# Warmup Iteration   1: 86581.963 ops/s
# Warmup Iteration   2: 93910.391 ops/s
# Warmup Iteration   3: 93929.443 ops/s
# Warmup Iteration   4: 93982.610 ops/s
# Warmup Iteration   5: 93916.328 ops/s
# Warmup Iteration   6: 93861.616 ops/s
# Warmup Iteration   7: 93938.429 ops/s
# Warmup Iteration   8: 94241.571 ops/s
# Warmup Iteration   9: 93736.601 ops/s
# Warmup Iteration  10: 94336.503 ops/s
# Warmup Iteration  11: 94061.334 ops/s
# Warmup Iteration  12: 94264.638 ops/s
# Warmup Iteration  13: 94183.011 ops/s
# Warmup Iteration  14: 94293.060 ops/s
# Warmup Iteration  15: 94256.732 ops/s
# Warmup Iteration  16: 94297.076 ops/s
# Warmup Iteration  17: 94219.602 ops/s
# Warmup Iteration  18: 94284.672 ops/s
# Warmup Iteration  19: 94272.414 ops/s
# Warmup Iteration  20: 94023.749 ops/s
Iteration   1: 94154.758 ops/s
Iteration   2: 94310.288 ops/s
Iteration   3: 94233.813 ops/s
Iteration   4: 94273.469 ops/s
Iteration   5: 94276.407 ops/s
Iteration   6: 93939.467 ops/s
Iteration   7: 94292.772 ops/s
Iteration   8: 94383.241 ops/s
Iteration   9: 94108.438 ops/s
Iteration  10: 94199.276 ops/s


Result "jvmscompare.benchmark.PersonCombinedSummaryStats.combinedStatistics_EC_Lazy_Serial":
  93906.655 ±(99.9%) 526.166 ops/s [Average]
  (min, avg, max) = (91532.176, 93906.655, 94383.241), stdev = 605.934
  CI (99.9%): [93380.489, 94432.822] (assumes normal distribution)


# JMH version: 1.23
# VM version: JDK 11.0.6, anonymous, 11.0.6+10
# *** WARNING: This VM is not supported by JMH. The produced benchmark data can be completely wrong.
# VM invoker: /Library/Java/JavaVirtualMachines/adoptopenjdk-11.jdk/Contents/Home/bin/java
# VM options: -Xms1024m -Xmx1024m
# Warmup: 20 iterations, 10 s each
# Measurement: 10 iterations, 10 s each
# Timeout: 10 min per iteration
# Threads: 1 thread, will synchronize iterations
# Benchmark mode: Throughput, ops/time
# Benchmark: jvmscompare.benchmark.PersonCombinedSummaryStats.combinedStatistics_EC_Stream_Parallel

WARNING: Not a HotSpot compiler command compatible VM ("anonymous-11.0.6"), compilerHints are disabled.
# Run progress: 40.00% complete, ETA 00:30:04
# Fork: 1 of 2
# Warmup Iteration   1: 11082.431 ops/s
# Warmup Iteration   2: 11377.946 ops/s
# Warmup Iteration   3: 11374.974 ops/s
# Warmup Iteration   4: 11523.132 ops/s
# Warmup Iteration   5: 11745.968 ops/s
# Warmup Iteration   6: 11316.954 ops/s
# Warmup Iteration   7: 11599.302 ops/s
# Warmup Iteration   8: 11630.742 ops/s
# Warmup Iteration   9: 11404.806 ops/s
# Warmup Iteration  10: 11316.061 ops/s
# Warmup Iteration  11: 12466.344 ops/s
# Warmup Iteration  12: 11319.096 ops/s
# Warmup Iteration  13: 11328.766 ops/s
# Warmup Iteration  14: 11308.291 ops/s
# Warmup Iteration  15: 12262.606 ops/s
# Warmup Iteration  16: 11283.392 ops/s
# Warmup Iteration  17: 11950.100 ops/s
# Warmup Iteration  18: 11305.582 ops/s
# Warmup Iteration  19: 11445.997 ops/s
# Warmup Iteration  20: 11399.550 ops/s
Iteration   1: 11333.802 ops/s
Iteration   2: 11320.053 ops/s
Iteration   3: 12006.785 ops/s
Iteration   4: 11351.568 ops/s
Iteration   5: 11347.145 ops/s
Iteration   6: 11352.271 ops/s
Iteration   7: 12091.102 ops/s
Iteration   8: 12044.926 ops/s
Iteration   9: 11315.386 ops/s
Iteration  10: 11315.587 ops/s

WARNING: Not a HotSpot compiler command compatible VM ("anonymous-11.0.6"), compilerHints are disabled.
# Run progress: 50.00% complete, ETA 00:25:03
# Fork: 2 of 2
# Warmup Iteration   1: 11603.632 ops/s
# Warmup Iteration   2: 12046.277 ops/s
# Warmup Iteration   3: 11960.883 ops/s
# Warmup Iteration   4: 11702.985 ops/s
# Warmup Iteration   5: 13996.902 ops/s
# Warmup Iteration   6: 12007.346 ops/s
# Warmup Iteration   7: 12163.137 ops/s
# Warmup Iteration   8: 11718.167 ops/s
# Warmup Iteration   9: 11689.621 ops/s
# Warmup Iteration  10: 12250.203 ops/s
# Warmup Iteration  11: 11897.673 ops/s
# Warmup Iteration  12: 12307.700 ops/s
# Warmup Iteration  13: 11678.903 ops/s
# Warmup Iteration  14: 12194.902 ops/s
# Warmup Iteration  15: 12022.632 ops/s
# Warmup Iteration  16: 12069.899 ops/s
# Warmup Iteration  17: 11718.693 ops/s
# Warmup Iteration  18: 12208.484 ops/s
# Warmup Iteration  19: 12262.300 ops/s
# Warmup Iteration  20: 11687.416 ops/s
Iteration   1: 11838.263 ops/s
Iteration   2: 12145.074 ops/s
Iteration   3: 12314.219 ops/s
Iteration   4: 11709.714 ops/s
Iteration   5: 11701.401 ops/s
Iteration   6: 12789.155 ops/s
Iteration   7: 11820.090 ops/s
Iteration   8: 12105.891 ops/s
Iteration   9: 12011.270 ops/s
Iteration  10: 12884.714 ops/s


Result "jvmscompare.benchmark.PersonCombinedSummaryStats.combinedStatistics_EC_Stream_Parallel":
  11839.921 ±(99.9%) 416.731 ops/s [Average]
  (min, avg, max) = (11315.386, 11839.921, 12884.714), stdev = 479.908
  CI (99.9%): [11423.190, 12256.652] (assumes normal distribution)


# JMH version: 1.23
# VM version: JDK 11.0.6, anonymous, 11.0.6+10
# *** WARNING: This VM is not supported by JMH. The produced benchmark data can be completely wrong.
# VM invoker: /Library/Java/JavaVirtualMachines/adoptopenjdk-11.jdk/Contents/Home/bin/java
# VM options: -Xms1024m -Xmx1024m
# Warmup: 20 iterations, 10 s each
# Measurement: 10 iterations, 10 s each
# Timeout: 10 min per iteration
# Threads: 1 thread, will synchronize iterations
# Benchmark mode: Throughput, ops/time
# Benchmark: jvmscompare.benchmark.PersonCombinedSummaryStats.combinedStatistics_JDK_Stream_Parallel

WARNING: Not a HotSpot compiler command compatible VM ("anonymous-11.0.6"), compilerHints are disabled.
# Run progress: 60.00% complete, ETA 00:20:02
# Fork: 1 of 2
# Warmup Iteration   1: 12041.471 ops/s
# Warmup Iteration   2: 11809.880 ops/s
# Warmup Iteration   3: 11586.665 ops/s
# Warmup Iteration   4: 11226.738 ops/s
# Warmup Iteration   5: 11170.834 ops/s
# Warmup Iteration   6: 11225.876 ops/s
# Warmup Iteration   7: 11568.853 ops/s
# Warmup Iteration   8: 11246.995 ops/s
# Warmup Iteration   9: 11836.297 ops/s
# Warmup Iteration  10: 11211.033 ops/s
# Warmup Iteration  11: 12519.689 ops/s
# Warmup Iteration  12: 11972.486 ops/s
# Warmup Iteration  13: 11231.110 ops/s
# Warmup Iteration  14: 12516.267 ops/s
# Warmup Iteration  15: 11229.913 ops/s
# Warmup Iteration  16: 11427.552 ops/s
# Warmup Iteration  17: 11772.300 ops/s
# Warmup Iteration  18: 11207.015 ops/s
# Warmup Iteration  19: 11228.858 ops/s
# Warmup Iteration  20: 11303.153 ops/s
Iteration   1: 12096.408 ops/s
Iteration   2: 11221.494 ops/s
Iteration   3: 11300.255 ops/s
Iteration   4: 11252.940 ops/s
Iteration   5: 11160.723 ops/s
Iteration   6: 11232.918 ops/s
Iteration   7: 11226.549 ops/s
Iteration   8: 12373.132 ops/s
Iteration   9: 11220.652 ops/s
Iteration  10: 11271.000 ops/s

WARNING: Not a HotSpot compiler command compatible VM ("anonymous-11.0.6"), compilerHints are disabled.
# Run progress: 70.00% complete, ETA 00:15:01
# Fork: 2 of 2
# Warmup Iteration   1: 10933.998 ops/s
# Warmup Iteration   2: 11134.459 ops/s
# Warmup Iteration   3: 11142.942 ops/s
# Warmup Iteration   4: 11068.378 ops/s
# Warmup Iteration   5: 12064.056 ops/s
# Warmup Iteration   6: 11083.480 ops/s
# Warmup Iteration   7: 11090.471 ops/s
# Warmup Iteration   8: 12228.671 ops/s
# Warmup Iteration   9: 11080.595 ops/s
# Warmup Iteration  10: 11088.406 ops/s
# Warmup Iteration  11: 11093.287 ops/s
# Warmup Iteration  12: 12032.719 ops/s
# Warmup Iteration  13: 11097.629 ops/s
# Warmup Iteration  14: 11262.188 ops/s
# Warmup Iteration  15: 11086.801 ops/s
# Warmup Iteration  16: 11053.124 ops/s
# Warmup Iteration  17: 11131.416 ops/s
# Warmup Iteration  18: 11110.631 ops/s
# Warmup Iteration  19: 11476.674 ops/s
# Warmup Iteration  20: 12005.641 ops/s
Iteration   1: 11107.519 ops/s
Iteration   2: 11474.700 ops/s
Iteration   3: 11109.857 ops/s
Iteration   4: 11153.220 ops/s
Iteration   5: 12245.913 ops/s
Iteration   6: 11118.169 ops/s
Iteration   7: 11089.803 ops/s
Iteration   8: 11102.750 ops/s
Iteration   9: 12411.049 ops/s
Iteration  10: 11095.804 ops/s


Result "jvmscompare.benchmark.PersonCombinedSummaryStats.combinedStatistics_JDK_Stream_Parallel":
  11413.243 ±(99.9%) 397.756 ops/s [Average]
  (min, avg, max) = (11089.803, 11413.243, 12411.049), stdev = 458.057
  CI (99.9%): [11015.486, 11810.999] (assumes normal distribution)


# JMH version: 1.23
# VM version: JDK 11.0.6, anonymous, 11.0.6+10
# *** WARNING: This VM is not supported by JMH. The produced benchmark data can be completely wrong.
# VM invoker: /Library/Java/JavaVirtualMachines/adoptopenjdk-11.jdk/Contents/Home/bin/java
# VM options: -Xms1024m -Xmx1024m
# Warmup: 20 iterations, 10 s each
# Measurement: 10 iterations, 10 s each
# Timeout: 10 min per iteration
# Threads: 1 thread, will synchronize iterations
# Benchmark mode: Throughput, ops/time
# Benchmark: jvmscompare.benchmark.PersonCombinedSummaryStats.combinedStatistics_JDK_Stream_Serial
WARNING: Not a HotSpot compiler command compatible VM ("anonymous-11.0.6"), compilerHints are disabled.

# Run progress: 80.00% complete, ETA 00:10:01
# Fork: 1 of 2
# Warmup Iteration   1: 78226.331 ops/s
# Warmup Iteration   2: 84812.764 ops/s
# Warmup Iteration   3: 84997.988 ops/s
# Warmup Iteration   4: 85022.342 ops/s
# Warmup Iteration   5: 84964.262 ops/s
# Warmup Iteration   6: 84966.316 ops/s
# Warmup Iteration   7: 84737.309 ops/s
# Warmup Iteration   8: 84887.572 ops/s
# Warmup Iteration   9: 84955.356 ops/s
# Warmup Iteration  10: 84669.355 ops/s
# Warmup Iteration  11: 84844.711 ops/s
# Warmup Iteration  12: 84747.021 ops/s
# Warmup Iteration  13: 84594.136 ops/s
# Warmup Iteration  14: 84898.276 ops/s
# Warmup Iteration  15: 84694.908 ops/s
# Warmup Iteration  16: 84805.380 ops/s
# Warmup Iteration  17: 84929.583 ops/s
# Warmup Iteration  18: 84826.462 ops/s
# Warmup Iteration  19: 85026.779 ops/s
# Warmup Iteration  20: 84969.992 ops/s
Iteration   1: 84952.891 ops/s
Iteration   2: 85003.193 ops/s
Iteration   3: 85100.861 ops/s
Iteration   4: 84936.860 ops/s
Iteration   5: 85067.074 ops/s
Iteration   6: 84912.644 ops/s
Iteration   7: 85113.830 ops/s
Iteration   8: 85037.171 ops/s
Iteration   9: 84822.817 ops/s
Iteration  10: 84819.409 ops/s

WARNING: Not a HotSpot compiler command compatible VM ("anonymous-11.0.6"), compilerHints are disabled.
# Run progress: 90.00% complete, ETA 00:05:00
# Fork: 2 of 2
# Warmup Iteration   1: 78651.165 ops/s
# Warmup Iteration   2: 85417.374 ops/s
# Warmup Iteration   3: 85508.553 ops/s
# Warmup Iteration   4: 85346.876 ops/s
# Warmup Iteration   5: 84978.853 ops/s
# Warmup Iteration   6: 84998.685 ops/s
# Warmup Iteration   7: 85565.779 ops/s
# Warmup Iteration   8: 85491.947 ops/s
# Warmup Iteration   9: 85506.727 ops/s
# Warmup Iteration  10: 85514.798 ops/s
# Warmup Iteration  11: 85448.823 ops/s
# Warmup Iteration  12: 85531.422 ops/s
# Warmup Iteration  13: 85537.362 ops/s
# Warmup Iteration  14: 85548.093 ops/s
# Warmup Iteration  15: 85503.868 ops/s
# Warmup Iteration  16: 85511.432 ops/s
# Warmup Iteration  17: 85556.534 ops/s
# Warmup Iteration  18: 85404.085 ops/s
# Warmup Iteration  19: 85554.018 ops/s
# Warmup Iteration  20: 85522.063 ops/s
Iteration   1: 85634.425 ops/s
Iteration   2: 85529.284 ops/s
Iteration   3: 85585.941 ops/s
Iteration   4: 85547.324 ops/s
Iteration   5: 85534.866 ops/s
Iteration   6: 85473.154 ops/s
Iteration   7: 85568.913 ops/s
Iteration   8: 85492.019 ops/s
Iteration   9: 85540.035 ops/s
Iteration  10: 85511.228 ops/s


Result "jvmscompare.benchmark.PersonCombinedSummaryStats.combinedStatistics_JDK_Stream_Serial":
  85259.197 ±(99.9%) 261.072 ops/s [Average]
  (min, avg, max) = (84819.409, 85259.197, 85634.425), stdev = 300.650
  CI (99.9%): [84998.125, 85520.269] (assumes normal distribution)


# Run complete. Total time: 00:50:06

REMEMBER: The numbers below are just data. To gain reusable insights, you need to follow up on
why the numbers are the way they are. Use profilers (see -prof, -lprof), design factorial
experiments, perform baseline and negative tests that provide experimental control, make sure
the benchmarking environment is safe on JVM/OS/HW level, ask for reviews from the domain experts.
Do not assume the numbers tell you what you want them to tell.

Benchmark                                                           Mode  Cnt      Score     Error  Units
PersonCombinedSummaryStats.combinedStatistics_EC_Eager_Serial      thrpt   20  93912.700 ± 447.248  ops/s
PersonCombinedSummaryStats.combinedStatistics_EC_Lazy_Serial       thrpt   20  93906.655 ± 526.166  ops/s
PersonCombinedSummaryStats.combinedStatistics_EC_Stream_Parallel   thrpt   20  11839.921 ± 416.731  ops/s
PersonCombinedSummaryStats.combinedStatistics_JDK_Stream_Parallel  thrpt   20  11413.243 ± 397.756  ops/s
PersonCombinedSummaryStats.combinedStatistics_JDK_Stream_Serial    thrpt   20  85259.197 ± 261.072  ops/s

Benchmark result is saved to benchmark-results/person-combined-summary-stats/04_AdoptOpenJDKHotspotPersonCombinedSummaryStats.csv
[INFO] ------------------------------------------------------------------------
[INFO] BUILD SUCCESS
[INFO] ------------------------------------------------------------------------
[INFO] Total time:  50:18 min
[INFO] Finished at: 2020-02-09T22:24:05-05:00
[INFO] ------------------------------------------------------------------------
