[INFO] Scanning for projects...
[INFO] 
[INFO] ---------------------< jvms-compare:jvms-compare >----------------------
[INFO] Building JVMs Compare 1.0.0
[INFO] --------------------------------[ jar ]---------------------------------
[INFO] 
[INFO] --- maven-clean-plugin:2.5:clean (default-clean) @ jvms-compare ---
[INFO] Deleting /Users/cguntur/projects/conf/jvms-compare/target
[INFO] 
[INFO] --- maven-toolchains-plugin:1.1:toolchain (default) @ jvms-compare ---
[INFO] Required toolchain: jdk [ vendor='openjdk' version='11' ]
[INFO] Found matching toolchain for type jdk: JDK[/Library/Java/JavaVirtualMachines/openjdk-11.0.2.jdk/Contents/Home/]
[INFO] 
[INFO] --- maven-dependency-plugin:3.1.1:build-classpath (build-classpath) @ jvms-compare ---
[INFO] Dependencies classpath:
/Users/cguntur/.m2/repository/org/apache/commons/commons-math3/3.2/commons-math3-3.2.jar:/Users/cguntur/.m2/repository/org/junit/jupiter/junit-jupiter-api/5.5.0/junit-jupiter-api-5.5.0.jar:/Users/cguntur/.m2/repository/org/eclipse/collections/eclipse-collections/10.0.0/eclipse-collections-10.0.0.jar:/Users/cguntur/.m2/repository/javax/annotation/javax.annotation-api/1.3.1/javax.annotation-api-1.3.1.jar:/Users/cguntur/.m2/repository/org/junit/platform/junit-platform-engine/1.5.0/junit-platform-engine-1.5.0.jar:/Users/cguntur/.m2/repository/org/junit/platform/junit-platform-commons/1.5.0/junit-platform-commons-1.5.0.jar:/Users/cguntur/.m2/repository/org/junit/jupiter/junit-jupiter-params/5.5.0/junit-jupiter-params-5.5.0.jar:/Users/cguntur/.m2/repository/org/junit/jupiter/junit-jupiter-engine/5.5.0/junit-jupiter-engine-5.5.0.jar:/Users/cguntur/.m2/repository/org/junit/jupiter/junit-jupiter/5.5.0/junit-jupiter-5.5.0.jar:/Users/cguntur/.m2/repository/org/opentest4j/opentest4j/1.2.0/opentest4j-1.2.0.jar:/Users/cguntur/.m2/repository/org/openjdk/jmh/jmh-core/1.23/jmh-core-1.23.jar:/Users/cguntur/.m2/repository/org/apiguardian/apiguardian-api/1.1.0/apiguardian-api-1.1.0.jar:/Users/cguntur/.m2/repository/net/sf/jopt-simple/jopt-simple/4.6/jopt-simple-4.6.jar:/Users/cguntur/.m2/repository/org/eclipse/collections/eclipse-collections-api/10.0.0/eclipse-collections-api-10.0.0.jar
[INFO] 
[INFO] --- maven-resources-plugin:2.6:resources (default-resources) @ jvms-compare ---
[INFO] Using 'UTF-8' encoding to copy filtered resources.
[INFO] Copying 1 resource
[INFO] 
[INFO] --- maven-compiler-plugin:3.8.1:compile (default-compile) @ jvms-compare ---
[INFO] Toolchain in maven-compiler-plugin: JDK[/Library/Java/JavaVirtualMachines/openjdk-11.0.2.jdk/Contents/Home/]
[INFO] Changes detected - recompiling the module!
[INFO] Compiling 10 source files to /Users/cguntur/projects/conf/jvms-compare/target/classes
[INFO] 
[INFO] --- maven-resources-plugin:2.6:testResources (default-testResources) @ jvms-compare ---
[INFO] Using 'UTF-8' encoding to copy filtered resources.
[INFO] Copying 1 resource
[INFO] 
[INFO] --- maven-compiler-plugin:3.8.1:testCompile (default-testCompile) @ jvms-compare ---
[INFO] Toolchain in maven-compiler-plugin: JDK[/Library/Java/JavaVirtualMachines/openjdk-11.0.2.jdk/Contents/Home/]
[INFO] Changes detected - recompiling the module!
[INFO] Compiling 2 source files to /Users/cguntur/projects/conf/jvms-compare/target/test-classes
[INFO] 
[INFO] --- maven-surefire-plugin:2.12.4:test (default-test) @ jvms-compare ---
[INFO] Toolchain in surefire-plugin: JDK[/Library/Java/JavaVirtualMachines/openjdk-11.0.2.jdk/Contents/Home/]
[INFO] Surefire report directory: /Users/cguntur/projects/conf/jvms-compare/target/surefire-reports

-------------------------------------------------------
 T E S T S
-------------------------------------------------------
Running jvmscompare.PersonTest
Tests run: 3, Failures: 0, Errors: 0, Skipped: 0, Time elapsed: 1.423 sec
Running jvmscompare.IntListTest
Tests run: 3, Failures: 0, Errors: 0, Skipped: 0, Time elapsed: 1.256 sec

Results :

Tests run: 6, Failures: 0, Errors: 0, Skipped: 0

[INFO] 
[INFO] --- exec-maven-plugin:1.6.0:exec (combinedSummaryStats) @ jvms-compare ---
[INFO] Toolchain in exec-maven-plugin: JDK[/Library/Java/JavaVirtualMachines/openjdk-11.0.2.jdk/Contents/Home/]
##### Heap utilization statistics [MB] #####
Used Memory:4
Free Memory:1019
Total Memory:1024
Max Memory:1024
Java Runtime Environment version: 11.0.2
Java Runtime Environment vendor: Oracle Corporation

Java Runtime Name: OpenJDK Runtime Environment
Java Runtime Version: 11.0.2+9

Java Virtual Machine name: anonymous
Java Virtual Machine vendor: Oracle Corporation
Java Virtual Machine version: 11.0.2+9

Java Class Version: 55.0

Benchmark size: 1000
Benchmark forks: 2
Benchmark warmups: 20
Benchmark measurements: 10

WARNING: An illegal reflective access operation has occurred
WARNING: Illegal reflective access by org.openjdk.jmh.util.Utils (file:/Users/cguntur/.m2/repository/org/openjdk/jmh/jmh-core/1.23/jmh-core-1.23.jar) to field java.io.PrintStream.charOut
WARNING: Please consider reporting this to the maintainers of org.openjdk.jmh.util.Utils
WARNING: Use --illegal-access=warn to enable warnings of further illegal reflective access operations
WARNING: All illegal access operations will be denied in a future release
# JMH version: 1.23
# VM version: JDK 11.0.2, anonymous, 11.0.2+9
# *** WARNING: This VM is not supported by JMH. The produced benchmark data can be completely wrong.
# VM invoker: /Library/Java/JavaVirtualMachines/openjdk-11.0.2.jdk/Contents/Home/bin/java
# VM options: -Xms1024m -Xmx1024m
# Warmup: 20 iterations, 10 s each
# Measurement: 10 iterations, 10 s each
# Timeout: 10 min per iteration
# Threads: 1 thread, will synchronize iterations
# Benchmark mode: Throughput, ops/time
# Benchmark: jvmscompare.benchmark.PersonCombinedSummaryStats.combinedStatistics_EC_Eager_Serial

WARNING: Not a HotSpot compiler command compatible VM ("anonymous-11.0.2"), compilerHints are disabled.
# Run progress: 0.00% complete, ETA 00:50:00
# Fork: 1 of 2
# Warmup Iteration   1: 91534.413 ops/s
# Warmup Iteration   2: 94027.014 ops/s
# Warmup Iteration   3: 94102.230 ops/s
# Warmup Iteration   4: 93737.577 ops/s
# Warmup Iteration   5: 94593.855 ops/s
# Warmup Iteration   6: 95101.054 ops/s
# Warmup Iteration   7: 94752.786 ops/s
# Warmup Iteration   8: 95062.946 ops/s
# Warmup Iteration   9: 95117.576 ops/s
# Warmup Iteration  10: 95084.676 ops/s
# Warmup Iteration  11: 95030.108 ops/s
# Warmup Iteration  12: 95045.570 ops/s
# Warmup Iteration  13: 95142.618 ops/s
# Warmup Iteration  14: 94314.172 ops/s
# Warmup Iteration  15: 94877.003 ops/s
# Warmup Iteration  16: 92802.601 ops/s
# Warmup Iteration  17: 95068.604 ops/s
# Warmup Iteration  18: 95085.044 ops/s
# Warmup Iteration  19: 95198.461 ops/s
# Warmup Iteration  20: 95098.229 ops/s
Iteration   1: 95010.151 ops/s
Iteration   2: 95078.238 ops/s
Iteration   3: 94922.497 ops/s
Iteration   4: 95031.390 ops/s
Iteration   5: 95113.723 ops/s
Iteration   6: 95067.795 ops/s
Iteration   7: 94880.883 ops/s
Iteration   8: 94912.684 ops/s
Iteration   9: 95064.950 ops/s
Iteration  10: 95011.830 ops/s

WARNING: Not a HotSpot compiler command compatible VM ("anonymous-11.0.2"), compilerHints are disabled.
# Run progress: 10.00% complete, ETA 00:45:06
# Fork: 2 of 2
# Warmup Iteration   1: 91654.044 ops/s
# Warmup Iteration   2: 93707.834 ops/s
# Warmup Iteration   3: 94011.662 ops/s
# Warmup Iteration   4: 94011.179 ops/s
# Warmup Iteration   5: 94772.327 ops/s
# Warmup Iteration   6: 94928.816 ops/s
# Warmup Iteration   7: 94868.186 ops/s
# Warmup Iteration   8: 94793.146 ops/s
# Warmup Iteration   9: 94961.572 ops/s
# Warmup Iteration  10: 94828.426 ops/s
# Warmup Iteration  11: 94847.600 ops/s
# Warmup Iteration  12: 94956.807 ops/s
# Warmup Iteration  13: 94944.354 ops/s
# Warmup Iteration  14: 94875.760 ops/s
# Warmup Iteration  15: 94768.749 ops/s
# Warmup Iteration  16: 94446.640 ops/s
# Warmup Iteration  17: 94561.201 ops/s
# Warmup Iteration  18: 94816.226 ops/s
# Warmup Iteration  19: 94864.180 ops/s
# Warmup Iteration  20: 94873.234 ops/s
Iteration   1: 94919.197 ops/s
Iteration   2: 94917.335 ops/s
Iteration   3: 94908.742 ops/s
Iteration   4: 94904.961 ops/s
Iteration   5: 94930.691 ops/s
Iteration   6: 94885.114 ops/s
Iteration   7: 94910.760 ops/s
Iteration   8: 94888.793 ops/s
Iteration   9: 94917.196 ops/s
Iteration  10: 94965.963 ops/s


Result "jvmscompare.benchmark.PersonCombinedSummaryStats.combinedStatistics_EC_Eager_Serial":
  94962.145 ±(99.9%) 64.653 ops/s [Average]
  (min, avg, max) = (94880.883, 94962.145, 95113.723), stdev = 74.455
  CI (99.9%): [94897.491, 95026.798] (assumes normal distribution)


# JMH version: 1.23
# VM version: JDK 11.0.2, anonymous, 11.0.2+9
# *** WARNING: This VM is not supported by JMH. The produced benchmark data can be completely wrong.
# VM invoker: /Library/Java/JavaVirtualMachines/openjdk-11.0.2.jdk/Contents/Home/bin/java
# VM options: -Xms1024m -Xmx1024m
# Warmup: 20 iterations, 10 s each
# Measurement: 10 iterations, 10 s each
# Timeout: 10 min per iteration
# Threads: 1 thread, will synchronize iterations
# Benchmark mode: Throughput, ops/time
# Benchmark: jvmscompare.benchmark.PersonCombinedSummaryStats.combinedStatistics_EC_Lazy_Serial

WARNING: Not a HotSpot compiler command compatible VM ("anonymous-11.0.2"), compilerHints are disabled.
# Run progress: 20.00% complete, ETA 00:40:05
# Fork: 1 of 2
# Warmup Iteration   1: 38826.347 ops/s
# Warmup Iteration   2: 40331.242 ops/s
# Warmup Iteration   3: 38735.940 ops/s
# Warmup Iteration   4: 38718.934 ops/s
# Warmup Iteration   5: 38681.706 ops/s
# Warmup Iteration   6: 38631.315 ops/s
# Warmup Iteration   7: 38543.325 ops/s
# Warmup Iteration   8: 38530.996 ops/s
# Warmup Iteration   9: 38638.474 ops/s
# Warmup Iteration  10: 38606.383 ops/s
# Warmup Iteration  11: 38472.882 ops/s
# Warmup Iteration  12: 38642.812 ops/s
# Warmup Iteration  13: 38621.133 ops/s
# Warmup Iteration  14: 38521.431 ops/s
# Warmup Iteration  15: 38581.843 ops/s
# Warmup Iteration  16: 38331.826 ops/s
# Warmup Iteration  17: 40830.156 ops/s
# Warmup Iteration  18: 40968.747 ops/s
# Warmup Iteration  19: 40912.231 ops/s
# Warmup Iteration  20: 40984.042 ops/s
Iteration   1: 41037.797 ops/s
Iteration   2: 41069.067 ops/s
Iteration   3: 41014.845 ops/s
Iteration   4: 40905.308 ops/s
Iteration   5: 41075.503 ops/s
Iteration   6: 40825.289 ops/s
Iteration   7: 41068.299 ops/s
Iteration   8: 41049.777 ops/s
Iteration   9: 41040.040 ops/s
Iteration  10: 41013.974 ops/s

WARNING: Not a HotSpot compiler command compatible VM ("anonymous-11.0.2"), compilerHints are disabled.
# Run progress: 30.00% complete, ETA 00:35:04
# Fork: 2 of 2
# Warmup Iteration   1: 29048.363 ops/s
# Warmup Iteration   2: 30726.365 ops/s
# Warmup Iteration   3: 30310.684 ops/s
# Warmup Iteration   4: 30293.996 ops/s
# Warmup Iteration   5: 30310.353 ops/s
# Warmup Iteration   6: 30262.739 ops/s
# Warmup Iteration   7: 30319.961 ops/s
# Warmup Iteration   8: 30263.605 ops/s
# Warmup Iteration   9: 30335.814 ops/s
# Warmup Iteration  10: 30297.261 ops/s
# Warmup Iteration  11: 30267.228 ops/s
# Warmup Iteration  12: 30290.863 ops/s
# Warmup Iteration  13: 30318.433 ops/s
# Warmup Iteration  14: 30211.390 ops/s
# Warmup Iteration  15: 30285.521 ops/s
# Warmup Iteration  16: 30276.228 ops/s
# Warmup Iteration  17: 31241.734 ops/s
# Warmup Iteration  18: 31332.272 ops/s
# Warmup Iteration  19: 31327.562 ops/s
# Warmup Iteration  20: 31368.772 ops/s
Iteration   1: 31366.909 ops/s
Iteration   2: 31382.540 ops/s
Iteration   3: 31354.064 ops/s
Iteration   4: 31263.557 ops/s
Iteration   5: 31385.922 ops/s
Iteration   6: 31360.383 ops/s
Iteration   7: 30615.435 ops/s
Iteration   8: 31351.762 ops/s
Iteration   9: 31266.341 ops/s
Iteration  10: 31354.692 ops/s


Result "jvmscompare.benchmark.PersonCombinedSummaryStats.combinedStatistics_EC_Lazy_Serial":
  36140.075 ±(99.9%) 4341.204 ops/s [Average]
  (min, avg, max) = (30615.435, 36140.075, 41075.503), stdev = 4999.337
  CI (99.9%): [31798.871, 40481.279] (assumes normal distribution)


# JMH version: 1.23
# VM version: JDK 11.0.2, anonymous, 11.0.2+9
# *** WARNING: This VM is not supported by JMH. The produced benchmark data can be completely wrong.
# VM invoker: /Library/Java/JavaVirtualMachines/openjdk-11.0.2.jdk/Contents/Home/bin/java
# VM options: -Xms1024m -Xmx1024m
# Warmup: 20 iterations, 10 s each
# Measurement: 10 iterations, 10 s each
# Timeout: 10 min per iteration
# Threads: 1 thread, will synchronize iterations
# Benchmark mode: Throughput, ops/time
# Benchmark: jvmscompare.benchmark.PersonCombinedSummaryStats.combinedStatistics_EC_Stream_Parallel

WARNING: Not a HotSpot compiler command compatible VM ("anonymous-11.0.2"), compilerHints are disabled.
# Run progress: 40.00% complete, ETA 00:30:04
# Fork: 1 of 2
# Warmup Iteration   1: 10889.573 ops/s
# Warmup Iteration   2: 11778.712 ops/s
# Warmup Iteration   3: 11508.359 ops/s
# Warmup Iteration   4: 12291.135 ops/s
# Warmup Iteration   5: 12830.773 ops/s
# Warmup Iteration   6: 11515.706 ops/s
# Warmup Iteration   7: 13109.601 ops/s
# Warmup Iteration   8: 11517.494 ops/s
# Warmup Iteration   9: 13494.227 ops/s
# Warmup Iteration  10: 12247.730 ops/s
# Warmup Iteration  11: 12097.797 ops/s
# Warmup Iteration  12: 11521.363 ops/s
# Warmup Iteration  13: 11909.922 ops/s
# Warmup Iteration  14: 12069.666 ops/s
# Warmup Iteration  15: 12356.703 ops/s
# Warmup Iteration  16: 11474.270 ops/s
# Warmup Iteration  17: 12566.571 ops/s
# Warmup Iteration  18: 11522.355 ops/s
# Warmup Iteration  19: 11565.505 ops/s
# Warmup Iteration  20: 12311.136 ops/s
Iteration   1: 12532.450 ops/s
Iteration   2: 12830.992 ops/s
Iteration   3: 13417.746 ops/s
Iteration   4: 11903.111 ops/s
Iteration   5: 12692.894 ops/s
Iteration   6: 11642.401 ops/s
Iteration   7: 11909.058 ops/s
Iteration   8: 11594.925 ops/s
Iteration   9: 11651.833 ops/s
Iteration  10: 12911.062 ops/s

WARNING: Not a HotSpot compiler command compatible VM ("anonymous-11.0.2"), compilerHints are disabled.
# Run progress: 50.00% complete, ETA 00:25:03
# Fork: 2 of 2
# Warmup Iteration   1: 11364.604 ops/s
# Warmup Iteration   2: 12397.593 ops/s
# Warmup Iteration   3: 13386.915 ops/s
# Warmup Iteration   4: 11706.095 ops/s
# Warmup Iteration   5: 13012.679 ops/s
# Warmup Iteration   6: 12205.566 ops/s
# Warmup Iteration   7: 12987.805 ops/s
# Warmup Iteration   8: 12483.497 ops/s
# Warmup Iteration   9: 11655.941 ops/s
# Warmup Iteration  10: 12106.591 ops/s
# Warmup Iteration  11: 12376.813 ops/s
# Warmup Iteration  12: 13319.633 ops/s
# Warmup Iteration  13: 11723.466 ops/s
# Warmup Iteration  14: 11714.168 ops/s
# Warmup Iteration  15: 12247.949 ops/s
# Warmup Iteration  16: 11837.768 ops/s
# Warmup Iteration  17: 12002.654 ops/s
# Warmup Iteration  18: 12090.284 ops/s
# Warmup Iteration  19: 11879.327 ops/s
# Warmup Iteration  20: 11762.806 ops/s
Iteration   1: 12123.863 ops/s
Iteration   2: 12040.230 ops/s
Iteration   3: 11741.257 ops/s
Iteration   4: 11734.472 ops/s
Iteration   5: 11750.193 ops/s
Iteration   6: 12417.842 ops/s
Iteration   7: 11733.250 ops/s
Iteration   8: 11734.283 ops/s
Iteration   9: 11646.648 ops/s
Iteration  10: 12606.762 ops/s


Result "jvmscompare.benchmark.PersonCombinedSummaryStats.combinedStatistics_EC_Stream_Parallel":
  12130.764 ±(99.9%) 463.329 ops/s [Average]
  (min, avg, max) = (11594.925, 12130.764, 13417.746), stdev = 533.570
  CI (99.9%): [11667.435, 12594.092] (assumes normal distribution)


# JMH version: 1.23
# VM version: JDK 11.0.2, anonymous, 11.0.2+9
# *** WARNING: This VM is not supported by JMH. The produced benchmark data can be completely wrong.
# VM invoker: /Library/Java/JavaVirtualMachines/openjdk-11.0.2.jdk/Contents/Home/bin/java
# VM options: -Xms1024m -Xmx1024m
# Warmup: 20 iterations, 10 s each
# Measurement: 10 iterations, 10 s each
# Timeout: 10 min per iteration
# Threads: 1 thread, will synchronize iterations
# Benchmark mode: Throughput, ops/time
# Benchmark: jvmscompare.benchmark.PersonCombinedSummaryStats.combinedStatistics_JDK_Stream_Parallel

WARNING: Not a HotSpot compiler command compatible VM ("anonymous-11.0.2"), compilerHints are disabled.
# Run progress: 60.00% complete, ETA 00:20:02
# Fork: 1 of 2
# Warmup Iteration   1: 11736.776 ops/s
# Warmup Iteration   2: 13244.651 ops/s
# Warmup Iteration   3: 12609.833 ops/s
# Warmup Iteration   4: 12325.104 ops/s
# Warmup Iteration   5: 12096.947 ops/s
# Warmup Iteration   6: 12131.081 ops/s
# Warmup Iteration   7: 12126.955 ops/s
# Warmup Iteration   8: 12169.536 ops/s
# Warmup Iteration   9: 12135.681 ops/s
# Warmup Iteration  10: 12147.106 ops/s
# Warmup Iteration  11: 12130.456 ops/s
# Warmup Iteration  12: 12110.943 ops/s
# Warmup Iteration  13: 12054.077 ops/s
# Warmup Iteration  14: 12092.658 ops/s
# Warmup Iteration  15: 12118.807 ops/s
# Warmup Iteration  16: 12889.242 ops/s
# Warmup Iteration  17: 12383.287 ops/s
# Warmup Iteration  18: 12355.971 ops/s
# Warmup Iteration  19: 12082.884 ops/s
# Warmup Iteration  20: 12112.442 ops/s
Iteration   1: 12112.105 ops/s
Iteration   2: 12120.614 ops/s
Iteration   3: 12168.411 ops/s
Iteration   4: 12127.318 ops/s
Iteration   5: 13147.013 ops/s
Iteration   6: 12199.599 ops/s
Iteration   7: 12136.922 ops/s
Iteration   8: 12085.489 ops/s
Iteration   9: 12093.346 ops/s
Iteration  10: 12456.409 ops/s

WARNING: Not a HotSpot compiler command compatible VM ("anonymous-11.0.2"), compilerHints are disabled.
# Run progress: 70.00% complete, ETA 00:15:01
# Fork: 2 of 2
# Warmup Iteration   1: 10581.261 ops/s
# Warmup Iteration   2: 13146.655 ops/s
# Warmup Iteration   3: 11129.492 ops/s
# Warmup Iteration   4: 11540.208 ops/s
# Warmup Iteration   5: 11164.962 ops/s
# Warmup Iteration   6: 11687.317 ops/s
# Warmup Iteration   7: 11838.748 ops/s
# Warmup Iteration   8: 11671.587 ops/s
# Warmup Iteration   9: 11577.114 ops/s
# Warmup Iteration  10: 11169.731 ops/s
# Warmup Iteration  11: 11183.386 ops/s
# Warmup Iteration  12: 11160.147 ops/s
# Warmup Iteration  13: 11652.231 ops/s
# Warmup Iteration  14: 11151.961 ops/s
# Warmup Iteration  15: 11551.784 ops/s
# Warmup Iteration  16: 11165.900 ops/s
# Warmup Iteration  17: 12246.605 ops/s
# Warmup Iteration  18: 11153.473 ops/s
# Warmup Iteration  19: 11195.938 ops/s
# Warmup Iteration  20: 11160.173 ops/s
Iteration   1: 11159.723 ops/s
Iteration   2: 11166.033 ops/s
Iteration   3: 11422.559 ops/s
Iteration   4: 11485.614 ops/s
Iteration   5: 11163.920 ops/s
Iteration   6: 11138.862 ops/s
Iteration   7: 11389.209 ops/s
Iteration   8: 11163.674 ops/s
Iteration   9: 11652.534 ops/s
Iteration  10: 11935.593 ops/s


Result "jvmscompare.benchmark.PersonCombinedSummaryStats.combinedStatistics_JDK_Stream_Parallel":
  11816.247 ±(99.9%) 472.794 ops/s [Average]
  (min, avg, max) = (11138.862, 11816.247, 13147.013), stdev = 544.471
  CI (99.9%): [11343.453, 12289.042] (assumes normal distribution)


# JMH version: 1.23
# VM version: JDK 11.0.2, anonymous, 11.0.2+9
# *** WARNING: This VM is not supported by JMH. The produced benchmark data can be completely wrong.
# VM invoker: /Library/Java/JavaVirtualMachines/openjdk-11.0.2.jdk/Contents/Home/bin/java
# VM options: -Xms1024m -Xmx1024m
# Warmup: 20 iterations, 10 s each
# Measurement: 10 iterations, 10 s each
# Timeout: 10 min per iteration
# Threads: 1 thread, will synchronize iterations
# Benchmark mode: Throughput, ops/time
# Benchmark: jvmscompare.benchmark.PersonCombinedSummaryStats.combinedStatistics_JDK_Stream_Serial

WARNING: Not a HotSpot compiler command compatible VM ("anonymous-11.0.2"), compilerHints are disabled.
# Run progress: 80.00% complete, ETA 00:10:01
# Fork: 1 of 2
# Warmup Iteration   1: 82677.407 ops/s
# Warmup Iteration   2: 90373.648 ops/s
# Warmup Iteration   3: 90539.205 ops/s
# Warmup Iteration   4: 90526.150 ops/s
# Warmup Iteration   5: 90563.696 ops/s
# Warmup Iteration   6: 90655.511 ops/s
# Warmup Iteration   7: 90562.590 ops/s
# Warmup Iteration   8: 90505.990 ops/s
# Warmup Iteration   9: 90560.478 ops/s
# Warmup Iteration  10: 90525.054 ops/s
# Warmup Iteration  11: 90457.601 ops/s
# Warmup Iteration  12: 90486.306 ops/s
# Warmup Iteration  13: 90523.898 ops/s
# Warmup Iteration  14: 89903.989 ops/s
# Warmup Iteration  15: 89462.303 ops/s
# Warmup Iteration  16: 90330.762 ops/s
# Warmup Iteration  17: 87107.060 ops/s
# Warmup Iteration  18: 90635.423 ops/s
# Warmup Iteration  19: 89301.938 ops/s
# Warmup Iteration  20: 88504.062 ops/s
Iteration   1: 90640.136 ops/s
Iteration   2: 90561.396 ops/s
Iteration   3: 90594.308 ops/s
Iteration   4: 90582.663 ops/s
Iteration   5: 90582.493 ops/s
Iteration   6: 90659.339 ops/s
Iteration   7: 90546.113 ops/s
Iteration   8: 90665.731 ops/s
Iteration   9: 90590.159 ops/s
Iteration  10: 90701.188 ops/s

WARNING: Not a HotSpot compiler command compatible VM ("anonymous-11.0.2"), compilerHints are disabled.
# Run progress: 90.00% complete, ETA 00:05:00
# Fork: 2 of 2
# Warmup Iteration   1: 82098.697 ops/s
# Warmup Iteration   2: 88739.402 ops/s
# Warmup Iteration   3: 88697.985 ops/s
# Warmup Iteration   4: 88813.713 ops/s
# Warmup Iteration   5: 88774.217 ops/s
# Warmup Iteration   6: 88449.571 ops/s
# Warmup Iteration   7: 88797.141 ops/s
# Warmup Iteration   8: 88782.234 ops/s
# Warmup Iteration   9: 88853.994 ops/s
# Warmup Iteration  10: 88823.934 ops/s
# Warmup Iteration  11: 88702.779 ops/s
# Warmup Iteration  12: 88797.028 ops/s
# Warmup Iteration  13: 88785.330 ops/s
# Warmup Iteration  14: 88729.806 ops/s
# Warmup Iteration  15: 88708.125 ops/s
# Warmup Iteration  16: 88765.223 ops/s
# Warmup Iteration  17: 88742.201 ops/s
# Warmup Iteration  18: 88928.439 ops/s
# Warmup Iteration  19: 88800.752 ops/s
# Warmup Iteration  20: 88756.656 ops/s
Iteration   1: 88868.055 ops/s
Iteration   2: 88942.033 ops/s
Iteration   3: 88882.519 ops/s
Iteration   4: 88831.451 ops/s
Iteration   5: 88893.338 ops/s
Iteration   6: 88990.473 ops/s
Iteration   7: 88825.140 ops/s
Iteration   8: 88649.074 ops/s
Iteration   9: 88740.088 ops/s
Iteration  10: 88972.446 ops/s


Result "jvmscompare.benchmark.PersonCombinedSummaryStats.combinedStatistics_JDK_Stream_Serial":
  89735.907 ±(99.9%) 783.939 ops/s [Average]
  (min, avg, max) = (88649.074, 89735.907, 90701.188), stdev = 902.785
  CI (99.9%): [88951.968, 90519.846] (assumes normal distribution)


# Run complete. Total time: 00:50:06

REMEMBER: The numbers below are just data. To gain reusable insights, you need to follow up on
why the numbers are the way they are. Use profilers (see -prof, -lprof), design factorial
experiments, perform baseline and negative tests that provide experimental control, make sure
the benchmarking environment is safe on JVM/OS/HW level, ask for reviews from the domain experts.
Do not assume the numbers tell you what you want them to tell.

Benchmark                                                           Mode  Cnt      Score      Error  Units
PersonCombinedSummaryStats.combinedStatistics_EC_Eager_Serial      thrpt   20  94962.145 ±   64.653  ops/s
PersonCombinedSummaryStats.combinedStatistics_EC_Lazy_Serial       thrpt   20  36140.075 ± 4341.204  ops/s
PersonCombinedSummaryStats.combinedStatistics_EC_Stream_Parallel   thrpt   20  12130.764 ±  463.329  ops/s
PersonCombinedSummaryStats.combinedStatistics_JDK_Stream_Parallel  thrpt   20  11816.247 ±  472.794  ops/s
PersonCombinedSummaryStats.combinedStatistics_JDK_Stream_Serial    thrpt   20  89735.907 ±  783.939  ops/s

Benchmark result is saved to benchmark-results/person-combined-summary-stats/06_OpenJDKHotspotPersonCombinedSummaryStats.csv
[INFO] ------------------------------------------------------------------------
[INFO] BUILD SUCCESS
[INFO] ------------------------------------------------------------------------
[INFO] Total time:  50:18 min
[INFO] Finished at: 2020-02-10T12:30:37-05:00
[INFO] ------------------------------------------------------------------------
