[INFO] Scanning for projects...
[INFO] 
[INFO] ---------------------< jvms-compare:jvms-compare >----------------------
[INFO] Building JVMs Compare 1.0.0
[INFO] --------------------------------[ jar ]---------------------------------
[INFO] 
[INFO] --- maven-clean-plugin:2.5:clean (default-clean) @ jvms-compare ---
[INFO] Deleting /Users/cguntur/projects/conf/jvms-compare/target
[INFO] 
[INFO] --- maven-toolchains-plugin:1.1:toolchain (default) @ jvms-compare ---
[INFO] Required toolchain: jdk [ vendor='openjdk' version='11' ]
[INFO] Found matching toolchain for type jdk: JDK[/Library/Java/JavaVirtualMachines/openjdk-11.0.2.jdk/Contents/Home/]
[INFO] 
[INFO] --- maven-dependency-plugin:3.1.1:build-classpath (build-classpath) @ jvms-compare ---
[INFO] Dependencies classpath:
/Users/cguntur/.m2/repository/org/apache/commons/commons-math3/3.2/commons-math3-3.2.jar:/Users/cguntur/.m2/repository/org/junit/jupiter/junit-jupiter-api/5.5.0/junit-jupiter-api-5.5.0.jar:/Users/cguntur/.m2/repository/org/eclipse/collections/eclipse-collections/10.0.0/eclipse-collections-10.0.0.jar:/Users/cguntur/.m2/repository/javax/annotation/javax.annotation-api/1.3.1/javax.annotation-api-1.3.1.jar:/Users/cguntur/.m2/repository/org/junit/platform/junit-platform-engine/1.5.0/junit-platform-engine-1.5.0.jar:/Users/cguntur/.m2/repository/org/junit/platform/junit-platform-commons/1.5.0/junit-platform-commons-1.5.0.jar:/Users/cguntur/.m2/repository/org/junit/jupiter/junit-jupiter-params/5.5.0/junit-jupiter-params-5.5.0.jar:/Users/cguntur/.m2/repository/org/junit/jupiter/junit-jupiter-engine/5.5.0/junit-jupiter-engine-5.5.0.jar:/Users/cguntur/.m2/repository/org/junit/jupiter/junit-jupiter/5.5.0/junit-jupiter-5.5.0.jar:/Users/cguntur/.m2/repository/org/opentest4j/opentest4j/1.2.0/opentest4j-1.2.0.jar:/Users/cguntur/.m2/repository/org/openjdk/jmh/jmh-core/1.23/jmh-core-1.23.jar:/Users/cguntur/.m2/repository/org/apiguardian/apiguardian-api/1.1.0/apiguardian-api-1.1.0.jar:/Users/cguntur/.m2/repository/net/sf/jopt-simple/jopt-simple/4.6/jopt-simple-4.6.jar:/Users/cguntur/.m2/repository/org/eclipse/collections/eclipse-collections-api/10.0.0/eclipse-collections-api-10.0.0.jar
[INFO] 
[INFO] --- maven-resources-plugin:2.6:resources (default-resources) @ jvms-compare ---
[INFO] Using 'UTF-8' encoding to copy filtered resources.
[INFO] Copying 1 resource
[INFO] 
[INFO] --- maven-compiler-plugin:3.8.1:compile (default-compile) @ jvms-compare ---
[INFO] Toolchain in maven-compiler-plugin: JDK[/Library/Java/JavaVirtualMachines/openjdk-11.0.2.jdk/Contents/Home/]
[INFO] Changes detected - recompiling the module!
[INFO] Compiling 10 source files to /Users/cguntur/projects/conf/jvms-compare/target/classes
[INFO] 
[INFO] --- maven-resources-plugin:2.6:testResources (default-testResources) @ jvms-compare ---
[INFO] Using 'UTF-8' encoding to copy filtered resources.
[INFO] Copying 1 resource
[INFO] 
[INFO] --- maven-compiler-plugin:3.8.1:testCompile (default-testCompile) @ jvms-compare ---
[INFO] Toolchain in maven-compiler-plugin: JDK[/Library/Java/JavaVirtualMachines/openjdk-11.0.2.jdk/Contents/Home/]
[INFO] Changes detected - recompiling the module!
[INFO] Compiling 2 source files to /Users/cguntur/projects/conf/jvms-compare/target/test-classes
[INFO] 
[INFO] --- maven-surefire-plugin:2.12.4:test (default-test) @ jvms-compare ---
[INFO] Toolchain in surefire-plugin: JDK[/Library/Java/JavaVirtualMachines/openjdk-11.0.2.jdk/Contents/Home/]
[INFO] Surefire report directory: /Users/cguntur/projects/conf/jvms-compare/target/surefire-reports

-------------------------------------------------------
 T E S T S
-------------------------------------------------------
Running jvmscompare.PersonTest
Tests run: 3, Failures: 0, Errors: 0, Skipped: 0, Time elapsed: 1.389 sec
Running jvmscompare.IntListTest
Tests run: 3, Failures: 0, Errors: 0, Skipped: 0, Time elapsed: 1.21 sec

Results :

Tests run: 6, Failures: 0, Errors: 0, Skipped: 0

[INFO] 
[INFO] --- exec-maven-plugin:1.6.0:exec (combinedSummaryStats) @ jvms-compare ---
[INFO] Toolchain in exec-maven-plugin: JDK[/Library/Java/JavaVirtualMachines/openjdk-11.0.2.jdk/Contents/Home/]
##### Heap utilization statistics [MB] #####
Used Memory:6
Free Memory:1017
Total Memory:1024
Max Memory:1024
Java Runtime Environment version: 11.0.2
Java Runtime Environment vendor: Oracle Corporation

Java Runtime Name: OpenJDK Runtime Environment
Java Runtime Version: 11.0.2+9

Java Virtual Machine name: anonymous
Java Virtual Machine vendor: Oracle Corporation
Java Virtual Machine version: 11.0.2+9

Java Class Version: 55.0

Benchmark size: 1000
Benchmark forks: 2
Benchmark warmups: 20
Benchmark measurements: 10

WARNING: An illegal reflective access operation has occurred
WARNING: Illegal reflective access by org.openjdk.jmh.util.Utils (file:/Users/cguntur/.m2/repository/org/openjdk/jmh/jmh-core/1.23/jmh-core-1.23.jar) to field java.io.PrintStream.charOut
WARNING: Please consider reporting this to the maintainers of org.openjdk.jmh.util.Utils
WARNING: Use --illegal-access=warn to enable warnings of further illegal reflective access operations
WARNING: All illegal access operations will be denied in a future release
# JMH version: 1.23
# VM version: JDK 11.0.2, anonymous, 11.0.2+9
# *** WARNING: This VM is not supported by JMH. The produced benchmark data can be completely wrong.
# VM invoker: /Library/Java/JavaVirtualMachines/openjdk-11.0.2.jdk/Contents/Home/bin/java
# VM options: -XX:+UnlockExperimentalVMOptions -XX:+EnableJVMCI -XX:+UseJVMCICompiler -Xms1024m -Xmx1024m
# Warmup: 20 iterations, 10 s each
# Measurement: 10 iterations, 10 s each
# Timeout: 10 min per iteration
# Threads: 1 thread, will synchronize iterations
# Benchmark mode: Throughput, ops/time
# Benchmark: jvmscompare.benchmark.PersonCombinedSummaryStats.combinedStatistics_EC_Eager_Serial

WARNING: Not a HotSpot compiler command compatible VM ("anonymous-11.0.2"), compilerHints are disabled.
# Run progress: 0.00% complete, ETA 00:50:00
# Fork: 1 of 2
# Warmup Iteration   1: 76189.556 ops/s
# Warmup Iteration   2: 95234.177 ops/s
# Warmup Iteration   3: 95967.832 ops/s
# Warmup Iteration   4: 95718.391 ops/s
# Warmup Iteration   5: 96515.125 ops/s
# Warmup Iteration   6: 96631.696 ops/s
# Warmup Iteration   7: 96778.283 ops/s
# Warmup Iteration   8: 96758.651 ops/s
# Warmup Iteration   9: 96937.725 ops/s
# Warmup Iteration  10: 96899.843 ops/s
# Warmup Iteration  11: 96388.252 ops/s
# Warmup Iteration  12: 96029.080 ops/s
# Warmup Iteration  13: 96525.193 ops/s
# Warmup Iteration  14: 96346.780 ops/s
# Warmup Iteration  15: 96259.773 ops/s
# Warmup Iteration  16: 96888.823 ops/s
# Warmup Iteration  17: 96806.716 ops/s
# Warmup Iteration  18: 96561.897 ops/s
# Warmup Iteration  19: 96837.519 ops/s
# Warmup Iteration  20: 97023.660 ops/s
Iteration   1: 96878.222 ops/s
Iteration   2: 96879.271 ops/s
Iteration   3: 97132.160 ops/s
Iteration   4: 96418.111 ops/s
Iteration   5: 96744.595 ops/s
Iteration   6: 96232.486 ops/s
Iteration   7: 96631.094 ops/s
Iteration   8: 96341.437 ops/s
Iteration   9: 96949.156 ops/s
Iteration  10: 97070.658 ops/s

WARNING: Not a HotSpot compiler command compatible VM ("anonymous-11.0.2"), compilerHints are disabled.
# Run progress: 10.00% complete, ETA 00:45:10
# Fork: 2 of 2
# Warmup Iteration   1: 78460.656 ops/s
# Warmup Iteration   2: 91414.669 ops/s
# Warmup Iteration   3: 91887.933 ops/s
# Warmup Iteration   4: 92357.894 ops/s
# Warmup Iteration   5: 92554.399 ops/s
# Warmup Iteration   6: 92520.089 ops/s
# Warmup Iteration   7: 92326.073 ops/s
# Warmup Iteration   8: 92410.491 ops/s
# Warmup Iteration   9: 92472.603 ops/s
# Warmup Iteration  10: 92270.226 ops/s
# Warmup Iteration  11: 92609.160 ops/s
# Warmup Iteration  12: 92645.793 ops/s
# Warmup Iteration  13: 92582.086 ops/s
# Warmup Iteration  14: 92490.448 ops/s
# Warmup Iteration  15: 92659.715 ops/s
# Warmup Iteration  16: 92670.974 ops/s
# Warmup Iteration  17: 92658.867 ops/s
# Warmup Iteration  18: 92668.557 ops/s
# Warmup Iteration  19: 92610.247 ops/s
# Warmup Iteration  20: 92382.035 ops/s
Iteration   1: 92508.370 ops/s
Iteration   2: 92574.197 ops/s
Iteration   3: 91871.977 ops/s
Iteration   4: 91845.374 ops/s
Iteration   5: 92615.539 ops/s
Iteration   6: 92579.095 ops/s
Iteration   7: 92435.984 ops/s
Iteration   8: 92472.174 ops/s
Iteration   9: 92337.164 ops/s
Iteration  10: 92481.857 ops/s


Result "jvmscompare.benchmark.PersonCombinedSummaryStats.combinedStatistics_EC_Eager_Serial":
  94549.946 ±(99.9%) 1956.426 ops/s [Average]
  (min, avg, max) = (91845.374, 94549.946, 97132.160), stdev = 2253.023
  CI (99.9%): [92593.520, 96506.372] (assumes normal distribution)


# JMH version: 1.23
# VM version: JDK 11.0.2, anonymous, 11.0.2+9
# *** WARNING: This VM is not supported by JMH. The produced benchmark data can be completely wrong.
# VM invoker: /Library/Java/JavaVirtualMachines/openjdk-11.0.2.jdk/Contents/Home/bin/java
# VM options: -XX:+UnlockExperimentalVMOptions -XX:+EnableJVMCI -XX:+UseJVMCICompiler -Xms1024m -Xmx1024m
# Warmup: 20 iterations, 10 s each
# Measurement: 10 iterations, 10 s each
# Timeout: 10 min per iteration
# Threads: 1 thread, will synchronize iterations
# Benchmark mode: Throughput, ops/time
# Benchmark: jvmscompare.benchmark.PersonCombinedSummaryStats.combinedStatistics_EC_Lazy_Serial

WARNING: Not a HotSpot compiler command compatible VM ("anonymous-11.0.2"), compilerHints are disabled.
# Run progress: 20.00% complete, ETA 00:40:07
# Fork: 1 of 2
# Warmup Iteration   1: 44638.712 ops/s
# Warmup Iteration   2: 55363.659 ops/s
# Warmup Iteration   3: 55724.590 ops/s
# Warmup Iteration   4: 55835.412 ops/s
# Warmup Iteration   5: 56072.491 ops/s
# Warmup Iteration   6: 55884.776 ops/s
# Warmup Iteration   7: 55955.060 ops/s
# Warmup Iteration   8: 56003.555 ops/s
# Warmup Iteration   9: 56077.015 ops/s
# Warmup Iteration  10: 56006.818 ops/s
# Warmup Iteration  11: 56049.523 ops/s
# Warmup Iteration  12: 56017.997 ops/s
# Warmup Iteration  13: 56024.878 ops/s
# Warmup Iteration  14: 55945.482 ops/s
# Warmup Iteration  15: 56048.078 ops/s
# Warmup Iteration  16: 55995.911 ops/s
# Warmup Iteration  17: 56052.440 ops/s
# Warmup Iteration  18: 56060.177 ops/s
# Warmup Iteration  19: 56050.438 ops/s
# Warmup Iteration  20: 56032.186 ops/s
Iteration   1: 56074.464 ops/s
Iteration   2: 55827.023 ops/s
Iteration   3: 56048.767 ops/s
Iteration   4: 56022.124 ops/s
Iteration   5: 56051.636 ops/s
Iteration   6: 55966.506 ops/s
Iteration   7: 56055.447 ops/s
Iteration   8: 56013.078 ops/s
Iteration   9: 55998.741 ops/s
Iteration  10: 56064.369 ops/s

WARNING: Not a HotSpot compiler command compatible VM ("anonymous-11.0.2"), compilerHints are disabled.
# Run progress: 30.00% complete, ETA 00:35:06
# Fork: 2 of 2
# Warmup Iteration   1: 44131.065 ops/s
# Warmup Iteration   2: 55035.322 ops/s
# Warmup Iteration   3: 55353.739 ops/s
# Warmup Iteration   4: 55521.084 ops/s
# Warmup Iteration   5: 55752.864 ops/s
# Warmup Iteration   6: 55708.093 ops/s
# Warmup Iteration   7: 55656.897 ops/s
# Warmup Iteration   8: 55679.257 ops/s
# Warmup Iteration   9: 55706.894 ops/s
# Warmup Iteration  10: 55676.838 ops/s
# Warmup Iteration  11: 55708.505 ops/s
# Warmup Iteration  12: 55661.562 ops/s
# Warmup Iteration  13: 55670.662 ops/s
# Warmup Iteration  14: 55549.922 ops/s
# Warmup Iteration  15: 55687.200 ops/s
# Warmup Iteration  16: 55646.647 ops/s
# Warmup Iteration  17: 55736.311 ops/s
# Warmup Iteration  18: 55723.073 ops/s
# Warmup Iteration  19: 55713.190 ops/s
# Warmup Iteration  20: 55770.075 ops/s
Iteration   1: 55776.445 ops/s
Iteration   2: 55686.460 ops/s
Iteration   3: 55756.966 ops/s
Iteration   4: 55292.391 ops/s
Iteration   5: 55584.272 ops/s
Iteration   6: 55776.171 ops/s
Iteration   7: 55775.660 ops/s
Iteration   8: 55625.039 ops/s
Iteration   9: 55809.487 ops/s
Iteration  10: 55779.269 ops/s


Result "jvmscompare.benchmark.PersonCombinedSummaryStats.combinedStatistics_EC_Lazy_Serial":
  55849.216 ±(99.9%) 178.375 ops/s [Average]
  (min, avg, max) = (55292.391, 55849.216, 56074.464), stdev = 205.417
  CI (99.9%): [55670.841, 56027.591] (assumes normal distribution)


# JMH version: 1.23
# VM version: JDK 11.0.2, anonymous, 11.0.2+9
# *** WARNING: This VM is not supported by JMH. The produced benchmark data can be completely wrong.
# VM invoker: /Library/Java/JavaVirtualMachines/openjdk-11.0.2.jdk/Contents/Home/bin/java
# VM options: -XX:+UnlockExperimentalVMOptions -XX:+EnableJVMCI -XX:+UseJVMCICompiler -Xms1024m -Xmx1024m
# Warmup: 20 iterations, 10 s each
# Measurement: 10 iterations, 10 s each
# Timeout: 10 min per iteration
# Threads: 1 thread, will synchronize iterations
# Benchmark mode: Throughput, ops/time
# Benchmark: jvmscompare.benchmark.PersonCombinedSummaryStats.combinedStatistics_EC_Stream_Parallel

WARNING: Not a HotSpot compiler command compatible VM ("anonymous-11.0.2"), compilerHints are disabled.
# Run progress: 40.00% complete, ETA 00:30:05
# Fork: 1 of 2
# Warmup Iteration   1: 11011.962 ops/s
# Warmup Iteration   2: 10673.164 ops/s
# Warmup Iteration   3: 10994.198 ops/s
# Warmup Iteration   4: 11492.902 ops/s
# Warmup Iteration   5: 10755.435 ops/s
# Warmup Iteration   6: 10829.375 ops/s
# Warmup Iteration   7: 11064.897 ops/s
# Warmup Iteration   8: 10740.776 ops/s
# Warmup Iteration   9: 10752.593 ops/s
# Warmup Iteration  10: 11740.346 ops/s
# Warmup Iteration  11: 10752.643 ops/s
# Warmup Iteration  12: 10742.402 ops/s
# Warmup Iteration  13: 10978.851 ops/s
# Warmup Iteration  14: 11576.841 ops/s
# Warmup Iteration  15: 10741.912 ops/s
# Warmup Iteration  16: 11217.488 ops/s
# Warmup Iteration  17: 11814.216 ops/s
# Warmup Iteration  18: 11091.536 ops/s
# Warmup Iteration  19: 10827.747 ops/s
# Warmup Iteration  20: 10787.606 ops/s
Iteration   1: 11141.268 ops/s
Iteration   2: 10794.701 ops/s
Iteration   3: 11014.984 ops/s
Iteration   4: 11984.997 ops/s
Iteration   5: 11675.747 ops/s
Iteration   6: 11384.779 ops/s
Iteration   7: 11221.346 ops/s
Iteration   8: 10804.122 ops/s
Iteration   9: 12124.995 ops/s
Iteration  10: 10760.788 ops/s

WARNING: Not a HotSpot compiler command compatible VM ("anonymous-11.0.2"), compilerHints are disabled.
# Run progress: 50.00% complete, ETA 00:25:03
# Fork: 2 of 2
# Warmup Iteration   1: 12997.207 ops/s
# Warmup Iteration   2: 11128.162 ops/s
# Warmup Iteration   3: 11361.151 ops/s
# Warmup Iteration   4: 11408.426 ops/s
# Warmup Iteration   5: 11733.202 ops/s
# Warmup Iteration   6: 11166.810 ops/s
# Warmup Iteration   7: 11677.374 ops/s
# Warmup Iteration   8: 11370.213 ops/s
# Warmup Iteration   9: 11206.551 ops/s
# Warmup Iteration  10: 11178.517 ops/s
# Warmup Iteration  11: 11181.205 ops/s
# Warmup Iteration  12: 11170.578 ops/s
# Warmup Iteration  13: 11193.925 ops/s
# Warmup Iteration  14: 11204.493 ops/s
# Warmup Iteration  15: 11181.994 ops/s
# Warmup Iteration  16: 11430.574 ops/s
# Warmup Iteration  17: 11221.037 ops/s
# Warmup Iteration  18: 11196.414 ops/s
# Warmup Iteration  19: 11207.199 ops/s
# Warmup Iteration  20: 11402.860 ops/s
Iteration   1: 11230.751 ops/s
Iteration   2: 11138.860 ops/s
Iteration   3: 11193.660 ops/s
Iteration   4: 11227.892 ops/s
Iteration   5: 11697.197 ops/s
Iteration   6: 11895.387 ops/s
Iteration   7: 11832.438 ops/s
Iteration   8: 11329.697 ops/s
Iteration   9: 11191.581 ops/s
Iteration  10: 11182.511 ops/s


Result "jvmscompare.benchmark.PersonCombinedSummaryStats.combinedStatistics_EC_Stream_Parallel":
  11341.385 ±(99.9%) 347.228 ops/s [Average]
  (min, avg, max) = (10760.788, 11341.385, 12124.995), stdev = 399.868
  CI (99.9%): [10994.157, 11688.613] (assumes normal distribution)


# JMH version: 1.23
# VM version: JDK 11.0.2, anonymous, 11.0.2+9
# *** WARNING: This VM is not supported by JMH. The produced benchmark data can be completely wrong.
# VM invoker: /Library/Java/JavaVirtualMachines/openjdk-11.0.2.jdk/Contents/Home/bin/java
# VM options: -XX:+UnlockExperimentalVMOptions -XX:+EnableJVMCI -XX:+UseJVMCICompiler -Xms1024m -Xmx1024m
# Warmup: 20 iterations, 10 s each
# Measurement: 10 iterations, 10 s each
# Timeout: 10 min per iteration
# Threads: 1 thread, will synchronize iterations
# Benchmark mode: Throughput, ops/time
# Benchmark: jvmscompare.benchmark.PersonCombinedSummaryStats.combinedStatistics_JDK_Stream_Parallel

WARNING: Not a HotSpot compiler command compatible VM ("anonymous-11.0.2"), compilerHints are disabled.
# Run progress: 60.00% complete, ETA 00:20:03
# Fork: 1 of 2
# Warmup Iteration   1: 12198.556 ops/s
# Warmup Iteration   2: 10813.675 ops/s
# Warmup Iteration   3: 10533.525 ops/s
# Warmup Iteration   4: 10520.362 ops/s
# Warmup Iteration   5: 10952.149 ops/s
# Warmup Iteration   6: 10458.890 ops/s
# Warmup Iteration   7: 10429.075 ops/s
# Warmup Iteration   8: 10431.068 ops/s
# Warmup Iteration   9: 11569.236 ops/s
# Warmup Iteration  10: 10643.508 ops/s
# Warmup Iteration  11: 10743.873 ops/s
# Warmup Iteration  12: 10440.665 ops/s
# Warmup Iteration  13: 10433.448 ops/s
# Warmup Iteration  14: 10906.402 ops/s
# Warmup Iteration  15: 10690.569 ops/s
# Warmup Iteration  16: 10431.370 ops/s
# Warmup Iteration  17: 10440.367 ops/s
# Warmup Iteration  18: 10458.596 ops/s
# Warmup Iteration  19: 10433.622 ops/s
# Warmup Iteration  20: 11307.747 ops/s
Iteration   1: 10456.633 ops/s
Iteration   2: 11193.896 ops/s
Iteration   3: 10440.882 ops/s
Iteration   4: 10890.914 ops/s
Iteration   5: 10433.409 ops/s
Iteration   6: 11345.674 ops/s
Iteration   7: 10650.052 ops/s
Iteration   8: 11818.231 ops/s
Iteration   9: 10940.929 ops/s
Iteration  10: 10442.227 ops/s

WARNING: Not a HotSpot compiler command compatible VM ("anonymous-11.0.2"), compilerHints are disabled.
# Run progress: 70.00% complete, ETA 00:15:02
# Fork: 2 of 2
# Warmup Iteration   1: 9747.681 ops/s
# Warmup Iteration   2: 10471.099 ops/s
# Warmup Iteration   3: 10505.218 ops/s
# Warmup Iteration   4: 11021.887 ops/s
# Warmup Iteration   5: 10461.469 ops/s
# Warmup Iteration   6: 10775.334 ops/s
# Warmup Iteration   7: 10486.975 ops/s
# Warmup Iteration   8: 10476.188 ops/s
# Warmup Iteration   9: 10721.677 ops/s
# Warmup Iteration  10: 11924.484 ops/s
# Warmup Iteration  11: 11052.038 ops/s
# Warmup Iteration  12: 11439.448 ops/s
# Warmup Iteration  13: 10473.338 ops/s
# Warmup Iteration  14: 10910.852 ops/s
# Warmup Iteration  15: 10504.120 ops/s
# Warmup Iteration  16: 10467.566 ops/s
# Warmup Iteration  17: 11067.714 ops/s
# Warmup Iteration  18: 10505.170 ops/s
# Warmup Iteration  19: 11611.053 ops/s
# Warmup Iteration  20: 11765.541 ops/s
Iteration   1: 11170.270 ops/s
Iteration   2: 10451.827 ops/s
Iteration   3: 10451.314 ops/s
Iteration   4: 10500.956 ops/s
Iteration   5: 10962.916 ops/s
Iteration   6: 10788.963 ops/s
Iteration   7: 11041.035 ops/s
Iteration   8: 10462.218 ops/s
Iteration   9: 10706.466 ops/s
Iteration  10: 10487.316 ops/s


Result "jvmscompare.benchmark.PersonCombinedSummaryStats.combinedStatistics_JDK_Stream_Parallel":
  10781.806 ±(99.9%) 334.400 ops/s [Average]
  (min, avg, max) = (10433.409, 10781.806, 11818.231), stdev = 385.095
  CI (99.9%): [10447.407, 11116.206] (assumes normal distribution)


# JMH version: 1.23
# VM version: JDK 11.0.2, anonymous, 11.0.2+9
# *** WARNING: This VM is not supported by JMH. The produced benchmark data can be completely wrong.
# VM invoker: /Library/Java/JavaVirtualMachines/openjdk-11.0.2.jdk/Contents/Home/bin/java
# VM options: -XX:+UnlockExperimentalVMOptions -XX:+EnableJVMCI -XX:+UseJVMCICompiler -Xms1024m -Xmx1024m
# Warmup: 20 iterations, 10 s each
# Measurement: 10 iterations, 10 s each
# Timeout: 10 min per iteration
# Threads: 1 thread, will synchronize iterations
# Benchmark mode: Throughput, ops/time
# Benchmark: jvmscompare.benchmark.PersonCombinedSummaryStats.combinedStatistics_JDK_Stream_Serial

WARNING: Not a HotSpot compiler command compatible VM ("anonymous-11.0.2"), compilerHints are disabled.
# Run progress: 80.00% complete, ETA 00:10:01
# Fork: 1 of 2
# Warmup Iteration   1: 47409.348 ops/s
# Warmup Iteration   2: 55873.001 ops/s
# Warmup Iteration   3: 55599.540 ops/s
# Warmup Iteration   4: 56522.425 ops/s
# Warmup Iteration   5: 56595.994 ops/s
# Warmup Iteration   6: 56556.180 ops/s
# Warmup Iteration   7: 56587.365 ops/s
# Warmup Iteration   8: 56551.362 ops/s
# Warmup Iteration   9: 56548.865 ops/s
# Warmup Iteration  10: 56485.676 ops/s
# Warmup Iteration  11: 56506.339 ops/s
# Warmup Iteration  12: 56496.339 ops/s
# Warmup Iteration  13: 56486.938 ops/s
# Warmup Iteration  14: 56607.929 ops/s
# Warmup Iteration  15: 56592.966 ops/s
# Warmup Iteration  16: 56560.211 ops/s
# Warmup Iteration  17: 56585.134 ops/s
# Warmup Iteration  18: 56607.091 ops/s
# Warmup Iteration  19: 56593.585 ops/s
# Warmup Iteration  20: 56549.282 ops/s
Iteration   1: 56601.565 ops/s
Iteration   2: 56478.003 ops/s
Iteration   3: 56583.203 ops/s
Iteration   4: 56575.132 ops/s
Iteration   5: 56595.069 ops/s
Iteration   6: 56492.276 ops/s
Iteration   7: 56548.317 ops/s
Iteration   8: 56544.045 ops/s
Iteration   9: 56586.489 ops/s
Iteration  10: 56513.188 ops/s

WARNING: Not a HotSpot compiler command compatible VM ("anonymous-11.0.2"), compilerHints are disabled.
# Run progress: 90.00% complete, ETA 00:05:00
# Fork: 2 of 2
# Warmup Iteration   1: 46714.589 ops/s
# Warmup Iteration   2: 55916.038 ops/s
# Warmup Iteration   3: 55286.008 ops/s
# Warmup Iteration   4: 56293.671 ops/s
# Warmup Iteration   5: 56301.714 ops/s
# Warmup Iteration   6: 56267.517 ops/s
# Warmup Iteration   7: 56311.106 ops/s
# Warmup Iteration   8: 56224.724 ops/s
# Warmup Iteration   9: 56224.477 ops/s
# Warmup Iteration  10: 56252.977 ops/s
# Warmup Iteration  11: 56242.741 ops/s
# Warmup Iteration  12: 56235.631 ops/s
# Warmup Iteration  13: 56257.316 ops/s
# Warmup Iteration  14: 56309.537 ops/s
# Warmup Iteration  15: 56122.660 ops/s
# Warmup Iteration  16: 56238.632 ops/s
# Warmup Iteration  17: 56401.697 ops/s
# Warmup Iteration  18: 56407.041 ops/s
# Warmup Iteration  19: 56299.792 ops/s
# Warmup Iteration  20: 56393.854 ops/s
Iteration   1: 56419.910 ops/s
Iteration   2: 56340.922 ops/s
Iteration   3: 56390.516 ops/s
Iteration   4: 56325.295 ops/s
Iteration   5: 56430.084 ops/s
Iteration   6: 55923.813 ops/s
Iteration   7: 56044.650 ops/s
Iteration   8: 56387.719 ops/s
Iteration   9: 56325.571 ops/s
Iteration  10: 56347.077 ops/s


Result "jvmscompare.benchmark.PersonCombinedSummaryStats.combinedStatistics_JDK_Stream_Serial":
  56422.642 ±(99.9%) 155.538 ops/s [Average]
  (min, avg, max) = (55923.813, 56422.642, 56601.565), stdev = 179.118
  CI (99.9%): [56267.104, 56578.180] (assumes normal distribution)


# Run complete. Total time: 00:50:07

REMEMBER: The numbers below are just data. To gain reusable insights, you need to follow up on
why the numbers are the way they are. Use profilers (see -prof, -lprof), design factorial
experiments, perform baseline and negative tests that provide experimental control, make sure
the benchmarking environment is safe on JVM/OS/HW level, ask for reviews from the domain experts.
Do not assume the numbers tell you what you want them to tell.

Benchmark                                                           Mode  Cnt      Score      Error  Units
PersonCombinedSummaryStats.combinedStatistics_EC_Eager_Serial      thrpt   20  94549.946 ± 1956.426  ops/s
PersonCombinedSummaryStats.combinedStatistics_EC_Lazy_Serial       thrpt   20  55849.216 ±  178.375  ops/s
PersonCombinedSummaryStats.combinedStatistics_EC_Stream_Parallel   thrpt   20  11341.385 ±  347.228  ops/s
PersonCombinedSummaryStats.combinedStatistics_JDK_Stream_Parallel  thrpt   20  10781.806 ±  334.400  ops/s
PersonCombinedSummaryStats.combinedStatistics_JDK_Stream_Serial    thrpt   20  56422.642 ±  155.538  ops/s

Benchmark result is saved to benchmark-results/person-combined-summary-stats/07_OpenJDKGraalPersonCombinedSummaryStats.csv
[INFO] ------------------------------------------------------------------------
[INFO] BUILD SUCCESS
[INFO] ------------------------------------------------------------------------
[INFO] Total time:  50:20 min
[INFO] Finished at: 2020-02-10T19:33:52-05:00
[INFO] ------------------------------------------------------------------------
