[INFO] Scanning for projects...
[INFO] 
[INFO] ---------------------< jvms-compare:jvms-compare >----------------------
[INFO] Building JVMs Compare 1.0.0
[INFO] --------------------------------[ jar ]---------------------------------
[INFO] 
[INFO] --- maven-clean-plugin:2.5:clean (default-clean) @ jvms-compare ---
[INFO] Deleting /Users/dr/projects/jvms-compare/target
[INFO] 
[INFO] --- maven-toolchains-plugin:1.1:toolchain (default) @ jvms-compare ---
[INFO] Required toolchain: jdk [ vendor='openjdk' version='11' ]
[INFO] Found matching toolchain for type jdk: JDK[/Library/Java/JavaVirtualMachines/openjdk-11.0.2.jdk/Contents/Home/]
[INFO] 
[INFO] --- maven-dependency-plugin:3.1.1:build-classpath (build-classpath) @ jvms-compare ---
[INFO] Dependencies classpath:
/Users/dr/.m2/repository/org/apache/commons/commons-math3/3.2/commons-math3-3.2.jar:/Users/dr/.m2/repository/org/junit/jupiter/junit-jupiter-api/5.5.0/junit-jupiter-api-5.5.0.jar:/Users/dr/.m2/repository/org/eclipse/collections/eclipse-collections/10.0.0/eclipse-collections-10.0.0.jar:/Users/dr/.m2/repository/javax/annotation/javax.annotation-api/1.3.1/javax.annotation-api-1.3.1.jar:/Users/dr/.m2/repository/org/junit/platform/junit-platform-engine/1.5.0/junit-platform-engine-1.5.0.jar:/Users/dr/.m2/repository/org/junit/platform/junit-platform-commons/1.5.0/junit-platform-commons-1.5.0.jar:/Users/dr/.m2/repository/org/junit/jupiter/junit-jupiter-params/5.5.0/junit-jupiter-params-5.5.0.jar:/Users/dr/.m2/repository/org/junit/jupiter/junit-jupiter-engine/5.5.0/junit-jupiter-engine-5.5.0.jar:/Users/dr/.m2/repository/org/junit/jupiter/junit-jupiter/5.5.0/junit-jupiter-5.5.0.jar:/Users/dr/.m2/repository/org/opentest4j/opentest4j/1.2.0/opentest4j-1.2.0.jar:/Users/dr/.m2/repository/org/openjdk/jmh/jmh-core/1.23/jmh-core-1.23.jar:/Users/dr/.m2/repository/org/apiguardian/apiguardian-api/1.1.0/apiguardian-api-1.1.0.jar:/Users/dr/.m2/repository/net/sf/jopt-simple/jopt-simple/4.6/jopt-simple-4.6.jar:/Users/dr/.m2/repository/org/eclipse/collections/eclipse-collections-api/10.0.0/eclipse-collections-api-10.0.0.jar
[INFO] 
[INFO] --- maven-resources-plugin:2.6:resources (default-resources) @ jvms-compare ---
[INFO] Using 'UTF-8' encoding to copy filtered resources.
[INFO] Copying 1 resource
[INFO] 
[INFO] --- maven-compiler-plugin:3.8.1:compile (default-compile) @ jvms-compare ---
[INFO] Toolchain in maven-compiler-plugin: JDK[/Library/Java/JavaVirtualMachines/openjdk-11.0.2.jdk/Contents/Home/]
[INFO] Changes detected - recompiling the module!
[INFO] Compiling 10 source files to /Users/dr/projects/jvms-compare/target/classes
[INFO] 
[INFO] --- maven-resources-plugin:2.6:testResources (default-testResources) @ jvms-compare ---
[INFO] Using 'UTF-8' encoding to copy filtered resources.
[INFO] Copying 1 resource
[INFO] 
[INFO] --- maven-compiler-plugin:3.8.1:testCompile (default-testCompile) @ jvms-compare ---
[INFO] Toolchain in maven-compiler-plugin: JDK[/Library/Java/JavaVirtualMachines/openjdk-11.0.2.jdk/Contents/Home/]
[INFO] Changes detected - recompiling the module!
[INFO] Compiling 2 source files to /Users/dr/projects/jvms-compare/target/test-classes
[INFO] 
[INFO] --- maven-surefire-plugin:2.12.4:test (default-test) @ jvms-compare ---
[INFO] Toolchain in surefire-plugin: JDK[/Library/Java/JavaVirtualMachines/openjdk-11.0.2.jdk/Contents/Home/]
[INFO] Surefire report directory: /Users/dr/projects/jvms-compare/target/surefire-reports

-------------------------------------------------------
 T E S T S
-------------------------------------------------------
Running jvmscompare.PersonTest
Tests run: 3, Failures: 0, Errors: 0, Skipped: 0, Time elapsed: 1.211 sec
Running jvmscompare.IntListTest
Tests run: 3, Failures: 0, Errors: 0, Skipped: 0, Time elapsed: 1.051 sec

Results :

Tests run: 6, Failures: 0, Errors: 0, Skipped: 0

[INFO] 
[INFO] --- exec-maven-plugin:1.6.0:exec (combinedSummaryStats) @ jvms-compare ---
[INFO] Toolchain in exec-maven-plugin: JDK[/Library/Java/JavaVirtualMachines/openjdk-11.0.2.jdk/Contents/Home/]
##### Heap utilization statistics [MB] #####
Used Memory:5
Free Memory:1018
Total Memory:1024
Max Memory:1024
Java Runtime Environment version: 11.0.2
Java Runtime Environment vendor: Oracle Corporation

Java Runtime Name: OpenJDK Runtime Environment
Java Runtime Version: 11.0.2+9

Java Virtual Machine name: anonymous
Java Virtual Machine vendor: Oracle Corporation
Java Virtual Machine version: 11.0.2+9

Java Class Version: 55.0

Benchmark size: 1000000
Benchmark forks: 2
Benchmark warmups: 20
Benchmark measurements: 10

WARNING: An illegal reflective access operation has occurred
WARNING: Illegal reflective access by org.openjdk.jmh.util.Utils (file:/Users/dr/.m2/repository/org/openjdk/jmh/jmh-core/1.23/jmh-core-1.23.jar) to field java.io.PrintStream.charOut
WARNING: Please consider reporting this to the maintainers of org.openjdk.jmh.util.Utils
WARNING: Use --illegal-access=warn to enable warnings of further illegal reflective access operations
WARNING: All illegal access operations will be denied in a future release
# JMH version: 1.23
# VM version: JDK 11.0.2, anonymous, 11.0.2+9
# *** WARNING: This VM is not supported by JMH. The produced benchmark data can be completely wrong.
# VM invoker: /Library/Java/JavaVirtualMachines/openjdk-11.0.2.jdk/Contents/Home/bin/java
# VM options: -Xms1024m -Xmx1024m
# Warmup: 20 iterations, 10 s each
# Measurement: 10 iterations, 10 s each
# Timeout: 10 min per iteration
# Threads: 1 thread, will synchronize iterations
# Benchmark mode: Throughput, ops/time
# Benchmark: jvmscompare.benchmark.PersonCombinedSummaryStats.combinedStatistics_EC_Eager_Serial

WARNING: Not a HotSpot compiler command compatible VM ("anonymous-11.0.2"), compilerHints are disabled.
# Run progress: 0.00% complete, ETA 00:50:00
# Fork: 1 of 2
# Warmup Iteration   1: 10.914 ops/s
# Warmup Iteration   2: 11.803 ops/s
# Warmup Iteration   3: 11.857 ops/s
# Warmup Iteration   4: 11.774 ops/s
# Warmup Iteration   5: 11.852 ops/s
# Warmup Iteration   6: 11.901 ops/s
# Warmup Iteration   7: 11.706 ops/s
# Warmup Iteration   8: 11.722 ops/s
# Warmup Iteration   9: 11.773 ops/s
# Warmup Iteration  10: 11.840 ops/s
# Warmup Iteration  11: 11.905 ops/s
# Warmup Iteration  12: 11.759 ops/s
# Warmup Iteration  13: 11.810 ops/s
# Warmup Iteration  14: 11.722 ops/s
# Warmup Iteration  15: 11.747 ops/s
# Warmup Iteration  16: 11.924 ops/s
# Warmup Iteration  17: 11.852 ops/s
# Warmup Iteration  18: 11.829 ops/s
# Warmup Iteration  19: 11.830 ops/s
# Warmup Iteration  20: 11.700 ops/s
Iteration   1: 11.667 ops/s
Iteration   2: 11.794 ops/s
Iteration   3: 11.777 ops/s
Iteration   4: 11.731 ops/s
Iteration   5: 11.864 ops/s
Iteration   6: 11.821 ops/s
Iteration   7: 11.904 ops/s
Iteration   8: 11.977 ops/s
Iteration   9: 11.754 ops/s
Iteration  10: 11.778 ops/s

WARNING: Not a HotSpot compiler command compatible VM ("anonymous-11.0.2"), compilerHints are disabled.
# Run progress: 10.00% complete, ETA 00:45:20
# Fork: 2 of 2
# Warmup Iteration   1: 10.749 ops/s
# Warmup Iteration   2: 11.747 ops/s
# Warmup Iteration   3: 11.846 ops/s
# Warmup Iteration   4: 11.795 ops/s
# Warmup Iteration   5: 11.895 ops/s
# Warmup Iteration   6: 11.789 ops/s
# Warmup Iteration   7: 11.678 ops/s
# Warmup Iteration   8: 11.750 ops/s
# Warmup Iteration   9: 11.692 ops/s
# Warmup Iteration  10: 11.644 ops/s
# Warmup Iteration  11: 11.927 ops/s
# Warmup Iteration  12: 11.609 ops/s
# Warmup Iteration  13: 11.804 ops/s
# Warmup Iteration  14: 11.822 ops/s
# Warmup Iteration  15: 11.735 ops/s
# Warmup Iteration  16: 11.822 ops/s
# Warmup Iteration  17: 11.722 ops/s
# Warmup Iteration  18: 11.742 ops/s
# Warmup Iteration  19: 11.648 ops/s
# Warmup Iteration  20: 11.769 ops/s
Iteration   1: 11.932 ops/s
Iteration   2: 11.846 ops/s
Iteration   3: 11.891 ops/s
Iteration   4: 11.934 ops/s
Iteration   5: 11.759 ops/s
Iteration   6: 11.719 ops/s
Iteration   7: 11.819 ops/s
Iteration   8: 11.724 ops/s
Iteration   9: 11.731 ops/s
Iteration  10: 11.820 ops/s


Result "jvmscompare.benchmark.PersonCombinedSummaryStats.combinedStatistics_EC_Eager_Serial":
  11.812 ±(99.9%) 0.073 ops/s [Average]
  (min, avg, max) = (11.667, 11.812, 11.977), stdev = 0.084
  CI (99.9%): [11.739, 11.885] (assumes normal distribution)


# JMH version: 1.23
# VM version: JDK 11.0.2, anonymous, 11.0.2+9
# *** WARNING: This VM is not supported by JMH. The produced benchmark data can be completely wrong.
# VM invoker: /Library/Java/JavaVirtualMachines/openjdk-11.0.2.jdk/Contents/Home/bin/java
# VM options: -Xms1024m -Xmx1024m
# Warmup: 20 iterations, 10 s each
# Measurement: 10 iterations, 10 s each
# Timeout: 10 min per iteration
# Threads: 1 thread, will synchronize iterations
# Benchmark mode: Throughput, ops/time
# Benchmark: jvmscompare.benchmark.PersonCombinedSummaryStats.combinedStatistics_EC_Lazy_Serial

WARNING: Not a HotSpot compiler command compatible VM ("anonymous-11.0.2"), compilerHints are disabled.
# Run progress: 20.00% complete, ETA 00:40:17
# Fork: 1 of 2
# Warmup Iteration   1: 9.365 ops/s
# Warmup Iteration   2: 10.472 ops/s
# Warmup Iteration   3: 10.612 ops/s
# Warmup Iteration   4: 10.409 ops/s
# Warmup Iteration   5: 10.415 ops/s
# Warmup Iteration   6: 10.564 ops/s
# Warmup Iteration   7: 10.620 ops/s
# Warmup Iteration   8: 10.399 ops/s
# Warmup Iteration   9: 10.628 ops/s
# Warmup Iteration  10: 10.621 ops/s
# Warmup Iteration  11: 10.563 ops/s
# Warmup Iteration  12: 10.580 ops/s
# Warmup Iteration  13: 10.625 ops/s
# Warmup Iteration  14: 10.630 ops/s
# Warmup Iteration  15: 10.435 ops/s
# Warmup Iteration  16: 10.523 ops/s
# Warmup Iteration  17: 10.519 ops/s
# Warmup Iteration  18: 10.426 ops/s
# Warmup Iteration  19: 10.401 ops/s
# Warmup Iteration  20: 10.278 ops/s
Iteration   1: 10.471 ops/s
Iteration   2: 10.424 ops/s
Iteration   3: 10.523 ops/s
Iteration   4: 10.631 ops/s
Iteration   5: 10.366 ops/s
Iteration   6: 10.531 ops/s
Iteration   7: 10.194 ops/s
Iteration   8: 10.291 ops/s
Iteration   9: 10.389 ops/s
Iteration  10: 10.469 ops/s

WARNING: Not a HotSpot compiler command compatible VM ("anonymous-11.0.2"), compilerHints are disabled.
# Run progress: 30.00% complete, ETA 00:35:15
# Fork: 2 of 2
# Warmup Iteration   1: 9.286 ops/s
# Warmup Iteration   2: 10.491 ops/s
# Warmup Iteration   3: 10.507 ops/s
# Warmup Iteration   4: 10.470 ops/s
# Warmup Iteration   5: 10.551 ops/s
# Warmup Iteration   6: 10.404 ops/s
# Warmup Iteration   7: 10.435 ops/s
# Warmup Iteration   8: 10.500 ops/s
# Warmup Iteration   9: 10.433 ops/s
# Warmup Iteration  10: 10.431 ops/s
# Warmup Iteration  11: 10.468 ops/s
# Warmup Iteration  12: 10.534 ops/s
# Warmup Iteration  13: 10.394 ops/s
# Warmup Iteration  14: 10.406 ops/s
# Warmup Iteration  15: 10.566 ops/s
# Warmup Iteration  16: 10.502 ops/s
# Warmup Iteration  17: 10.400 ops/s
# Warmup Iteration  18: 10.663 ops/s
# Warmup Iteration  19: 10.404 ops/s
# Warmup Iteration  20: 10.477 ops/s
Iteration   1: 10.656 ops/s
Iteration   2: 10.558 ops/s
Iteration   3: 10.522 ops/s
Iteration   4: 10.500 ops/s
Iteration   5: 10.620 ops/s
Iteration   6: 10.562 ops/s
Iteration   7: 10.606 ops/s
Iteration   8: 10.438 ops/s
Iteration   9: 10.472 ops/s
Iteration  10: 10.544 ops/s


Result "jvmscompare.benchmark.PersonCombinedSummaryStats.combinedStatistics_EC_Lazy_Serial":
  10.488 ±(99.9%) 0.101 ops/s [Average]
  (min, avg, max) = (10.194, 10.488, 10.656), stdev = 0.116
  CI (99.9%): [10.388, 10.589] (assumes normal distribution)


# JMH version: 1.23
# VM version: JDK 11.0.2, anonymous, 11.0.2+9
# *** WARNING: This VM is not supported by JMH. The produced benchmark data can be completely wrong.
# VM invoker: /Library/Java/JavaVirtualMachines/openjdk-11.0.2.jdk/Contents/Home/bin/java
# VM options: -Xms1024m -Xmx1024m
# Warmup: 20 iterations, 10 s each
# Measurement: 10 iterations, 10 s each
# Timeout: 10 min per iteration
# Threads: 1 thread, will synchronize iterations
# Benchmark mode: Throughput, ops/time
# Benchmark: jvmscompare.benchmark.PersonCombinedSummaryStats.combinedStatistics_EC_Stream_Parallel

WARNING: Not a HotSpot compiler command compatible VM ("anonymous-11.0.2"), compilerHints are disabled.
# Run progress: 40.00% complete, ETA 00:30:13
# Fork: 1 of 2
# Warmup Iteration   1: 94.495 ops/s
# Warmup Iteration   2: 100.019 ops/s
# Warmup Iteration   3: 97.668 ops/s
# Warmup Iteration   4: 106.877 ops/s
# Warmup Iteration   5: 102.965 ops/s
# Warmup Iteration   6: 104.235 ops/s
# Warmup Iteration   7: 107.084 ops/s
# Warmup Iteration   8: 106.435 ops/s
# Warmup Iteration   9: 105.349 ops/s
# Warmup Iteration  10: 104.847 ops/s
# Warmup Iteration  11: 104.797 ops/s
# Warmup Iteration  12: 106.366 ops/s
# Warmup Iteration  13: 105.436 ops/s
# Warmup Iteration  14: 97.806 ops/s
# Warmup Iteration  15: 107.562 ops/s
# Warmup Iteration  16: 104.151 ops/s
# Warmup Iteration  17: 104.746 ops/s
# Warmup Iteration  18: 99.974 ops/s
# Warmup Iteration  19: 105.070 ops/s
# Warmup Iteration  20: 106.154 ops/s
Iteration   1: 100.389 ops/s
Iteration   2: 101.706 ops/s
Iteration   3: 108.547 ops/s
Iteration   4: 104.529 ops/s
Iteration   5: 112.732 ops/s
Iteration   6: 112.319 ops/s
Iteration   7: 111.556 ops/s
Iteration   8: 106.844 ops/s
Iteration   9: 105.419 ops/s
Iteration  10: 105.500 ops/s

WARNING: Not a HotSpot compiler command compatible VM ("anonymous-11.0.2"), compilerHints are disabled.
# Run progress: 50.00% complete, ETA 00:25:10
# Fork: 2 of 2
# Warmup Iteration   1: 92.393 ops/s
# Warmup Iteration   2: 105.077 ops/s
# Warmup Iteration   3: 105.790 ops/s
# Warmup Iteration   4: 103.696 ops/s
# Warmup Iteration   5: 105.256 ops/s
# Warmup Iteration   6: 103.067 ops/s
# Warmup Iteration   7: 104.662 ops/s
# Warmup Iteration   8: 105.432 ops/s
# Warmup Iteration   9: 106.239 ops/s
# Warmup Iteration  10: 104.328 ops/s
# Warmup Iteration  11: 105.103 ops/s
# Warmup Iteration  12: 102.449 ops/s
# Warmup Iteration  13: 96.226 ops/s
# Warmup Iteration  14: 95.472 ops/s
# Warmup Iteration  15: 96.583 ops/s
# Warmup Iteration  16: 98.218 ops/s
# Warmup Iteration  17: 96.014 ops/s
# Warmup Iteration  18: 103.399 ops/s
# Warmup Iteration  19: 91.660 ops/s
# Warmup Iteration  20: 95.454 ops/s
Iteration   1: 91.960 ops/s
Iteration   2: 96.612 ops/s
Iteration   3: 99.839 ops/s
Iteration   4: 94.796 ops/s
Iteration   5: 99.935 ops/s
Iteration   6: 99.513 ops/s
Iteration   7: 100.240 ops/s
Iteration   8: 98.703 ops/s
Iteration   9: 99.924 ops/s
Iteration  10: 94.921 ops/s


Result "jvmscompare.benchmark.PersonCombinedSummaryStats.combinedStatistics_EC_Stream_Parallel":
  102.299 ±(99.9%) 5.179 ops/s [Average]
  (min, avg, max) = (91.960, 102.299, 112.732), stdev = 5.964
  CI (99.9%): [97.121, 107.478] (assumes normal distribution)


# JMH version: 1.23
# VM version: JDK 11.0.2, anonymous, 11.0.2+9
# *** WARNING: This VM is not supported by JMH. The produced benchmark data can be completely wrong.
# VM invoker: /Library/Java/JavaVirtualMachines/openjdk-11.0.2.jdk/Contents/Home/bin/java
# VM options: -Xms1024m -Xmx1024m
# Warmup: 20 iterations, 10 s each
# Measurement: 10 iterations, 10 s each
# Timeout: 10 min per iteration
# Threads: 1 thread, will synchronize iterations
# Benchmark mode: Throughput, ops/time
# Benchmark: jvmscompare.benchmark.PersonCombinedSummaryStats.combinedStatistics_JDK_Stream_Parallel

WARNING: Not a HotSpot compiler command compatible VM ("anonymous-11.0.2"), compilerHints are disabled.
# Run progress: 60.00% complete, ETA 00:20:07
# Fork: 1 of 2
# Warmup Iteration   1: 83.661 ops/s
# Warmup Iteration   2: 95.042 ops/s
# Warmup Iteration   3: 103.322 ops/s
# Warmup Iteration   4: 94.146 ops/s
# Warmup Iteration   5: 100.793 ops/s
# Warmup Iteration   6: 92.828 ops/s
# Warmup Iteration   7: 104.907 ops/s
# Warmup Iteration   8: 97.955 ops/s
# Warmup Iteration   9: 98.095 ops/s
# Warmup Iteration  10: 95.668 ops/s
# Warmup Iteration  11: 97.027 ops/s
# Warmup Iteration  12: 101.406 ops/s
# Warmup Iteration  13: 90.759 ops/s
# Warmup Iteration  14: 98.201 ops/s
# Warmup Iteration  15: 102.380 ops/s
# Warmup Iteration  16: 99.827 ops/s
# Warmup Iteration  17: 101.628 ops/s
# Warmup Iteration  18: 97.608 ops/s
# Warmup Iteration  19: 100.887 ops/s
# Warmup Iteration  20: 99.244 ops/s
Iteration   1: 93.339 ops/s
Iteration   2: 102.979 ops/s
Iteration   3: 96.276 ops/s
Iteration   4: 101.332 ops/s
Iteration   5: 97.186 ops/s
Iteration   6: 104.698 ops/s
Iteration   7: 100.685 ops/s
Iteration   8: 96.255 ops/s
Iteration   9: 97.485 ops/s
Iteration  10: 99.181 ops/s

WARNING: Not a HotSpot compiler command compatible VM ("anonymous-11.0.2"), compilerHints are disabled.
# Run progress: 70.00% complete, ETA 00:15:05
# Fork: 2 of 2
# Warmup Iteration   1: 88.423 ops/s
# Warmup Iteration   2: 95.332 ops/s
# Warmup Iteration   3: 101.622 ops/s
# Warmup Iteration   4: 96.394 ops/s
# Warmup Iteration   5: 93.549 ops/s
# Warmup Iteration   6: 104.627 ops/s
# Warmup Iteration   7: 97.870 ops/s
# Warmup Iteration   8: 94.678 ops/s
# Warmup Iteration   9: 98.123 ops/s
# Warmup Iteration  10: 98.857 ops/s
# Warmup Iteration  11: 100.065 ops/s
# Warmup Iteration  12: 98.908 ops/s
# Warmup Iteration  13: 103.052 ops/s
# Warmup Iteration  14: 99.402 ops/s
# Warmup Iteration  15: 99.085 ops/s
# Warmup Iteration  16: 100.212 ops/s
# Warmup Iteration  17: 99.409 ops/s
# Warmup Iteration  18: 96.136 ops/s
# Warmup Iteration  19: 100.058 ops/s
# Warmup Iteration  20: 96.834 ops/s
Iteration   1: 94.182 ops/s
Iteration   2: 99.301 ops/s
Iteration   3: 99.452 ops/s
Iteration   4: 93.384 ops/s
Iteration   5: 97.916 ops/s
Iteration   6: 96.912 ops/s
Iteration   7: 96.963 ops/s
Iteration   8: 99.238 ops/s
Iteration   9: 102.406 ops/s
Iteration  10: 102.160 ops/s


Result "jvmscompare.benchmark.PersonCombinedSummaryStats.combinedStatistics_JDK_Stream_Parallel":
  98.567 ±(99.9%) 2.759 ops/s [Average]
  (min, avg, max) = (93.339, 98.567, 104.698), stdev = 3.177
  CI (99.9%): [95.808, 101.326] (assumes normal distribution)


# JMH version: 1.23
# VM version: JDK 11.0.2, anonymous, 11.0.2+9
# *** WARNING: This VM is not supported by JMH. The produced benchmark data can be completely wrong.
# VM invoker: /Library/Java/JavaVirtualMachines/openjdk-11.0.2.jdk/Contents/Home/bin/java
# VM options: -Xms1024m -Xmx1024m
# Warmup: 20 iterations, 10 s each
# Measurement: 10 iterations, 10 s each
# Timeout: 10 min per iteration
# Threads: 1 thread, will synchronize iterations
# Benchmark mode: Throughput, ops/time
# Benchmark: jvmscompare.benchmark.PersonCombinedSummaryStats.combinedStatistics_JDK_Stream_Serial

WARNING: Not a HotSpot compiler command compatible VM ("anonymous-11.0.2"), compilerHints are disabled.
# Run progress: 80.00% complete, ETA 00:10:03
# Fork: 1 of 2
# Warmup Iteration   1: 9.459 ops/s
# Warmup Iteration   2: 10.916 ops/s
# Warmup Iteration   3: 11.337 ops/s
# Warmup Iteration   4: 11.412 ops/s
# Warmup Iteration   5: 11.469 ops/s
# Warmup Iteration   6: 11.478 ops/s
# Warmup Iteration   7: 11.284 ops/s
# Warmup Iteration   8: 11.575 ops/s
# Warmup Iteration   9: 11.352 ops/s
# Warmup Iteration  10: 11.285 ops/s
# Warmup Iteration  11: 11.404 ops/s
# Warmup Iteration  12: 11.290 ops/s
# Warmup Iteration  13: 11.423 ops/s
# Warmup Iteration  14: 11.386 ops/s
# Warmup Iteration  15: 11.258 ops/s
# Warmup Iteration  16: 11.372 ops/s
# Warmup Iteration  17: 11.380 ops/s
# Warmup Iteration  18: 11.344 ops/s
# Warmup Iteration  19: 11.277 ops/s
# Warmup Iteration  20: 11.375 ops/s
Iteration   1: 11.351 ops/s
Iteration   2: 11.465 ops/s
Iteration   3: 11.232 ops/s
Iteration   4: 11.422 ops/s
Iteration   5: 11.452 ops/s
Iteration   6: 11.341 ops/s
Iteration   7: 11.337 ops/s
Iteration   8: 11.363 ops/s
Iteration   9: 11.172 ops/s
Iteration  10: 11.357 ops/s

WARNING: Not a HotSpot compiler command compatible VM ("anonymous-11.0.2"), compilerHints are disabled.
# Run progress: 90.00% complete, ETA 00:05:01
# Fork: 2 of 2
# Warmup Iteration   1: 10.388 ops/s
# Warmup Iteration   2: 11.321 ops/s
# Warmup Iteration   3: 11.807 ops/s
# Warmup Iteration   4: 12.003 ops/s
# Warmup Iteration   5: 12.087 ops/s
# Warmup Iteration   6: 12.076 ops/s
# Warmup Iteration   7: 11.967 ops/s
# Warmup Iteration   8: 11.918 ops/s
# Warmup Iteration   9: 11.390 ops/s
# Warmup Iteration  10: 11.559 ops/s
# Warmup Iteration  11: 11.328 ops/s
# Warmup Iteration  12: 11.333 ops/s
# Warmup Iteration  13: 11.491 ops/s
# Warmup Iteration  14: 11.427 ops/s
# Warmup Iteration  15: 11.279 ops/s
# Warmup Iteration  16: 11.514 ops/s
# Warmup Iteration  17: 11.410 ops/s
# Warmup Iteration  18: 11.217 ops/s
# Warmup Iteration  19: 11.443 ops/s
# Warmup Iteration  20: 11.331 ops/s
Iteration   1: 11.260 ops/s
Iteration   2: 11.342 ops/s
Iteration   3: 11.334 ops/s
Iteration   4: 11.483 ops/s
Iteration   5: 11.292 ops/s
Iteration   6: 11.376 ops/s
Iteration   7: 11.238 ops/s
Iteration   8: 11.470 ops/s
Iteration   9: 11.395 ops/s
Iteration  10: 11.193 ops/s


Result "jvmscompare.benchmark.PersonCombinedSummaryStats.combinedStatistics_JDK_Stream_Serial":
  11.344 ±(99.9%) 0.079 ops/s [Average]
  (min, avg, max) = (11.172, 11.344, 11.483), stdev = 0.091
  CI (99.9%): [11.265, 11.423] (assumes normal distribution)


# Run complete. Total time: 00:50:17

REMEMBER: The numbers below are just data. To gain reusable insights, you need to follow up on
why the numbers are the way they are. Use profilers (see -prof, -lprof), design factorial
experiments, perform baseline and negative tests that provide experimental control, make sure
the benchmarking environment is safe on JVM/OS/HW level, ask for reviews from the domain experts.
Do not assume the numbers tell you what you want them to tell.

Benchmark                                                           Mode  Cnt    Score   Error  Units
PersonCombinedSummaryStats.combinedStatistics_EC_Eager_Serial      thrpt   20   11.812 ± 0.073  ops/s
PersonCombinedSummaryStats.combinedStatistics_EC_Lazy_Serial       thrpt   20   10.488 ± 0.101  ops/s
PersonCombinedSummaryStats.combinedStatistics_EC_Stream_Parallel   thrpt   20  102.299 ± 5.179  ops/s
PersonCombinedSummaryStats.combinedStatistics_JDK_Stream_Parallel  thrpt   20   98.567 ± 2.759  ops/s
PersonCombinedSummaryStats.combinedStatistics_JDK_Stream_Serial    thrpt   20   11.344 ± 0.079  ops/s

Benchmark result is saved to benchmark-results/person-combined-summary-stats/06_OpenJDKHotspotPersonCombinedSummaryStats.csv
[INFO] ------------------------------------------------------------------------
[INFO] BUILD SUCCESS
[INFO] ------------------------------------------------------------------------
[INFO] Total time:  50:29 min
[INFO] Finished at: 2020-02-07T13:50:24-05:00
[INFO] ------------------------------------------------------------------------
