[INFO] Scanning for projects...
[INFO] 
[INFO] ---------------------< jvms-compare:jvms-compare >----------------------
[INFO] Building JVMs Compare 1.0.0
[INFO] --------------------------------[ jar ]---------------------------------
[INFO] 
[INFO] --- maven-clean-plugin:2.5:clean (default-clean) @ jvms-compare ---
[INFO] Deleting /Users/dr/projects/jvms-compare/target
[INFO] 
[INFO] --- maven-toolchains-plugin:1.1:toolchain (default) @ jvms-compare ---
[INFO] Required toolchain: jdk [ vendor='openjdk' version='11' ]
[INFO] Found matching toolchain for type jdk: JDK[/Library/Java/JavaVirtualMachines/openjdk-11.0.2.jdk/Contents/Home/]
[INFO] 
[INFO] --- maven-dependency-plugin:3.1.1:build-classpath (build-classpath) @ jvms-compare ---
[INFO] Dependencies classpath:
/Users/dr/.m2/repository/org/apache/commons/commons-math3/3.2/commons-math3-3.2.jar:/Users/dr/.m2/repository/org/junit/jupiter/junit-jupiter-api/5.5.0/junit-jupiter-api-5.5.0.jar:/Users/dr/.m2/repository/org/eclipse/collections/eclipse-collections/10.0.0/eclipse-collections-10.0.0.jar:/Users/dr/.m2/repository/javax/annotation/javax.annotation-api/1.3.1/javax.annotation-api-1.3.1.jar:/Users/dr/.m2/repository/org/junit/platform/junit-platform-engine/1.5.0/junit-platform-engine-1.5.0.jar:/Users/dr/.m2/repository/org/junit/platform/junit-platform-commons/1.5.0/junit-platform-commons-1.5.0.jar:/Users/dr/.m2/repository/org/junit/jupiter/junit-jupiter-params/5.5.0/junit-jupiter-params-5.5.0.jar:/Users/dr/.m2/repository/org/junit/jupiter/junit-jupiter-engine/5.5.0/junit-jupiter-engine-5.5.0.jar:/Users/dr/.m2/repository/org/junit/jupiter/junit-jupiter/5.5.0/junit-jupiter-5.5.0.jar:/Users/dr/.m2/repository/org/opentest4j/opentest4j/1.2.0/opentest4j-1.2.0.jar:/Users/dr/.m2/repository/org/openjdk/jmh/jmh-core/1.23/jmh-core-1.23.jar:/Users/dr/.m2/repository/org/apiguardian/apiguardian-api/1.1.0/apiguardian-api-1.1.0.jar:/Users/dr/.m2/repository/net/sf/jopt-simple/jopt-simple/4.6/jopt-simple-4.6.jar:/Users/dr/.m2/repository/org/eclipse/collections/eclipse-collections-api/10.0.0/eclipse-collections-api-10.0.0.jar
[INFO] 
[INFO] --- maven-resources-plugin:2.6:resources (default-resources) @ jvms-compare ---
[INFO] Using 'UTF-8' encoding to copy filtered resources.
[INFO] Copying 1 resource
[INFO] 
[INFO] --- maven-compiler-plugin:3.8.1:compile (default-compile) @ jvms-compare ---
[INFO] Toolchain in maven-compiler-plugin: JDK[/Library/Java/JavaVirtualMachines/openjdk-11.0.2.jdk/Contents/Home/]
[INFO] Changes detected - recompiling the module!
[INFO] Compiling 10 source files to /Users/dr/projects/jvms-compare/target/classes
[INFO] 
[INFO] --- maven-resources-plugin:2.6:testResources (default-testResources) @ jvms-compare ---
[INFO] Using 'UTF-8' encoding to copy filtered resources.
[INFO] Copying 1 resource
[INFO] 
[INFO] --- maven-compiler-plugin:3.8.1:testCompile (default-testCompile) @ jvms-compare ---
[INFO] Toolchain in maven-compiler-plugin: JDK[/Library/Java/JavaVirtualMachines/openjdk-11.0.2.jdk/Contents/Home/]
[INFO] Changes detected - recompiling the module!
[INFO] Compiling 2 source files to /Users/dr/projects/jvms-compare/target/test-classes
[INFO] 
[INFO] --- maven-surefire-plugin:2.12.4:test (default-test) @ jvms-compare ---
[INFO] Toolchain in surefire-plugin: JDK[/Library/Java/JavaVirtualMachines/openjdk-11.0.2.jdk/Contents/Home/]
[INFO] Surefire report directory: /Users/dr/projects/jvms-compare/target/surefire-reports

-------------------------------------------------------
 T E S T S
-------------------------------------------------------
Running jvmscompare.PersonTest
Tests run: 3, Failures: 0, Errors: 0, Skipped: 0, Time elapsed: 1.241 sec
Running jvmscompare.IntListTest
Tests run: 3, Failures: 0, Errors: 0, Skipped: 0, Time elapsed: 1.066 sec

Results :

Tests run: 6, Failures: 0, Errors: 0, Skipped: 0

[INFO] 
[INFO] --- exec-maven-plugin:1.6.0:exec (combinedSummaryStats) @ jvms-compare ---
[INFO] Toolchain in exec-maven-plugin: JDK[/Library/Java/JavaVirtualMachines/openjdk-11.0.2.jdk/Contents/Home/]
##### Heap utilization statistics [MB] #####
Used Memory:6
Free Memory:1017
Total Memory:1024
Max Memory:1024
Java Runtime Environment version: 11.0.2
Java Runtime Environment vendor: Oracle Corporation

Java Runtime Name: OpenJDK Runtime Environment
Java Runtime Version: 11.0.2+9

Java Virtual Machine name: anonymous
Java Virtual Machine vendor: Oracle Corporation
Java Virtual Machine version: 11.0.2+9

Java Class Version: 55.0

Benchmark size: 1000000
Benchmark forks: 2
Benchmark warmups: 20
Benchmark measurements: 10

WARNING: An illegal reflective access operation has occurred
WARNING: Illegal reflective access by org.openjdk.jmh.util.Utils (file:/Users/dr/.m2/repository/org/openjdk/jmh/jmh-core/1.23/jmh-core-1.23.jar) to field java.io.PrintStream.charOut
WARNING: Please consider reporting this to the maintainers of org.openjdk.jmh.util.Utils
WARNING: Use --illegal-access=warn to enable warnings of further illegal reflective access operations
WARNING: All illegal access operations will be denied in a future release
# JMH version: 1.23
# VM version: JDK 11.0.2, anonymous, 11.0.2+9
# *** WARNING: This VM is not supported by JMH. The produced benchmark data can be completely wrong.
# VM invoker: /Library/Java/JavaVirtualMachines/openjdk-11.0.2.jdk/Contents/Home/bin/java
# VM options: -XX:+UnlockExperimentalVMOptions -XX:+EnableJVMCI -XX:+UseJVMCICompiler -Xms1024m -Xmx1024m
# Warmup: 20 iterations, 10 s each
# Measurement: 10 iterations, 10 s each
# Timeout: 10 min per iteration
# Threads: 1 thread, will synchronize iterations
# Benchmark mode: Throughput, ops/time
# Benchmark: jvmscompare.benchmark.PersonCombinedSummaryStats.combinedStatistics_EC_Eager_Serial

WARNING: Not a HotSpot compiler command compatible VM ("anonymous-11.0.2"), compilerHints are disabled.
# Run progress: 0.00% complete, ETA 00:50:00
# Fork: 1 of 2
# Warmup Iteration   1: 8.682 ops/s
# Warmup Iteration   2: 11.029 ops/s
# Warmup Iteration   3: 11.075 ops/s
# Warmup Iteration   4: 11.111 ops/s
# Warmup Iteration   5: 11.168 ops/s
# Warmup Iteration   6: 11.025 ops/s
# Warmup Iteration   7: 11.123 ops/s
# Warmup Iteration   8: 11.059 ops/s
# Warmup Iteration   9: 11.086 ops/s
# Warmup Iteration  10: 11.169 ops/s
# Warmup Iteration  11: 11.087 ops/s
# Warmup Iteration  12: 11.110 ops/s
# Warmup Iteration  13: 11.079 ops/s
# Warmup Iteration  14: 11.263 ops/s
# Warmup Iteration  15: 11.065 ops/s
# Warmup Iteration  16: 10.979 ops/s
# Warmup Iteration  17: 11.024 ops/s
# Warmup Iteration  18: 11.179 ops/s
# Warmup Iteration  19: 11.104 ops/s
# Warmup Iteration  20: 11.161 ops/s
Iteration   1: 11.009 ops/s
Iteration   2: 11.038 ops/s
Iteration   3: 11.229 ops/s
Iteration   4: 11.131 ops/s
Iteration   5: 11.140 ops/s
Iteration   6: 11.196 ops/s
Iteration   7: 11.259 ops/s
Iteration   8: 11.137 ops/s
Iteration   9: 11.057 ops/s
Iteration  10: 11.171 ops/s

WARNING: Not a HotSpot compiler command compatible VM ("anonymous-11.0.2"), compilerHints are disabled.
# Run progress: 10.00% complete, ETA 00:45:18
# Fork: 2 of 2
# Warmup Iteration   1: 9.093 ops/s
# Warmup Iteration   2: 11.000 ops/s
# Warmup Iteration   3: 11.052 ops/s
# Warmup Iteration   4: 11.032 ops/s
# Warmup Iteration   5: 11.040 ops/s
# Warmup Iteration   6: 11.096 ops/s
# Warmup Iteration   7: 10.955 ops/s
# Warmup Iteration   8: 10.962 ops/s
# Warmup Iteration   9: 11.224 ops/s
# Warmup Iteration  10: 11.053 ops/s
# Warmup Iteration  11: 11.058 ops/s
# Warmup Iteration  12: 10.982 ops/s
# Warmup Iteration  13: 11.137 ops/s
# Warmup Iteration  14: 11.072 ops/s
# Warmup Iteration  15: 11.042 ops/s
# Warmup Iteration  16: 11.057 ops/s
# Warmup Iteration  17: 10.887 ops/s
# Warmup Iteration  18: 10.999 ops/s
# Warmup Iteration  19: 10.987 ops/s
# Warmup Iteration  20: 10.989 ops/s
Iteration   1: 10.968 ops/s
Iteration   2: 11.142 ops/s
Iteration   3: 10.905 ops/s
Iteration   4: 11.079 ops/s
Iteration   5: 11.066 ops/s
Iteration   6: 10.978 ops/s
Iteration   7: 10.958 ops/s
Iteration   8: 11.058 ops/s
Iteration   9: 10.973 ops/s
Iteration  10: 11.048 ops/s


Result "jvmscompare.benchmark.PersonCombinedSummaryStats.combinedStatistics_EC_Eager_Serial":
  11.077 ±(99.9%) 0.084 ops/s [Average]
  (min, avg, max) = (10.905, 11.077, 11.259), stdev = 0.097
  CI (99.9%): [10.993, 11.161] (assumes normal distribution)


# JMH version: 1.23
# VM version: JDK 11.0.2, anonymous, 11.0.2+9
# *** WARNING: This VM is not supported by JMH. The produced benchmark data can be completely wrong.
# VM invoker: /Library/Java/JavaVirtualMachines/openjdk-11.0.2.jdk/Contents/Home/bin/java
# VM options: -XX:+UnlockExperimentalVMOptions -XX:+EnableJVMCI -XX:+UseJVMCICompiler -Xms1024m -Xmx1024m
# Warmup: 20 iterations, 10 s each
# Measurement: 10 iterations, 10 s each
# Timeout: 10 min per iteration
# Threads: 1 thread, will synchronize iterations
# Benchmark mode: Throughput, ops/time
# Benchmark: jvmscompare.benchmark.PersonCombinedSummaryStats.combinedStatistics_EC_Lazy_Serial

WARNING: Not a HotSpot compiler command compatible VM ("anonymous-11.0.2"), compilerHints are disabled.
# Run progress: 20.00% complete, ETA 00:40:16
# Fork: 1 of 2
# Warmup Iteration   1: 5.255 ops/s
# Warmup Iteration   2: 6.988 ops/s
# Warmup Iteration   3: 7.007 ops/s
# Warmup Iteration   4: 7.031 ops/s
# Warmup Iteration   5: 7.017 ops/s
# Warmup Iteration   6: 7.024 ops/s
# Warmup Iteration   7: 7.024 ops/s
# Warmup Iteration   8: 7.038 ops/s
# Warmup Iteration   9: 6.968 ops/s
# Warmup Iteration  10: 7.004 ops/s
# Warmup Iteration  11: 7.060 ops/s
# Warmup Iteration  12: 7.008 ops/s
# Warmup Iteration  13: 7.017 ops/s
# Warmup Iteration  14: 7.066 ops/s
# Warmup Iteration  15: 6.973 ops/s
# Warmup Iteration  16: 6.935 ops/s
# Warmup Iteration  17: 7.015 ops/s
# Warmup Iteration  18: 6.951 ops/s
# Warmup Iteration  19: 6.908 ops/s
# Warmup Iteration  20: 7.074 ops/s
Iteration   1: 6.925 ops/s
Iteration   2: 6.865 ops/s
Iteration   3: 6.965 ops/s
Iteration   4: 6.901 ops/s
Iteration   5: 6.873 ops/s
Iteration   6: 6.893 ops/s
Iteration   7: 6.899 ops/s
Iteration   8: 7.023 ops/s
Iteration   9: 6.993 ops/s
Iteration  10: 7.044 ops/s

WARNING: Not a HotSpot compiler command compatible VM ("anonymous-11.0.2"), compilerHints are disabled.
# Run progress: 30.00% complete, ETA 00:35:16
# Fork: 2 of 2
# Warmup Iteration   1: 6.136 ops/s
# Warmup Iteration   2: 8.093 ops/s
# Warmup Iteration   3: 8.143 ops/s
# Warmup Iteration   4: 8.136 ops/s
# Warmup Iteration   5: 8.097 ops/s
# Warmup Iteration   6: 8.295 ops/s
# Warmup Iteration   7: 8.233 ops/s
# Warmup Iteration   8: 8.092 ops/s
# Warmup Iteration   9: 8.246 ops/s
# Warmup Iteration  10: 8.189 ops/s
# Warmup Iteration  11: 8.115 ops/s
# Warmup Iteration  12: 8.102 ops/s
# Warmup Iteration  13: 8.133 ops/s
# Warmup Iteration  14: 8.156 ops/s
# Warmup Iteration  15: 8.131 ops/s
# Warmup Iteration  16: 8.286 ops/s
# Warmup Iteration  17: 8.074 ops/s
# Warmup Iteration  18: 8.152 ops/s
# Warmup Iteration  19: 8.266 ops/s
# Warmup Iteration  20: 8.185 ops/s
Iteration   1: 8.144 ops/s
Iteration   2: 8.222 ops/s
Iteration   3: 8.090 ops/s
Iteration   4: 8.105 ops/s
Iteration   5: 8.243 ops/s
Iteration   6: 8.114 ops/s
Iteration   7: 8.175 ops/s
Iteration   8: 8.229 ops/s
Iteration   9: 8.237 ops/s
Iteration  10: 8.098 ops/s


Result "jvmscompare.benchmark.PersonCombinedSummaryStats.combinedStatistics_EC_Lazy_Serial":
  7.552 ±(99.9%) 0.549 ops/s [Average]
  (min, avg, max) = (6.865, 7.552, 8.243), stdev = 0.633
  CI (99.9%): [7.003, 8.101] (assumes normal distribution)


# JMH version: 1.23
# VM version: JDK 11.0.2, anonymous, 11.0.2+9
# *** WARNING: This VM is not supported by JMH. The produced benchmark data can be completely wrong.
# VM invoker: /Library/Java/JavaVirtualMachines/openjdk-11.0.2.jdk/Contents/Home/bin/java
# VM options: -XX:+UnlockExperimentalVMOptions -XX:+EnableJVMCI -XX:+UseJVMCICompiler -Xms1024m -Xmx1024m
# Warmup: 20 iterations, 10 s each
# Measurement: 10 iterations, 10 s each
# Timeout: 10 min per iteration
# Threads: 1 thread, will synchronize iterations
# Benchmark mode: Throughput, ops/time
# Benchmark: jvmscompare.benchmark.PersonCombinedSummaryStats.combinedStatistics_EC_Stream_Parallel

WARNING: Not a HotSpot compiler command compatible VM ("anonymous-11.0.2"), compilerHints are disabled.
# Run progress: 40.00% complete, ETA 00:30:14
# Fork: 1 of 2
# Warmup Iteration   1: 62.793 ops/s
# Warmup Iteration   2: 77.408 ops/s
# Warmup Iteration   3: 73.480 ops/s
# Warmup Iteration   4: 74.837 ops/s
# Warmup Iteration   5: 76.804 ops/s
# Warmup Iteration   6: 74.302 ops/s
# Warmup Iteration   7: 79.850 ops/s
# Warmup Iteration   8: 77.025 ops/s
# Warmup Iteration   9: 77.784 ops/s
# Warmup Iteration  10: 77.338 ops/s
# Warmup Iteration  11: 77.936 ops/s
# Warmup Iteration  12: 76.767 ops/s
# Warmup Iteration  13: 75.865 ops/s
# Warmup Iteration  14: 76.359 ops/s
# Warmup Iteration  15: 77.663 ops/s
# Warmup Iteration  16: 76.975 ops/s
# Warmup Iteration  17: 79.371 ops/s
# Warmup Iteration  18: 78.169 ops/s
# Warmup Iteration  19: 77.172 ops/s
# Warmup Iteration  20: 77.927 ops/s
Iteration   1: 75.731 ops/s
Iteration   2: 79.912 ops/s
Iteration   3: 80.196 ops/s
Iteration   4: 81.425 ops/s
Iteration   5: 80.942 ops/s
Iteration   6: 80.670 ops/s
Iteration   7: 81.072 ops/s
Iteration   8: 81.105 ops/s
Iteration   9: 81.118 ops/s
Iteration  10: 81.626 ops/s

WARNING: Not a HotSpot compiler command compatible VM ("anonymous-11.0.2"), compilerHints are disabled.
# Run progress: 50.00% complete, ETA 00:25:11
# Fork: 2 of 2
# Warmup Iteration   1: 63.433 ops/s
# Warmup Iteration   2: 80.573 ops/s
# Warmup Iteration   3: 81.513 ops/s
# Warmup Iteration   4: 81.092 ops/s
# Warmup Iteration   5: 79.777 ops/s
# Warmup Iteration   6: 81.194 ops/s
# Warmup Iteration   7: 81.460 ops/s
# Warmup Iteration   8: 80.465 ops/s
# Warmup Iteration   9: 81.270 ops/s
# Warmup Iteration  10: 80.941 ops/s
# Warmup Iteration  11: 78.741 ops/s
# Warmup Iteration  12: 76.400 ops/s
# Warmup Iteration  13: 77.070 ops/s
# Warmup Iteration  14: 74.639 ops/s
# Warmup Iteration  15: 77.100 ops/s
# Warmup Iteration  16: 80.645 ops/s
# Warmup Iteration  17: 75.219 ops/s
# Warmup Iteration  18: 74.537 ops/s
# Warmup Iteration  19: 75.592 ops/s
# Warmup Iteration  20: 76.939 ops/s
Iteration   1: 78.001 ops/s
Iteration   2: 76.786 ops/s
Iteration   3: 79.845 ops/s
Iteration   4: 77.058 ops/s
Iteration   5: 76.099 ops/s
Iteration   6: 77.496 ops/s
Iteration   7: 75.202 ops/s
Iteration   8: 78.029 ops/s
Iteration   9: 80.638 ops/s
Iteration  10: 75.043 ops/s


Result "jvmscompare.benchmark.PersonCombinedSummaryStats.combinedStatistics_EC_Stream_Parallel":
  78.900 ±(99.9%) 1.993 ops/s [Average]
  (min, avg, max) = (75.043, 78.900, 81.626), stdev = 2.295
  CI (99.9%): [76.907, 80.893] (assumes normal distribution)


# JMH version: 1.23
# VM version: JDK 11.0.2, anonymous, 11.0.2+9
# *** WARNING: This VM is not supported by JMH. The produced benchmark data can be completely wrong.
# VM invoker: /Library/Java/JavaVirtualMachines/openjdk-11.0.2.jdk/Contents/Home/bin/java
# VM options: -XX:+UnlockExperimentalVMOptions -XX:+EnableJVMCI -XX:+UseJVMCICompiler -Xms1024m -Xmx1024m
# Warmup: 20 iterations, 10 s each
# Measurement: 10 iterations, 10 s each
# Timeout: 10 min per iteration
# Threads: 1 thread, will synchronize iterations
# Benchmark mode: Throughput, ops/time
# Benchmark: jvmscompare.benchmark.PersonCombinedSummaryStats.combinedStatistics_JDK_Stream_Parallel

WARNING: Not a HotSpot compiler command compatible VM ("anonymous-11.0.2"), compilerHints are disabled.
# Run progress: 60.00% complete, ETA 00:20:07
# Fork: 1 of 2
# Warmup Iteration   1: 47.136 ops/s
# Warmup Iteration   2: 61.730 ops/s
# Warmup Iteration   3: 63.862 ops/s
# Warmup Iteration   4: 60.235 ops/s
# Warmup Iteration   5: 61.218 ops/s
# Warmup Iteration   6: 62.101 ops/s
# Warmup Iteration   7: 62.206 ops/s
# Warmup Iteration   8: 62.697 ops/s
# Warmup Iteration   9: 62.208 ops/s
# Warmup Iteration  10: 61.823 ops/s
# Warmup Iteration  11: 62.684 ops/s
# Warmup Iteration  12: 63.438 ops/s
# Warmup Iteration  13: 61.295 ops/s
# Warmup Iteration  14: 61.790 ops/s
# Warmup Iteration  15: 62.129 ops/s
# Warmup Iteration  16: 60.729 ops/s
# Warmup Iteration  17: 59.936 ops/s
# Warmup Iteration  18: 62.313 ops/s
# Warmup Iteration  19: 62.811 ops/s
# Warmup Iteration  20: 62.290 ops/s
Iteration   1: 62.096 ops/s
Iteration   2: 61.203 ops/s
Iteration   3: 60.705 ops/s
Iteration   4: 60.695 ops/s
Iteration   5: 62.037 ops/s
Iteration   6: 61.192 ops/s
Iteration   7: 63.213 ops/s
Iteration   8: 62.233 ops/s
Iteration   9: 62.315 ops/s
Iteration  10: 59.621 ops/s

WARNING: Not a HotSpot compiler command compatible VM ("anonymous-11.0.2"), compilerHints are disabled.
# Run progress: 70.00% complete, ETA 00:15:05
# Fork: 2 of 2
# Warmup Iteration   1: 50.559 ops/s
# Warmup Iteration   2: 62.428 ops/s
# Warmup Iteration   3: 59.939 ops/s
# Warmup Iteration   4: 61.740 ops/s
# Warmup Iteration   5: 58.860 ops/s
# Warmup Iteration   6: 60.965 ops/s
# Warmup Iteration   7: 60.411 ops/s
# Warmup Iteration   8: 60.744 ops/s
# Warmup Iteration   9: 59.281 ops/s
# Warmup Iteration  10: 63.631 ops/s
# Warmup Iteration  11: 60.153 ops/s
# Warmup Iteration  12: 58.315 ops/s
# Warmup Iteration  13: 59.256 ops/s
# Warmup Iteration  14: 61.242 ops/s
# Warmup Iteration  15: 58.748 ops/s
# Warmup Iteration  16: 58.753 ops/s
# Warmup Iteration  17: 61.442 ops/s
# Warmup Iteration  18: 62.267 ops/s
# Warmup Iteration  19: 59.132 ops/s
# Warmup Iteration  20: 60.237 ops/s
Iteration   1: 61.941 ops/s
Iteration   2: 62.162 ops/s
Iteration   3: 62.334 ops/s
Iteration   4: 60.619 ops/s
Iteration   5: 59.661 ops/s
Iteration   6: 62.702 ops/s
Iteration   7: 63.436 ops/s
Iteration   8: 58.785 ops/s
Iteration   9: 60.046 ops/s
Iteration  10: 60.699 ops/s


Result "jvmscompare.benchmark.PersonCombinedSummaryStats.combinedStatistics_JDK_Stream_Parallel":
  61.385 ±(99.9%) 1.097 ops/s [Average]
  (min, avg, max) = (58.785, 61.385, 63.436), stdev = 1.263
  CI (99.9%): [60.288, 62.482] (assumes normal distribution)


# JMH version: 1.23
# VM version: JDK 11.0.2, anonymous, 11.0.2+9
# *** WARNING: This VM is not supported by JMH. The produced benchmark data can be completely wrong.
# VM invoker: /Library/Java/JavaVirtualMachines/openjdk-11.0.2.jdk/Contents/Home/bin/java
# VM options: -XX:+UnlockExperimentalVMOptions -XX:+EnableJVMCI -XX:+UseJVMCICompiler -Xms1024m -Xmx1024m
# Warmup: 20 iterations, 10 s each
# Measurement: 10 iterations, 10 s each
# Timeout: 10 min per iteration
# Threads: 1 thread, will synchronize iterations
# Benchmark mode: Throughput, ops/time
# Benchmark: jvmscompare.benchmark.PersonCombinedSummaryStats.combinedStatistics_JDK_Stream_Serial

WARNING: Not a HotSpot compiler command compatible VM ("anonymous-11.0.2"), compilerHints are disabled.
# Run progress: 80.00% complete, ETA 00:10:03
# Fork: 1 of 2
# Warmup Iteration   1: 5.167 ops/s
# Warmup Iteration   2: 5.988 ops/s
# Warmup Iteration   3: 5.935 ops/s
# Warmup Iteration   4: 6.052 ops/s
# Warmup Iteration   5: 5.964 ops/s
# Warmup Iteration   6: 5.984 ops/s
# Warmup Iteration   7: 6.336 ops/s
# Warmup Iteration   8: 6.307 ops/s
# Warmup Iteration   9: 6.353 ops/s
# Warmup Iteration  10: 6.356 ops/s
# Warmup Iteration  11: 6.429 ops/s
# Warmup Iteration  12: 6.368 ops/s
# Warmup Iteration  13: 5.962 ops/s
# Warmup Iteration  14: 6.030 ops/s
# Warmup Iteration  15: 6.028 ops/s
# Warmup Iteration  16: 5.939 ops/s
# Warmup Iteration  17: 5.891 ops/s
# Warmup Iteration  18: 5.864 ops/s
# Warmup Iteration  19: 5.949 ops/s
# Warmup Iteration  20: 5.836 ops/s
Iteration   1: 5.834 ops/s
Iteration   2: 5.825 ops/s
Iteration   3: 5.916 ops/s
Iteration   4: 5.908 ops/s
Iteration   5: 6.010 ops/s
Iteration   6: 5.900 ops/s
Iteration   7: 5.926 ops/s
Iteration   8: 5.937 ops/s
Iteration   9: 5.872 ops/s
Iteration  10: 5.919 ops/s

WARNING: Not a HotSpot compiler command compatible VM ("anonymous-11.0.2"), compilerHints are disabled.
# Run progress: 90.00% complete, ETA 00:05:01
# Fork: 2 of 2
# Warmup Iteration   1: 5.059 ops/s
# Warmup Iteration   2: 5.982 ops/s
# Warmup Iteration   3: 6.010 ops/s
# Warmup Iteration   4: 5.992 ops/s
# Warmup Iteration   5: 5.975 ops/s
# Warmup Iteration   6: 6.000 ops/s
# Warmup Iteration   7: 6.041 ops/s
# Warmup Iteration   8: 6.020 ops/s
# Warmup Iteration   9: 5.996 ops/s
# Warmup Iteration  10: 5.979 ops/s
# Warmup Iteration  11: 6.045 ops/s
# Warmup Iteration  12: 5.941 ops/s
# Warmup Iteration  13: 5.992 ops/s
# Warmup Iteration  14: 6.078 ops/s
# Warmup Iteration  15: 5.998 ops/s
# Warmup Iteration  16: 5.959 ops/s
# Warmup Iteration  17: 5.854 ops/s
# Warmup Iteration  18: 5.853 ops/s
# Warmup Iteration  19: 5.884 ops/s
# Warmup Iteration  20: 5.884 ops/s
Iteration   1: 5.836 ops/s
Iteration   2: 5.862 ops/s
Iteration   3: 5.886 ops/s
Iteration   4: 5.846 ops/s
Iteration   5: 5.865 ops/s
Iteration   6: 5.850 ops/s
Iteration   7: 5.869 ops/s
Iteration   8: 5.822 ops/s
Iteration   9: 5.835 ops/s
Iteration  10: 5.890 ops/s


Result "jvmscompare.benchmark.PersonCombinedSummaryStats.combinedStatistics_JDK_Stream_Serial":
  5.880 ±(99.9%) 0.041 ops/s [Average]
  (min, avg, max) = (5.822, 5.880, 6.010), stdev = 0.047
  CI (99.9%): [5.840, 5.921] (assumes normal distribution)


# Run complete. Total time: 00:50:21

REMEMBER: The numbers below are just data. To gain reusable insights, you need to follow up on
why the numbers are the way they are. Use profilers (see -prof, -lprof), design factorial
experiments, perform baseline and negative tests that provide experimental control, make sure
the benchmarking environment is safe on JVM/OS/HW level, ask for reviews from the domain experts.
Do not assume the numbers tell you what you want them to tell.

Benchmark                                                           Mode  Cnt   Score   Error  Units
PersonCombinedSummaryStats.combinedStatistics_EC_Eager_Serial      thrpt   20  11.077 ± 0.084  ops/s
PersonCombinedSummaryStats.combinedStatistics_EC_Lazy_Serial       thrpt   20   7.552 ± 0.549  ops/s
PersonCombinedSummaryStats.combinedStatistics_EC_Stream_Parallel   thrpt   20  78.900 ± 1.993  ops/s
PersonCombinedSummaryStats.combinedStatistics_JDK_Stream_Parallel  thrpt   20  61.385 ± 1.097  ops/s
PersonCombinedSummaryStats.combinedStatistics_JDK_Stream_Serial    thrpt   20   5.880 ± 0.041  ops/s

Benchmark result is saved to benchmark-results/person-combined-summary-stats/07_OpenJDKGraalPersonCombinedSummaryStats.csv
[INFO] ------------------------------------------------------------------------
[INFO] BUILD SUCCESS
[INFO] ------------------------------------------------------------------------
[INFO] Total time:  50:33 min
[INFO] Finished at: 2020-02-07T20:54:48-05:00
[INFO] ------------------------------------------------------------------------
