[INFO] Scanning for projects...
[INFO] 
[INFO] ---------------------< jvms-compare:jvms-compare >----------------------
[INFO] Building JVMs Compare 1.0.0
[INFO] --------------------------------[ jar ]---------------------------------
[INFO] 
[INFO] --- maven-clean-plugin:2.5:clean (default-clean) @ jvms-compare ---
[INFO] Deleting /Users/dr/projects/jvms-compare/target
[INFO] 
[INFO] --- maven-toolchains-plugin:1.1:toolchain (default) @ jvms-compare ---
[INFO] Required toolchain: jdk [ vendor='graalvmee' version='11' ]
[INFO] Found matching toolchain for type jdk: JDK[/Library/Java/JavaVirtualMachines/graalvm-ee-java11-19.3.1/]
[INFO] 
[INFO] --- maven-dependency-plugin:3.1.1:build-classpath (build-classpath) @ jvms-compare ---
[INFO] Dependencies classpath:
/Users/dr/.m2/repository/org/apache/commons/commons-math3/3.2/commons-math3-3.2.jar:/Users/dr/.m2/repository/org/junit/jupiter/junit-jupiter-api/5.5.0/junit-jupiter-api-5.5.0.jar:/Users/dr/.m2/repository/org/eclipse/collections/eclipse-collections/10.0.0/eclipse-collections-10.0.0.jar:/Users/dr/.m2/repository/javax/annotation/javax.annotation-api/1.3.1/javax.annotation-api-1.3.1.jar:/Users/dr/.m2/repository/org/junit/platform/junit-platform-engine/1.5.0/junit-platform-engine-1.5.0.jar:/Users/dr/.m2/repository/org/junit/platform/junit-platform-commons/1.5.0/junit-platform-commons-1.5.0.jar:/Users/dr/.m2/repository/org/junit/jupiter/junit-jupiter-params/5.5.0/junit-jupiter-params-5.5.0.jar:/Users/dr/.m2/repository/org/junit/jupiter/junit-jupiter-engine/5.5.0/junit-jupiter-engine-5.5.0.jar:/Users/dr/.m2/repository/org/junit/jupiter/junit-jupiter/5.5.0/junit-jupiter-5.5.0.jar:/Users/dr/.m2/repository/org/opentest4j/opentest4j/1.2.0/opentest4j-1.2.0.jar:/Users/dr/.m2/repository/org/openjdk/jmh/jmh-core/1.23/jmh-core-1.23.jar:/Users/dr/.m2/repository/org/apiguardian/apiguardian-api/1.1.0/apiguardian-api-1.1.0.jar:/Users/dr/.m2/repository/net/sf/jopt-simple/jopt-simple/4.6/jopt-simple-4.6.jar:/Users/dr/.m2/repository/org/eclipse/collections/eclipse-collections-api/10.0.0/eclipse-collections-api-10.0.0.jar
[INFO] 
[INFO] --- maven-resources-plugin:2.6:resources (default-resources) @ jvms-compare ---
[INFO] Using 'UTF-8' encoding to copy filtered resources.
[INFO] Copying 1 resource
[INFO] 
[INFO] --- maven-compiler-plugin:3.8.1:compile (default-compile) @ jvms-compare ---
[INFO] Toolchain in maven-compiler-plugin: JDK[/Library/Java/JavaVirtualMachines/graalvm-ee-java11-19.3.1/]
[INFO] Changes detected - recompiling the module!
[INFO] Compiling 10 source files to /Users/dr/projects/jvms-compare/target/classes
[INFO] 
[INFO] --- maven-resources-plugin:2.6:testResources (default-testResources) @ jvms-compare ---
[INFO] Using 'UTF-8' encoding to copy filtered resources.
[INFO] Copying 1 resource
[INFO] 
[INFO] --- maven-compiler-plugin:3.8.1:testCompile (default-testCompile) @ jvms-compare ---
[INFO] Toolchain in maven-compiler-plugin: JDK[/Library/Java/JavaVirtualMachines/graalvm-ee-java11-19.3.1/]
[INFO] Changes detected - recompiling the module!
[INFO] Compiling 2 source files to /Users/dr/projects/jvms-compare/target/test-classes
[INFO] 
[INFO] --- maven-surefire-plugin:2.12.4:test (default-test) @ jvms-compare ---
[INFO] Toolchain in surefire-plugin: JDK[/Library/Java/JavaVirtualMachines/graalvm-ee-java11-19.3.1/]
[INFO] Surefire report directory: /Users/dr/projects/jvms-compare/target/surefire-reports

-------------------------------------------------------
 T E S T S
-------------------------------------------------------
Running jvmscompare.PersonTest
Tests run: 3, Failures: 0, Errors: 0, Skipped: 0, Time elapsed: 1.678 sec
Running jvmscompare.IntListTest
Tests run: 3, Failures: 0, Errors: 0, Skipped: 0, Time elapsed: 1.213 sec

Results :

Tests run: 6, Failures: 0, Errors: 0, Skipped: 0

[INFO] 
[INFO] --- exec-maven-plugin:1.6.0:exec (combinedSummaryStats) @ jvms-compare ---
[INFO] Toolchain in exec-maven-plugin: JDK[/Library/Java/JavaVirtualMachines/graalvm-ee-java11-19.3.1/]
##### Heap utilization statistics [MB] #####
Used Memory:6
Free Memory:1018
Total Memory:1024
Max Memory:1024
Java Runtime Environment version: 11.0.6
Java Runtime Environment vendor: Oracle Corporation

Java Runtime Name: Java(TM) SE Runtime Environment
Java Runtime Version: 11.0.6+1-LTS-jvmci-19.3-b07

Java Virtual Machine name: anonymous
Java Virtual Machine vendor: Oracle Corporation
Java Virtual Machine version: 11.0.6+1-LTS-jvmci-19.3-b07

Java Class Version: 55.0

Benchmark size: 1000000
Benchmark forks: 2
Benchmark warmups: 20
Benchmark measurements: 10

WARNING: An illegal reflective access operation has occurred
WARNING: Illegal reflective access by org.openjdk.jmh.util.Utils (file:/Users/dr/.m2/repository/org/openjdk/jmh/jmh-core/1.23/jmh-core-1.23.jar) to field java.io.PrintStream.charOut
WARNING: Please consider reporting this to the maintainers of org.openjdk.jmh.util.Utils
WARNING: Use --illegal-access=warn to enable warnings of further illegal reflective access operations
WARNING: All illegal access operations will be denied in a future release
# JMH version: 1.23
# VM version: JDK 11.0.6, anonymous, 11.0.6+1-LTS-jvmci-19.3-b07
# *** WARNING: This VM is not supported by JMH. The produced benchmark data can be completely wrong.
# VM invoker: /Library/Java/JavaVirtualMachines/graalvm-ee-java11-19.3.1/Contents/Home/bin/java
# VM options: -XX:+UnlockExperimentalVMOptions -XX:+EnableJVMCIProduct -XX:-UnlockExperimentalVMOptions -XX:+UnlockExperimentalVMOptions -XX:-UseJVMCICompiler -Xms1024m -Xmx1024m
# Warmup: 20 iterations, 10 s each
# Measurement: 10 iterations, 10 s each
# Timeout: 10 min per iteration
# Threads: 1 thread, will synchronize iterations
# Benchmark mode: Throughput, ops/time
# Benchmark: jvmscompare.benchmark.PersonCombinedSummaryStats.combinedStatistics_EC_Eager_Serial

WARNING: Not a HotSpot compiler command compatible VM ("anonymous-11.0.6"), compilerHints are disabled.
# Run progress: 0.00% complete, ETA 00:50:00
# Fork: 1 of 2
# Warmup Iteration   1: 10.611 ops/s
# Warmup Iteration   2: 11.696 ops/s
# Warmup Iteration   3: 11.886 ops/s
# Warmup Iteration   4: 11.856 ops/s
# Warmup Iteration   5: 11.746 ops/s
# Warmup Iteration   6: 11.819 ops/s
# Warmup Iteration   7: 12.060 ops/s
# Warmup Iteration   8: 11.719 ops/s
# Warmup Iteration   9: 11.784 ops/s
# Warmup Iteration  10: 11.878 ops/s
# Warmup Iteration  11: 11.818 ops/s
# Warmup Iteration  12: 11.902 ops/s
# Warmup Iteration  13: 11.928 ops/s
# Warmup Iteration  14: 11.702 ops/s
# Warmup Iteration  15: 11.590 ops/s
# Warmup Iteration  16: 11.834 ops/s
# Warmup Iteration  17: 11.747 ops/s
# Warmup Iteration  18: 11.790 ops/s
# Warmup Iteration  19: 11.727 ops/s
# Warmup Iteration  20: 11.804 ops/s
Iteration   1: 11.727 ops/s
Iteration   2: 11.846 ops/s
Iteration   3: 11.837 ops/s
Iteration   4: 11.731 ops/s
Iteration   5: 11.727 ops/s
Iteration   6: 11.967 ops/s
Iteration   7: 11.754 ops/s
Iteration   8: 11.783 ops/s
Iteration   9: 11.802 ops/s
Iteration  10: 11.695 ops/s

WARNING: Not a HotSpot compiler command compatible VM ("anonymous-11.0.6"), compilerHints are disabled.
# Run progress: 10.00% complete, ETA 00:45:20
# Fork: 2 of 2
# Warmup Iteration   1: 10.540 ops/s
# Warmup Iteration   2: 11.593 ops/s
# Warmup Iteration   3: 11.698 ops/s
# Warmup Iteration   4: 11.772 ops/s
# Warmup Iteration   5: 11.767 ops/s
# Warmup Iteration   6: 11.739 ops/s
# Warmup Iteration   7: 11.899 ops/s
# Warmup Iteration   8: 11.803 ops/s
# Warmup Iteration   9: 11.827 ops/s
# Warmup Iteration  10: 11.889 ops/s
# Warmup Iteration  11: 11.786 ops/s
# Warmup Iteration  12: 11.882 ops/s
# Warmup Iteration  13: 11.860 ops/s
# Warmup Iteration  14: 11.685 ops/s
# Warmup Iteration  15: 11.879 ops/s
# Warmup Iteration  16: 11.694 ops/s
# Warmup Iteration  17: 11.724 ops/s
# Warmup Iteration  18: 11.847 ops/s
# Warmup Iteration  19: 11.899 ops/s
# Warmup Iteration  20: 11.734 ops/s
Iteration   1: 11.802 ops/s
Iteration   2: 11.858 ops/s
Iteration   3: 11.688 ops/s
Iteration   4: 11.874 ops/s
Iteration   5: 11.923 ops/s
Iteration   6: 11.749 ops/s
Iteration   7: 11.711 ops/s
Iteration   8: 11.870 ops/s
Iteration   9: 11.842 ops/s
Iteration  10: 11.805 ops/s


Result "jvmscompare.benchmark.PersonCombinedSummaryStats.combinedStatistics_EC_Eager_Serial":
  11.800 ±(99.9%) 0.067 ops/s [Average]
  (min, avg, max) = (11.688, 11.800, 11.967), stdev = 0.077
  CI (99.9%): [11.732, 11.867] (assumes normal distribution)


# JMH version: 1.23
# VM version: JDK 11.0.6, anonymous, 11.0.6+1-LTS-jvmci-19.3-b07
# *** WARNING: This VM is not supported by JMH. The produced benchmark data can be completely wrong.
# VM invoker: /Library/Java/JavaVirtualMachines/graalvm-ee-java11-19.3.1/Contents/Home/bin/java
# VM options: -XX:+UnlockExperimentalVMOptions -XX:+EnableJVMCIProduct -XX:-UnlockExperimentalVMOptions -XX:+UnlockExperimentalVMOptions -XX:-UseJVMCICompiler -Xms1024m -Xmx1024m
# Warmup: 20 iterations, 10 s each
# Measurement: 10 iterations, 10 s each
# Timeout: 10 min per iteration
# Threads: 1 thread, will synchronize iterations
# Benchmark mode: Throughput, ops/time
# Benchmark: jvmscompare.benchmark.PersonCombinedSummaryStats.combinedStatistics_EC_Lazy_Serial

WARNING: Not a HotSpot compiler command compatible VM ("anonymous-11.0.6"), compilerHints are disabled.
# Run progress: 20.00% complete, ETA 00:40:17
# Fork: 1 of 2
# Warmup Iteration   1: 8.963 ops/s
# Warmup Iteration   2: 10.235 ops/s
# Warmup Iteration   3: 10.388 ops/s
# Warmup Iteration   4: 10.303 ops/s
# Warmup Iteration   5: 10.228 ops/s
# Warmup Iteration   6: 10.258 ops/s
# Warmup Iteration   7: 10.390 ops/s
# Warmup Iteration   8: 10.254 ops/s
# Warmup Iteration   9: 10.164 ops/s
# Warmup Iteration  10: 10.129 ops/s
# Warmup Iteration  11: 10.341 ops/s
# Warmup Iteration  12: 10.246 ops/s
# Warmup Iteration  13: 10.415 ops/s
# Warmup Iteration  14: 10.364 ops/s
# Warmup Iteration  15: 10.331 ops/s
# Warmup Iteration  16: 10.183 ops/s
# Warmup Iteration  17: 10.410 ops/s
# Warmup Iteration  18: 10.208 ops/s
# Warmup Iteration  19: 10.140 ops/s
# Warmup Iteration  20: 10.388 ops/s
Iteration   1: 10.246 ops/s
Iteration   2: 10.211 ops/s
Iteration   3: 10.382 ops/s
Iteration   4: 10.211 ops/s
Iteration   5: 10.311 ops/s
Iteration   6: 10.317 ops/s
Iteration   7: 10.308 ops/s
Iteration   8: 10.266 ops/s
Iteration   9: 10.392 ops/s
Iteration  10: 10.182 ops/s

WARNING: Not a HotSpot compiler command compatible VM ("anonymous-11.0.6"), compilerHints are disabled.
# Run progress: 30.00% complete, ETA 00:35:15
# Fork: 2 of 2
# Warmup Iteration   1: 9.077 ops/s
# Warmup Iteration   2: 10.517 ops/s
# Warmup Iteration   3: 10.760 ops/s
# Warmup Iteration   4: 10.510 ops/s
# Warmup Iteration   5: 10.505 ops/s
# Warmup Iteration   6: 10.578 ops/s
# Warmup Iteration   7: 10.624 ops/s
# Warmup Iteration   8: 10.654 ops/s
# Warmup Iteration   9: 10.526 ops/s
# Warmup Iteration  10: 10.529 ops/s
# Warmup Iteration  11: 10.516 ops/s
# Warmup Iteration  12: 10.625 ops/s
# Warmup Iteration  13: 10.488 ops/s
# Warmup Iteration  14: 10.563 ops/s
# Warmup Iteration  15: 10.522 ops/s
# Warmup Iteration  16: 10.417 ops/s
# Warmup Iteration  17: 10.489 ops/s
# Warmup Iteration  18: 10.495 ops/s
# Warmup Iteration  19: 10.496 ops/s
# Warmup Iteration  20: 10.564 ops/s
Iteration   1: 10.486 ops/s
Iteration   2: 10.611 ops/s
Iteration   3: 10.427 ops/s
Iteration   4: 10.716 ops/s
Iteration   5: 10.593 ops/s
Iteration   6: 10.481 ops/s
Iteration   7: 10.464 ops/s
Iteration   8: 10.740 ops/s
Iteration   9: 10.438 ops/s
Iteration  10: 10.454 ops/s


Result "jvmscompare.benchmark.PersonCombinedSummaryStats.combinedStatistics_EC_Lazy_Serial":
  10.412 ±(99.9%) 0.141 ops/s [Average]
  (min, avg, max) = (10.182, 10.412, 10.740), stdev = 0.162
  CI (99.9%): [10.271, 10.553] (assumes normal distribution)


# JMH version: 1.23
# VM version: JDK 11.0.6, anonymous, 11.0.6+1-LTS-jvmci-19.3-b07
# *** WARNING: This VM is not supported by JMH. The produced benchmark data can be completely wrong.
# VM invoker: /Library/Java/JavaVirtualMachines/graalvm-ee-java11-19.3.1/Contents/Home/bin/java
# VM options: -XX:+UnlockExperimentalVMOptions -XX:+EnableJVMCIProduct -XX:-UnlockExperimentalVMOptions -XX:+UnlockExperimentalVMOptions -XX:-UseJVMCICompiler -Xms1024m -Xmx1024m
# Warmup: 20 iterations, 10 s each
# Measurement: 10 iterations, 10 s each
# Timeout: 10 min per iteration
# Threads: 1 thread, will synchronize iterations
# Benchmark mode: Throughput, ops/time
# Benchmark: jvmscompare.benchmark.PersonCombinedSummaryStats.combinedStatistics_EC_Stream_Parallel

WARNING: Not a HotSpot compiler command compatible VM ("anonymous-11.0.6"), compilerHints are disabled.
# Run progress: 40.00% complete, ETA 00:30:13
# Fork: 1 of 2
# Warmup Iteration   1: 96.770 ops/s
# Warmup Iteration   2: 103.328 ops/s
# Warmup Iteration   3: 100.855 ops/s
# Warmup Iteration   4: 106.106 ops/s
# Warmup Iteration   5: 99.202 ops/s
# Warmup Iteration   6: 99.706 ops/s
# Warmup Iteration   7: 104.565 ops/s
# Warmup Iteration   8: 102.126 ops/s
# Warmup Iteration   9: 103.126 ops/s
# Warmup Iteration  10: 101.760 ops/s
# Warmup Iteration  11: 103.263 ops/s
# Warmup Iteration  12: 101.575 ops/s
# Warmup Iteration  13: 102.107 ops/s
# Warmup Iteration  14: 105.521 ops/s
# Warmup Iteration  15: 103.698 ops/s
# Warmup Iteration  16: 104.152 ops/s
# Warmup Iteration  17: 103.936 ops/s
# Warmup Iteration  18: 104.758 ops/s
# Warmup Iteration  19: 103.457 ops/s
# Warmup Iteration  20: 102.633 ops/s
Iteration   1: 107.220 ops/s
Iteration   2: 108.665 ops/s
Iteration   3: 106.355 ops/s
Iteration   4: 106.469 ops/s
Iteration   5: 100.972 ops/s
Iteration   6: 107.871 ops/s
Iteration   7: 102.923 ops/s
Iteration   8: 99.710 ops/s
Iteration   9: 100.986 ops/s
Iteration  10: 98.798 ops/s

WARNING: Not a HotSpot compiler command compatible VM ("anonymous-11.0.6"), compilerHints are disabled.
# Run progress: 50.00% complete, ETA 00:25:09
# Fork: 2 of 2
# Warmup Iteration   1: 98.048 ops/s
# Warmup Iteration   2: 103.540 ops/s
# Warmup Iteration   3: 103.887 ops/s
# Warmup Iteration   4: 102.026 ops/s
# Warmup Iteration   5: 105.713 ops/s
# Warmup Iteration   6: 98.988 ops/s
# Warmup Iteration   7: 101.910 ops/s
# Warmup Iteration   8: 94.240 ops/s
# Warmup Iteration   9: 99.654 ops/s
# Warmup Iteration  10: 95.211 ops/s
# Warmup Iteration  11: 97.943 ops/s
# Warmup Iteration  12: 96.004 ops/s
# Warmup Iteration  13: 99.135 ops/s
# Warmup Iteration  14: 94.514 ops/s
# Warmup Iteration  15: 102.053 ops/s
# Warmup Iteration  16: 93.943 ops/s
# Warmup Iteration  17: 100.256 ops/s
# Warmup Iteration  18: 94.483 ops/s
# Warmup Iteration  19: 109.866 ops/s
# Warmup Iteration  20: 111.397 ops/s
Iteration   1: 111.499 ops/s
Iteration   2: 111.230 ops/s
Iteration   3: 111.484 ops/s
Iteration   4: 111.385 ops/s
Iteration   5: 104.373 ops/s
Iteration   6: 105.900 ops/s
Iteration   7: 96.314 ops/s
Iteration   8: 93.931 ops/s
Iteration   9: 107.083 ops/s
Iteration  10: 105.055 ops/s


Result "jvmscompare.benchmark.PersonCombinedSummaryStats.combinedStatistics_EC_Stream_Parallel":
  104.911 ±(99.9%) 4.459 ops/s [Average]
  (min, avg, max) = (93.931, 104.911, 111.499), stdev = 5.135
  CI (99.9%): [100.452, 109.370] (assumes normal distribution)


# JMH version: 1.23
# VM version: JDK 11.0.6, anonymous, 11.0.6+1-LTS-jvmci-19.3-b07
# *** WARNING: This VM is not supported by JMH. The produced benchmark data can be completely wrong.
# VM invoker: /Library/Java/JavaVirtualMachines/graalvm-ee-java11-19.3.1/Contents/Home/bin/java
# VM options: -XX:+UnlockExperimentalVMOptions -XX:+EnableJVMCIProduct -XX:-UnlockExperimentalVMOptions -XX:+UnlockExperimentalVMOptions -XX:-UseJVMCICompiler -Xms1024m -Xmx1024m
# Warmup: 20 iterations, 10 s each
# Measurement: 10 iterations, 10 s each
# Timeout: 10 min per iteration
# Threads: 1 thread, will synchronize iterations
# Benchmark mode: Throughput, ops/time
# Benchmark: jvmscompare.benchmark.PersonCombinedSummaryStats.combinedStatistics_JDK_Stream_Parallel

WARNING: Not a HotSpot compiler command compatible VM ("anonymous-11.0.6"), compilerHints are disabled.
# Run progress: 60.00% complete, ETA 00:20:07
# Fork: 1 of 2
# Warmup Iteration   1: 83.069 ops/s
# Warmup Iteration   2: 96.753 ops/s
# Warmup Iteration   3: 98.631 ops/s
# Warmup Iteration   4: 96.620 ops/s
# Warmup Iteration   5: 99.913 ops/s
# Warmup Iteration   6: 100.248 ops/s
# Warmup Iteration   7: 102.030 ops/s
# Warmup Iteration   8: 98.232 ops/s
# Warmup Iteration   9: 101.835 ops/s
# Warmup Iteration  10: 99.906 ops/s
# Warmup Iteration  11: 96.318 ops/s
# Warmup Iteration  12: 96.292 ops/s
# Warmup Iteration  13: 94.925 ops/s
# Warmup Iteration  14: 97.332 ops/s
# Warmup Iteration  15: 96.891 ops/s
# Warmup Iteration  16: 96.904 ops/s
# Warmup Iteration  17: 101.713 ops/s
# Warmup Iteration  18: 98.836 ops/s
# Warmup Iteration  19: 92.010 ops/s
# Warmup Iteration  20: 100.085 ops/s
Iteration   1: 101.141 ops/s
Iteration   2: 96.717 ops/s
Iteration   3: 103.499 ops/s
Iteration   4: 102.367 ops/s
Iteration   5: 97.770 ops/s
Iteration   6: 100.990 ops/s
Iteration   7: 93.557 ops/s
Iteration   8: 100.664 ops/s
Iteration   9: 100.400 ops/s
Iteration  10: 100.414 ops/s

WARNING: Not a HotSpot compiler command compatible VM ("anonymous-11.0.6"), compilerHints are disabled.
# Run progress: 70.00% complete, ETA 00:15:05
# Fork: 2 of 2
# Warmup Iteration   1: 90.903 ops/s
# Warmup Iteration   2: 97.319 ops/s
# Warmup Iteration   3: 91.525 ops/s
# Warmup Iteration   4: 99.103 ops/s
# Warmup Iteration   5: 95.297 ops/s
# Warmup Iteration   6: 99.261 ops/s
# Warmup Iteration   7: 96.540 ops/s
# Warmup Iteration   8: 96.224 ops/s
# Warmup Iteration   9: 92.260 ops/s
# Warmup Iteration  10: 91.697 ops/s
# Warmup Iteration  11: 91.494 ops/s
# Warmup Iteration  12: 94.815 ops/s
# Warmup Iteration  13: 93.595 ops/s
# Warmup Iteration  14: 101.170 ops/s
# Warmup Iteration  15: 95.847 ops/s
# Warmup Iteration  16: 100.632 ops/s
# Warmup Iteration  17: 96.672 ops/s
# Warmup Iteration  18: 103.707 ops/s
# Warmup Iteration  19: 98.301 ops/s
# Warmup Iteration  20: 96.034 ops/s
Iteration   1: 96.082 ops/s
Iteration   2: 102.503 ops/s
Iteration   3: 93.575 ops/s
Iteration   4: 96.470 ops/s
Iteration   5: 99.980 ops/s
Iteration   6: 101.181 ops/s
Iteration   7: 98.680 ops/s
Iteration   8: 92.642 ops/s
Iteration   9: 95.267 ops/s
Iteration  10: 94.259 ops/s


Result "jvmscompare.benchmark.PersonCombinedSummaryStats.combinedStatistics_JDK_Stream_Parallel":
  98.408 ±(99.9%) 2.924 ops/s [Average]
  (min, avg, max) = (92.642, 98.408, 103.499), stdev = 3.367
  CI (99.9%): [95.484, 101.332] (assumes normal distribution)


# JMH version: 1.23
# VM version: JDK 11.0.6, anonymous, 11.0.6+1-LTS-jvmci-19.3-b07
# *** WARNING: This VM is not supported by JMH. The produced benchmark data can be completely wrong.
# VM invoker: /Library/Java/JavaVirtualMachines/graalvm-ee-java11-19.3.1/Contents/Home/bin/java
# VM options: -XX:+UnlockExperimentalVMOptions -XX:+EnableJVMCIProduct -XX:-UnlockExperimentalVMOptions -XX:+UnlockExperimentalVMOptions -XX:-UseJVMCICompiler -Xms1024m -Xmx1024m
# Warmup: 20 iterations, 10 s each
# Measurement: 10 iterations, 10 s each
# Timeout: 10 min per iteration
# Threads: 1 thread, will synchronize iterations
# Benchmark mode: Throughput, ops/time
# Benchmark: jvmscompare.benchmark.PersonCombinedSummaryStats.combinedStatistics_JDK_Stream_Serial

WARNING: Not a HotSpot compiler command compatible VM ("anonymous-11.0.6"), compilerHints are disabled.
# Run progress: 80.00% complete, ETA 00:10:03
# Fork: 1 of 2
# Warmup Iteration   1: 9.733 ops/s
# Warmup Iteration   2: 11.183 ops/s
# Warmup Iteration   3: 11.457 ops/s
# Warmup Iteration   4: 11.599 ops/s
# Warmup Iteration   5: 11.523 ops/s
# Warmup Iteration   6: 11.603 ops/s
# Warmup Iteration   7: 11.680 ops/s
# Warmup Iteration   8: 11.540 ops/s
# Warmup Iteration   9: 11.781 ops/s
# Warmup Iteration  10: 11.563 ops/s
# Warmup Iteration  11: 11.641 ops/s
# Warmup Iteration  12: 11.821 ops/s
# Warmup Iteration  13: 11.675 ops/s
# Warmup Iteration  14: 11.657 ops/s
# Warmup Iteration  15: 11.723 ops/s
# Warmup Iteration  16: 11.535 ops/s
# Warmup Iteration  17: 11.573 ops/s
# Warmup Iteration  18: 11.728 ops/s
# Warmup Iteration  19: 11.522 ops/s
# Warmup Iteration  20: 11.568 ops/s
Iteration   1: 11.573 ops/s
Iteration   2: 11.767 ops/s
Iteration   3: 11.519 ops/s
Iteration   4: 11.593 ops/s
Iteration   5: 11.641 ops/s
Iteration   6: 11.536 ops/s
Iteration   7: 11.527 ops/s
Iteration   8: 11.723 ops/s
Iteration   9: 11.554 ops/s
Iteration  10: 11.525 ops/s

WARNING: Not a HotSpot compiler command compatible VM ("anonymous-11.0.6"), compilerHints are disabled.
# Run progress: 90.00% complete, ETA 00:05:01
# Fork: 2 of 2
# Warmup Iteration   1: 10.643 ops/s
# Warmup Iteration   2: 11.634 ops/s
# Warmup Iteration   3: 11.540 ops/s
# Warmup Iteration   4: 11.741 ops/s
# Warmup Iteration   5: 11.482 ops/s
# Warmup Iteration   6: 11.576 ops/s
# Warmup Iteration   7: 11.623 ops/s
# Warmup Iteration   8: 11.531 ops/s
# Warmup Iteration   9: 11.518 ops/s
# Warmup Iteration  10: 11.556 ops/s
# Warmup Iteration  11: 11.676 ops/s
# Warmup Iteration  12: 11.582 ops/s
# Warmup Iteration  13: 11.510 ops/s
# Warmup Iteration  14: 11.643 ops/s
# Warmup Iteration  15: 11.685 ops/s
# Warmup Iteration  16: 11.605 ops/s
# Warmup Iteration  17: 11.784 ops/s
# Warmup Iteration  18: 11.640 ops/s
# Warmup Iteration  19: 11.662 ops/s
# Warmup Iteration  20: 11.766 ops/s
Iteration   1: 11.658 ops/s
Iteration   2: 11.734 ops/s
Iteration   3: 11.661 ops/s
Iteration   4: 11.539 ops/s
Iteration   5: 11.541 ops/s
Iteration   6: 11.595 ops/s
Iteration   7: 11.625 ops/s
Iteration   8: 11.606 ops/s
Iteration   9: 11.702 ops/s
Iteration  10: 11.683 ops/s


Result "jvmscompare.benchmark.PersonCombinedSummaryStats.combinedStatistics_JDK_Stream_Serial":
  11.615 ±(99.9%) 0.067 ops/s [Average]
  (min, avg, max) = (11.519, 11.615, 11.767), stdev = 0.078
  CI (99.9%): [11.548, 11.683] (assumes normal distribution)


# Run complete. Total time: 00:50:16

REMEMBER: The numbers below are just data. To gain reusable insights, you need to follow up on
why the numbers are the way they are. Use profilers (see -prof, -lprof), design factorial
experiments, perform baseline and negative tests that provide experimental control, make sure
the benchmarking environment is safe on JVM/OS/HW level, ask for reviews from the domain experts.
Do not assume the numbers tell you what you want them to tell.

Benchmark                                                           Mode  Cnt    Score   Error  Units
PersonCombinedSummaryStats.combinedStatistics_EC_Eager_Serial      thrpt   20   11.800 ± 0.067  ops/s
PersonCombinedSummaryStats.combinedStatistics_EC_Lazy_Serial       thrpt   20   10.412 ± 0.141  ops/s
PersonCombinedSummaryStats.combinedStatistics_EC_Stream_Parallel   thrpt   20  104.911 ± 4.459  ops/s
PersonCombinedSummaryStats.combinedStatistics_JDK_Stream_Parallel  thrpt   20   98.408 ± 2.924  ops/s
PersonCombinedSummaryStats.combinedStatistics_JDK_Stream_Serial    thrpt   20   11.615 ± 0.067  ops/s

Benchmark result is saved to benchmark-results/person-combined-summary-stats/08_GraalEEC2PersonCombinedSummaryStats.csv
[INFO] ------------------------------------------------------------------------
[INFO] BUILD SUCCESS
[INFO] ------------------------------------------------------------------------
[INFO] Total time:  50:29 min
[INFO] Finished at: 2020-02-08T03:58:49-05:00
[INFO] ------------------------------------------------------------------------
